asin,title,price,rating,reviews,countryOfOrigin,category1,bsr1,category2,bsr2,category3,bsr3,variations,sellers,fulfillment,revenue30d,unitSales30d,url,image,isPrime,isSponsored,pageNum,scrapedAt
"B06WWRCZXX","Queen Size 4 Piece Sheet Set - Comfy Breathable & Cooling Bed Sheets Set - Hotel Luxury Bedding for Women, Men, Kids, Teens, Boys & Girls - Deep Pockets, Soft and Wrinkle Free - Oeko-Tex - Dark Grey","$21.24","4.5","423819","","Home & Kitchen","1","Kids' Sheet & Pillowcase Sets","1","","","440","1","FBA","$8,111,476.61","272,453","https://www.amazon.com/dp/B06WWRCZXX","https://images-na.ssl-images-amazon.com/images/I/61f1FJiuShL._AC_UL600_SR600,400_.jpg","false","false","1","2026-02-01T17:43:31.937Z"
"B085DTZQNZ","Owala FreeSip Insulated Stainless Steel Water Bottle with Straw, BPA-Free Sports Water Bottle, Great for Travel, 24 Oz, Very, Very Dark | Insulated, with Straw, for Sports, Travel, and School, BPA-Free","$21.72","4.7","107332","","Kitchen & Dining","1","Travel & To-Go Drinkware","1","Insulated Bottles","1","62","3","AMZ","$20,277,141.68","638,010","https://www.amazon.com/dp/B085DTZQNZ","https://images-na.ssl-images-amazon.com/images/I/718RbhzhVbL._AC_UL600_SR600,400_.jpg","false","false","1","2026-02-01T17:43:31.937Z"
"B0C2C9NHZW","LEVOIT Top Fill Humidifiers for Bedroom, 2.5L Tank for Large Room, Easy to Fill & Clean, 28dB Quiet Cool Mist Air Humidifier for Home Baby Nursery & Plants, Auto Shut-off for Safety, 25H","$27.96","4.4","20115","","Home & Kitchen","3","Humidifiers","1","","","1","1","AMZ","$0.00","N/A","https://www.amazon.com/dp/B0C2C9NHZW","https://images-na.ssl-images-amazon.com/images/I/71xIgTqSN6L._AC_UL600_SR600,400_.jpg","false","false","1","2026-02-01T17:43:31.938Z"
"B0BQR2BQYZ","upsimples 11x14 Picture Frame, Display Pictures 8x10 with Mat or 11x14 Without Mat, Wall Hanging Photo Frame, Black, 1 Pack","$6.99","4.5","35299","","Home & Kitchen","4","Wall & Tabletop Picture Frames","1","","","203","1","FBA","$2,477,556.74","225,890","https://www.amazon.com/dp/B0BQR2BQYZ","https://images-na.ssl-images-amazon.com/images/I/71Si2QlAb3L._AC_UL600_SR600,400_.jpg","false","false","1","2026-02-01T17:43:31.938Z"
"B00FXNAAW2","Amazon Basics Slim, Velvet, Non-Slip Suit Clothes Hangers, Pack of 50, Black","$17.81","4.8","225118","","Home & Kitchen","5","Standard Hangers","1","","","17","1","AMZ","$3,893,651.76","191,090","https://www.amazon.com/dp/B00FXNAAW2","https://images-na.ssl-images-amazon.com/images/I/81Cn1+lUraL._AC_UL600_SR600,400_.jpg","false","false","1","2026-02-01T17:43:31.939Z"
"B07V6M3PDX","Amazon Basics Ceramic Space Heater, Portable Indoor Heating Solution, With Overheat and Tip-Over Protection, Thermostat, Non-Oscillating, 1500W, 7.52""D x 6.34""W x 9.45""H, Silver","$19.79","4.4","44527","","Home & Kitchen","6","Indoor Electric Space Heaters","1","","","4","1","AMZ","$2,820,931.26","130,822","https://www.amazon.com/dp/B07V6M3PDX","https://images-na.ssl-images-amazon.com/images/I/81LOT-SLKLL._AC_UL600_SR600,400_.jpg","false","false","1","2026-02-01T17:43:31.940Z"
"B08QRFZ6TH","Barossa Design Plastic Shower Liner Clear - Premium PEVA Shower Curtain Liner with Rustproof Grommets and 3 Magnets, Waterproof Cute Lightweight Standard Size Bathroom Curtains - Clear","$8.95","4.5","91664","","Home & Kitchen","7","Shower Curtain Liners","1","","","93","1","FBA","$1,574,826.21","150,444","https://www.amazon.com/dp/B08QRFZ6TH","https://images-na.ssl-images-amazon.com/images/I/7136-eapqKL._AC_UL600_SR600,400_.jpg","false","false","1","2026-02-01T17:43:31.940Z"
"B01LYNW421","Beckham Hotel Collection Bed Pillows Standard/Queen Size Set of 2 - Original Soft Down Alternative Pillow for Sleeping - Soft Support for Back, Stomach or Side Sleepers","$41.98","4.3","257751","","Home & Kitchen","8","Bed Pillows","1","","","3","2","FBA","$4,334,753.56","85,298","https://www.amazon.com/dp/B01LYNW421","https://images-na.ssl-images-amazon.com/images/I/71329CVoVDL._AC_UL600_SR600,400_.jpg","false","false","1","2026-02-01T17:43:31.941Z"
"B0CFGYFCYL","OLANLY Bathroom Rugs 30x20, Extra Soft Absorbent Chenille Bath Rugs, Rubber Backing Quick Dry, Machine Washable Bath Mats for Bathroom Floor, Tub and Shower, Home Decor Accessories, Grey","$9.47","4.4","37236","","Home & Kitchen","9","Bath Rugs","1","","","525","2","FBA","$3,293,289.17","150,721","https://www.amazon.com/dp/B0CFGYFCYL","https://images-na.ssl-images-amazon.com/images/I/914ufIDbM1L._AC_UL600_SR600,400_.jpg","false","false","1","2026-02-01T17:43:31.942Z"
"B0113UZJE2","Etekcity Food Kitchen Scale, Digital Grams and Ounces for Weight Loss, Baking, Cooking, Keto and Meal Prep, LCD Display, Medium, 304 Stainless Steel","$6.92","4.6","172151","","Kitchen & Dining","2","Digital Kitchen Scales","1","","","13","1","AMZ","$1,755,290.35","88,166","https://www.amazon.com/dp/B0113UZJE2","https://images-na.ssl-images-amazon.com/images/I/91YrLTBnMcL._AC_UL600_SR600,400_.jpg","false","false","1","2026-02-01T17:43:31.942Z"
"B00NX0WXQI","Utopia Bedding Queen Size Sheet Set – 4 Piece Bed Sheets, Soft and Breathable Microfiber, Includes 1 Fitted Sheet, 1 Flat Sheet and 2 Pillowcases – Oeko Tex (Grey)","$14.99","4.6","230999","","Home & Kitchen","11","Sheet & Pillowcase Sets","1","","","151","2","FBA","$2,052,168.71","97,253","https://www.amazon.com/dp/B00NX0WXQI","https://images-na.ssl-images-amazon.com/images/I/71JAtSHx8iL._AC_UL600_SR600,400_.jpg","false","false","1","2026-02-01T17:43:31.943Z"
"B0DR9MZ563","STANLEY Quencher H2.0 Tumbler with Handle and Straw 40 oz | Flowstate 3-Position Lid | Cup Holder Compatible for Travel | Insulated Stainless Steel Cup | BPA-Free | Hot Coral","$21.38","4.7","92385","","Kitchen & Dining","3","Insulated Tumblers","1","","","154","4","AMZ","$10,910,781.39","284,522","https://www.amazon.com/dp/B0DR9MZ563","https://images-na.ssl-images-amazon.com/images/I/516+r63M1IL._AC_UL600_SR600,400_.jpg","false","false","1","2026-02-01T17:43:31.943Z"
"B0C6FCKQML","DREO Space Heater, Portable Electric Heaters for Indoor Use with Thermostat and Remote, 2024 Upgraded, Digital Display, 12H Timer, 5 Mode, 1500W PTC Ceramic Fast Safety Heat for Office Bedroom Home","$39.99","4.6","17765","","Home & Kitchen","13","Indoor Electric Space Heaters","2","","","5","1","AMZ","$5,233,976.35","133,289","https://www.amazon.com/dp/B0C6FCKQML","https://images-na.ssl-images-amazon.com/images/I/81Ha7nqu+bL._AC_UL600_SR600,400_.jpg","false","false","1","2026-02-01T17:43:31.944Z"
"B0DLMX1GP9","2 Pack Red Tinsel Backdrop, 3.28 FT x 7.05 FT Fringe Curtains, Red Foil Tinsel Party Streamer Backdrop Curtains for Valentines Day, Wedding Photo Backdrop Party Decorations for Wedding Anniversaries","$5.98","4.6","2042","","Home & Kitchen","14","Party Streamers","1","Photographic Studio Photo Backgrounds","1","75","1","FBA","$572,231.91","75,076","https://www.amazon.com/dp/B0DLMX1GP9","https://images-na.ssl-images-amazon.com/images/I/91vmrxKq01L._AC_UL600_SR600,400_.jpg","false","false","1","2026-02-01T17:43:31.945Z"
"B09D8T11YS","Zulay Original Milk Frother Handheld Foam Maker for Lattes - Whisk Drink Mixer for Coffee, Mini Foamer for Cappuccino, Frappe, Matcha, Hot Chocolate by Milk Boss (Black)","$14.99","4.3","320917","","Home & Kitchen","15","Milk Frothers","1","","","210","1","FBA","$1,873,639.06","129,773","https://www.amazon.com/dp/B09D8T11YS","https://images-na.ssl-images-amazon.com/images/I/811-tPSBMML._AC_UL600_SR600,400_.jpg","false","false","1","2026-02-01T17:43:31.946Z"
"B0725WFLMB","Bedsure Satin Pillowcase, Similar to Silk Pillow Cases Queen Size Set of 2, Cooling Pillow Case Covers with Envelope Closure, Room Decor Valentine Gifts for Women Men, Silver Grey, 20x30 Inches, 2pcs","$5.98","4.5","314495","","Home & Kitchen","16","Bed Pillow Pillowcases","1","","","120","1","FBA","$1,297,136.32","139,472","https://www.amazon.com/dp/B0725WFLMB","https://images-na.ssl-images-amazon.com/images/I/71lChEqublL._AC_UL600_SR600,400_.jpg","false","false","1","2026-02-01T17:43:31.946Z"
"B06X9NQ8GX","Amazon Basics Digital Kitchen Scale with LCD Display, Batteries Included, Weighs up to 11 pounds, Black and Stainless Steel","$8.99","4.7","111588","","Kitchen & Dining","4","Digital Kitchen Scales","2","","","1","1","AMZ","$958,801.60","105,480","https://www.amazon.com/dp/B06X9NQ8GX","https://images-na.ssl-images-amazon.com/images/I/71eiII6MS-L._AC_UL600_SR600,400_.jpg","false","false","1","2026-02-01T17:43:31.947Z"
"B01NBNDC1T","Utopia Bedding 18x18 Pillow Inserts, Set of 2, White – Indoor Decorative Throw Pillows for Bed, Sofa & Couch – Soft, Supportive & Fluffy Cushion Inserts","$16.89","4.6","213981","","Home & Kitchen","18","Throw Pillow Inserts","1","","","34","1","FBA","$2,059,809.48","102,869","https://www.amazon.com/dp/B01NBNDC1T","https://images-na.ssl-images-amazon.com/images/I/619C-vVJjdL._AC_UL600_SR600,400_.jpg","false","false","1","2026-02-01T17:43:31.948Z"
"B0F5X4FM3Q","0.5 Sec Instant Read Meat Thermometer Digital with ±0.5℉ Precision, Food Thermometer for Cooking Kitchen Gadgets, Oven Grill Candy BBQ Essentials Accessories, Gifts for Him Dad Men Birthday, Red","$9.99","4.8","3919","","Kitchen & Dining","5","Instant-Read Thermometers & Timers","1","","","6","1","FBA","$1,293,478.05","111,146","https://www.amazon.com/dp/B0F5X4FM3Q","https://images-na.ssl-images-amazon.com/images/I/61is4F1PDOL._AC_UL600_SR600,400_.jpg","false","false","1","2026-02-01T17:43:31.949Z"
"B00MRH9NCK","Twin Size Mattress Protector Waterproof, Premium 200 GSM Terry Mattress Cover, Soft & Breathable Bed Cover, Fitted Sheet Style Stretchable Deep Pockets 15"" by Utopia Bedding (White)","$12.34","4.6","96911","","Home & Kitchen","20","Mattress Protectors","1","","","47","3","FBA","$1,456,815.56","83,725","https://www.amazon.com/dp/B00MRH9NCK","https://images-na.ssl-images-amazon.com/images/I/81tHpdEj26L._AC_UL600_SR600,400_.jpg","false","false","1","2026-02-01T17:43:31.950Z"
"B0DF472VMZ","Owala SmoothSip Slider Insulated Stainless Steel Coffee Tumbler, Reusable Iced Coffee Cup, Hot Coffee Travel Mug, BPA Free 12 oz, Vanilla Bean","$23.50","4.6","9433","","Kitchen & Dining","6","Insulated Tumblers","2","","","34","1","AMZ","$4,545,720.94","161,601","https://www.amazon.com/dp/B0DF472VMZ","https://images-na.ssl-images-amazon.com/images/I/311JdFvhtVL._AC_UL600_SR600,400_.jpg","false","false","1","2026-02-01T17:43:31.950Z"
"B000TTSXNI","Lasko 1500W Ceramic Tower Space Heater with Remote, Thermostat, Timer & Widespread Oscillation, Portable Electric Heater for Indoor Use, Bedroom & Living Room, 751320","$76.95","4.4","39774","","Home & Kitchen","22","Indoor Electric Space Heaters","3","","","1","4","AMZ","$4,136,266.13","66,781","https://www.amazon.com/dp/B000TTSXNI","https://images-na.ssl-images-amazon.com/images/I/71wLH8DIhhL._AC_UL600_SR600,400_.jpg","false","false","1","2026-02-01T17:43:31.951Z"
"B0C1NNYJGB","BEDLORE Waterproof Mattress Protector, Queen Size Mattress Pad Noiseless with Deep Pocket 6""-18"" Depth, Soft Breathable Dirt-Proof Bed Mattress Cover Washable for Home, Bedroom, Hotel (Gray)","$28.21","4.6","14184","","Home & Kitchen","23","Mattress Protectors","2","","","42","1","FBA","$3,590,670.38","130,013","https://www.amazon.com/dp/B0C1NNYJGB","https://images-na.ssl-images-amazon.com/images/I/71+omVwPiXL._AC_UL600_SR600,400_.jpg","false","false","1","2026-02-01T17:43:31.952Z"
"B074MX8VN5","Amazon Basics Ceramic Space Heater, Mini Heater for Office Desk, Portable Tent Heater (Indoor Use), 500 W, With Tip-Over Protection, Lightweight (1.4 LBS), Black, 5.87”D x 3.15”W x 5.95”H","$14.99","4.4","37945","","Home & Kitchen","24","Indoor Electric Space Heaters","4","","","4","1","AMZ","$735,888.52","46,475","https://www.amazon.com/dp/B074MX8VN5","https://images-na.ssl-images-amazon.com/images/I/81YKI0L2gZL._AC_UL600_SR600,400_.jpg","false","false","1","2026-02-01T17:43:31.953Z"
"B0973DGD8P","Cozy Essential 20 Pack Vacuum Storage Bags, Space Saver Bags (4 Jumbo/4 Large/4 Medium/4 Small/4 Roll) Compression for Comforters and Blankets, Pillow, Bedding, Sealer Clothes Storage","$24.99","4.3","82650","","Home & Kitchen","25","Space Saver Bags","1","","","26","2","FBA","$1,115,549.10","41,156","https://www.amazon.com/dp/B0973DGD8P","https://images-na.ssl-images-amazon.com/images/I/81JmVgvOmCL._AC_UL600_SR600,400_.jpg","false","false","1","2026-02-01T17:43:31.954Z"
"B0CCY6VG8Z","Dreo Humidifiers for Bedroom, 4L Top Fill for Large Room, 36H Runtime, 28 dB Quiet Supersized Cool Mist Air Humidifier for Baby Nursery, Plants, Indoor, Night Light, Easy to Clean & Fill, White","$33.97","4.4","11906","","Home & Kitchen","26","Humidifiers","2","","","1","1","AMZ","$210,850.96","6,207","https://www.amazon.com/dp/B0CCY6VG8Z","https://images-na.ssl-images-amazon.com/images/I/61-VUNgNlBL._AC_UL600_SR600,400_.jpg","false","false","1","2026-02-01T17:43:31.954Z"
"B08NJ6VF9T","Mrs Awesome Clear Shower Curtain Liner with 3 Magnets, 72x72 Premium Flexible Sturdy Plastic Shower Curtain for Bathroom Lightweight, Waterproof, Clear","$5.98","4.5","29412","","Home & Kitchen","27","Shower Curtain Liners","2","","","53","1","FBA","$557,575.69","69,129","https://www.amazon.com/dp/B08NJ6VF9T","https://images-na.ssl-images-amazon.com/images/I/71V7L0wjQ-L._AC_UL600_SR600,400_.jpg","false","false","1","2026-02-01T17:43:31.955Z"
"B07W4SN7N7","GiveBest Portable Electric Space Heater with Thermostat, 1500W/750W Safe and Quiet Ceramic Heater Fan, Heat Up 200 Square Feet for Office Room Desk Indoor Use, Silver","$29.99","4.4","93961","","Home & Kitchen","28","Indoor Electric Space Heaters","5","","","5","6","FBA","$2,160,328.15","68,858","https://www.amazon.com/dp/B07W4SN7N7","https://images-na.ssl-images-amazon.com/images/I/9103N74QllL._AC_UL600_SR600,400_.jpg","false","false","1","2026-02-01T17:43:31.956Z"
"B00LS9UD2M","LiBa Bathroom Shower Curtain Waterproof Plastic Shower Curtain Premium PEVA Non-Toxic with Rust Proof Grommets Clear 8G Bathroom Accessories 72x72","$8.59","4.5","254695","","Home & Kitchen","29","Shower Curtains","1","","","35","4","FBA","$933,523.15","81,105","https://www.amazon.com/dp/B00LS9UD2M","https://images-na.ssl-images-amazon.com/images/I/7170px9vGUL._AC_UL600_SR600,400_.jpg","false","false","1","2026-02-01T17:43:31.957Z"
"B07D5DN269","NIAGARA Ultra Soft Queen Size Mattress Topper - Viscose Made from Bamboo Pillow Top Mattress Pad for Back Pain Relief - Naturally Cooling for Hot Sleepers, Green","$44.99","4.4","42434","","Home & Kitchen","30","Mattresses Toppers","1","","","38","1","FBA","$3,884,288.47","83,487","https://www.amazon.com/dp/B07D5DN269","https://images-na.ssl-images-amazon.com/images/I/716vPNP9ErL._AC_UL600_SR600,400_.jpg","false","false","1","2026-02-01T17:43:31.958Z"
"B01IE7P2VW","Utopia Bedding Queen Fitted Sheet - Bottom Sheet - Deep Pocket - Soft Microfiber - Shrinkage and Fade Resistant - Easy Care -1 Fitted Sheet Only (Grey)","$9.99","4.6","122107","","Home & Kitchen","31","Fitted Bed Sheets","1","","","87","2","FBA","$819,635.84","62,948","https://www.amazon.com/dp/B01IE7P2VW","https://images-na.ssl-images-amazon.com/images/I/71fPBZKJjyL._AC_UL300_SR300,200_.jpg","false","false","1","2026-02-01T17:43:31.959Z"
"B088BZTYFP","Amazon Basics 16x20x1 Air Filter 6 Pack, MERV 8 AC Furnace Filters (Actual Size: 15.75"" x 19.75"" x 0.75"")","$27.87","4.6","13239","","Home & Kitchen","32","Air Conditioner Replacement Filters","1","","","21","1","AMZ","$1,059,580.31","35,915","https://www.amazon.com/dp/B088BZTYFP","https://images-na.ssl-images-amazon.com/images/I/71KuGgYip5L._AC_UL300_SR300,200_.jpg","false","false","1","2026-02-01T17:43:31.960Z"
"B00LHE5OSQ","Wagner's 53002 Farmer's Delight Wild Bird Food with Cherry Flavor, 10-Pound Bag","$12.48","4.5","18218","","Patio, Lawn & Garden","1","Bird Seed","1","","","2","2","AMZ","$544,843.42","43,657","https://www.amazon.com/dp/B00LHE5OSQ","https://images-na.ssl-images-amazon.com/images/I/81gIvBzsnaL._AC_UL300_SR300,200_.jpg","false","false","1","2026-02-01T17:43:31.961Z"
"B0CP4XY9QC","YARRAMATE 16oz/470ml Glass Olive Oil Sprayer for Cooking with Stickers, 2 in 1 Oil Dispenser for Kitchen Gadgets, Food Grade Premium Spray Bottle with Portion Control for Salad, Frying, BBQ (Black)","$8.99","4.4","37253","","Kitchen & Dining","7","Oil Dispensing Bottles","1","","","23","2","FBA","$722,794.67","74,120","https://www.amazon.com/dp/B0CP4XY9QC","https://images-na.ssl-images-amazon.com/images/I/71ZjnwrH7iL._AC_UL300_SR300,200_.jpg","false","false","1","2026-02-01T17:43:31.962Z"
"B08DTH86Q2","Utopia Bedding Bed Pillows for Sleeping Queen Size (White), Set of 2, Soft & Fluffy Pillow with Down Alternative Filling, Cooling, Hotel Quality, Gusseted Pillow for Back, Stomach or Side Sleepers","$18.59","4.5","74058","","Home & Kitchen","35","Bed Pillows","2","","","13","2","FBA","$3,028,144.18","101,446","https://www.amazon.com/dp/B08DTH86Q2","https://images-na.ssl-images-amazon.com/images/I/61xfSz+1KOL._AC_UL300_SR300,200_.jpg","false","false","1","2026-02-01T17:43:31.963Z"
"B0D5RMVMWF","AirScent Ritzy Hotel Fragrance Oil No. 1014 - The Iconic 5-Star Hotel Coastal Blend - Lemon Bergamot Sea Breeze - 10 mL Hotel Diffuser Oil for Ultrasonic and Waterless Diffusers and Crafting","$9.99","4.4","7673","","Home & Kitchen","36","Reed Diffuser Oils","1","","","4","2","FBA","$1,004,747.40","50,477","https://www.amazon.com/dp/B0D5RMVMWF","https://images-na.ssl-images-amazon.com/images/I/61xfmWK+5CL._AC_UL300_SR300,200_.jpg","false","false","1","2026-02-01T17:43:31.964Z"
"B0C4Z6SKCS","Amazon Basics Basket Coffee Filters for 8-12 Cup Coffee Makers, White, 200 Count","$2.55","4.8","19829","","Home & Kitchen","37","Disposable Coffee Filters","1","","","2","1","AMZ","$83,407.01","33,901","https://www.amazon.com/dp/B0C4Z6SKCS","https://images-na.ssl-images-amazon.com/images/I/61pVQ0ca4zL._AC_UL300_SR300,200_.jpg","false","false","1","2026-02-01T17:43:31.965Z"
"B0B8VQLN6Y","NEW JETO Metal Bed Frame,Queen Size Bed Frame with Storage Space,Heavy Duty Sturdy Mattress Foundation,Easy Assembly,No Box Spring Needed, Black,14 Inch,Queen","$52.99","4.6","25796","","Home & Kitchen","38","Bed Frames","1","","","16","1","FBA","$4,496,953.57","82,663","https://www.amazon.com/dp/B0B8VQLN6Y","https://images-na.ssl-images-amazon.com/images/I/61AYTycliAL._AC_UL300_SR300,200_.jpg","false","false","1","2026-02-01T17:43:31.966Z"
"B0016HF5GK","BISSELL Little Green Multi-Purpose Portable Carpet and Upholstery Cleaner, Car and Auto Detailer, with Exclusive Specialty Tools, Green, 1400B","$109.99","4.5","109190","","Home & Kitchen","39","Carpet & Upholstery Cleaning Machines","1","","","5","1","AMZ","$1,881,102.73","18,191","https://www.amazon.com/dp/B0016HF5GK","https://images-na.ssl-images-amazon.com/images/I/717X5secGjL._AC_UL300_SR300,200_.jpg","false","false","1","2026-02-01T17:43:31.967Z"
"B08KXKVT4K","Vtopmart 25 PCS Clear Plastic Drawer Organizers Set, 4-Size Versatile Bathroom and Vanity Drawer Organizer Trays, Storage Bins for Makeup, Bedroom, Kitchen Gadgets Utensils and Office","$16.14","4.7","40036","","Home & Kitchen","40","Clothes Drawer Organizers","1","","","8","4","FBA","$1,737,166.60","94,225","https://www.amazon.com/dp/B08KXKVT4K","https://images-na.ssl-images-amazon.com/images/I/81yj+PUYVxL._AC_UL300_SR300,200_.jpg","false","false","1","2026-02-01T17:43:31.968Z"
"B0BWR49R77","2 Pack Foil Curtain Backdrop Silver Metallic Tinsel Foil Fringe Curtains Photo Booth Props for Birthday Wedding Engagement Baby Shower Bachelorette Christmas Holiday Celebration Party Decorations","$5.97","4.4","9387","","Home & Kitchen","41","Party Streamers","2","Photographic Studio Photo Backgrounds","2","61","2","FBA","$591,051.29","65,595","https://www.amazon.com/dp/B0BWR49R77","https://images-na.ssl-images-amazon.com/images/I/8187pIJ2dDL._AC_UL300_SR300,200_.jpg","false","false","1","2026-02-01T17:43:31.969Z"
"B0CQY6MPNG","PetOde 2 Pieces Dryer Vent Cleaner Kit Compatible with Most Vacuum Cleaner, Dryer Lint Brush and Vacuum Hose Attachment with Universal Connector, Quickly Lint Remover","$11.79","4.5","11311","","Home & Kitchen","42","Vacuum Attachments","1","","","3","2","FBA","$220,025.16","17,528","https://www.amazon.com/dp/B0CQY6MPNG","https://images-na.ssl-images-amazon.com/images/I/71IY72tUuJL._AC_UL300_SR300,200_.jpg","false","false","1","2026-02-01T17:43:31.970Z"
"B0G67WTZQR","STANLEY Quencher ProTour Flip Straw Tumbler with Leakproof Lid | Built-In Straw & Handle | Cupholder Compatible for Travel | Insulated Stainless Steel Cup | BPA-Free","","4.7","12858","","Kitchen & Dining","8","Insulated Tumblers","3","","","77","1","AMZ","$6,172,665.00","166,309","https://www.amazon.com/dp/B0G67WTZQR","https://images-na.ssl-images-amazon.com/images/I/61oLestaUpL._AC_UL300_SR300,200_.jpg","false","false","1","2026-02-01T17:43:31.971Z"
"B0CJF94M8J","TrendPlain 16oz/470ml Glass Olive Oil Sprayer for Cooking – 2 in 1 Olive Oil Dispenser Bottle for Kitchen Gadgets and Air Fryer Accessories, Salad, BBQ - Black","$8.99","4.5","30717","","Kitchen & Dining","9","Oil Dispensing Oil Sprayers","1","","","16","1","FBA","$776,208.05","81,557","https://www.amazon.com/dp/B0CJF94M8J","https://images-na.ssl-images-amazon.com/images/I/71fHCOxxqXL._AC_UL300_SR300,200_.jpg","false","false","1","2026-02-01T17:43:31.972Z"
"B093D7Y3F2","EHZNZIE Clear Shower Curtain Liner Light Weight PEVA, Shower Liner 72x72 Inches, Waterproof, No Chemical Smell with 12 Rust Proof Metal Grommets Holes for Bathroom Shower Curtain","$4.14","4.5","22802","","Home & Kitchen","45","Shower Curtain Liners","3","","","31","1","FBA","$507,439.40","91,882","https://www.amazon.com/dp/B093D7Y3F2","https://images-na.ssl-images-amazon.com/images/I/710Od6JMBRL._AC_UL300_SR300,200_.jpg","false","false","1","2026-02-01T17:43:31.974Z"
"B073H8STZ7","Utopia Bedding Fleece Blanket Queen Size Grey (90x90 Inches) Ultra Soft Warm Lightweight Microfiber Breathable Anti-Static Cozy Winter Bed Blanket, All-Season Home Decor Gift for Men & Women","$19.99","4.5","88119","","Home & Kitchen","46","Bed Blankets","1","","","91","1","FBA","$1,221,602.01","61,694","https://www.amazon.com/dp/B073H8STZ7","https://images-na.ssl-images-amazon.com/images/I/81GmI6IgW4L._AC_UL300_SR300,200_.jpg","false","false","1","2026-02-01T17:43:31.975Z"
"B082KP92DF","AmazerBath Shower Curtain Liner, 72x72 Clear Shower Curtain Liner, Waterproof Plastic Shower Liner, Cute Lightweight PEVA Shower Curtain for Bathroom with 3 Magnets and 12 Rustproof Metal Grommets","$6.99","4.4","64352","","Home & Kitchen","47","Shower Curtain Liners","4","","","40","1","FBA","$484,723.57","56,557","https://www.amazon.com/dp/B082KP92DF","https://images-na.ssl-images-amazon.com/images/I/71qiW-RP39L._AC_UL300_SR300,200_.jpg","false","false","1","2026-02-01T17:43:31.976Z"
"B0FLXY2CBC","8 Blade All-in-1 Vegetable Chopper Mandoline Slicer with Container, Food Chopper, Onion Chopper, Veggie Cutter for Salad, Kitchen Gadgets Accessories Essentials, White","$16.99","4.5","478","","Kitchen & Dining","10","Seasoning & Spice Choppers","1","","","4","1","FBA","$285,087.72","14,352","https://www.amazon.com/dp/B0FLXY2CBC","https://images-na.ssl-images-amazon.com/images/I/71Qj8BrJQtL._AC_UL300_SR300,200_.jpg","false","false","1","2026-02-01T17:43:31.977Z"
"B0BWT84GZ7","OLANLY Dog Door Mat for Muddy Paws 30x20, Absorbs Moisture and Dirt, Absorbent Non-Slip Washable Doormat, Quick Dry Chenille Mud Mat for Dogs, Entry Indoor Entryway Carpet for Inside Floor, Grey","$9.49","4.5","18898","","Patio, Lawn & Garden","2","Outdoor Doormats","1","","","911","1","FBA","$1,382,079.59","54,947","https://www.amazon.com/dp/B0BWT84GZ7","https://images-na.ssl-images-amazon.com/images/I/9102+B7xv+L._AC_UL300_SR300,200_.jpg","false","false","1","2026-02-01T17:43:31.978Z"
"B0DNS9R88M","Trade Grade Pet-Friendly Ice Melt - Fast Acting Magnesium Chloride Formula, Safer for Pets & Surfaces, 15lb Bucket","$45.98","4.0","961","","Patio, Lawn & Garden","3","Snow & Ice Melters","1","","","3","1","MERCH","$664,913.36","12,645","https://www.amazon.com/dp/B0DNS9R88M","https://images-na.ssl-images-amazon.com/images/I/819u9pXzc5L._AC_UL300_SR300,200_.jpg","false","false","1","2026-02-01T17:43:31.980Z"
"B08BZFRQLS","ALYVIA SPRING Waterproof Fabric Shower Curtain Liner with 3 Magnets - Soft Hotel Quality Cloth Shower Liner, Light-Weight & Machine Washable - Standard Size 72x72, White","$9.98","4.5","56783","","Home & Kitchen","51","Shower Curtain Liners","5","","","86","1","FBA","$746,534.68","61,631","https://www.amazon.com/dp/B08BZFRQLS","https://images-na.ssl-images-amazon.com/images/I/61S1tvRFMML._AC_UL600_SR600,400_.jpg","false","false","1","2026-02-01T17:44:51.063Z"
"B00E4GACB8","TERRO Ant Killer Bait Stations T300B - Liquid Bait to Eliminate Ants - Bait System - 12 Count Stations for Effective Indoor Ant Control","$11.97","4.6","145225","","Patio, Lawn & Garden","4","Pest Control Baits & Lures","1","","","1","8","AMZ","$615,331.00","53,230","https://www.amazon.com/dp/B00E4GACB8","https://images-na.ssl-images-amazon.com/images/I/81CRcsNV1+L._AC_UL600_SR600,400_.jpg","false","false","1","2026-02-01T17:44:51.064Z"
"B0714K41PB","Utopia Bedding Throw Pillows (Set of 4, White) – 18 x 18 Inches Down Alternative Pillows for Bed, Sofa, and Couch - Fluffy Decorative Stuffer Pillow for Indoors & Outdoors","$16.89","4.6","123093","","Home & Kitchen","53","Throw Pillows","1","","","31","1","FBA","$1,914,501.86","77,366","https://www.amazon.com/dp/B0714K41PB","https://images-na.ssl-images-amazon.com/images/I/71J8HPDimhL._AC_UL600_SR600,400_.jpg","false","false","1","2026-02-01T17:44:51.064Z"
