asin,title,price,rating,reviews,countryOfOrigin,category1,bsr1,category2,bsr2,category3,bsr3,variations,sellers,fulfillment,revenue30d,unitSales30d,url,image,isPrime,isSponsored,pageNum,scrapedAt
"B07P5K7DQP","Pure Encapsulations Magnesium (Glycinate) - Supplement to Support Stress Relief, Sleep, Heart Health, Nerves, Muscles, and Metabolism* - with Magnesium Glycinate - 90 Capsules","$26.00","4.6","44995","","Health & Household","16","Magnesium Mineral Supplements","1","","","3","1","FBA","$8,818,105.81","239,308","https://www.amazon.com/dp/B07P5K7DQP","https://images-na.ssl-images-amazon.com/images/I/71xzWlvjHAL._AC_UL600_SR600,400_.jpg","false","false","1","2026-02-22T11:30:54.621Z"
"B0B6CTYD6S","Magnesium Glycinate 400mg | 180 Capsules | Sleep, Muscle, & Heart Support | Vegan, Third Party Tested, Gluten Free, Non-GMO, by Double Wood Supplements","$16.95","4.6","19304","","Health & Household","100","Magnesium Mineral Supplements","2","","","2","3","FBA","$2,060,010.87","131,293","https://www.amazon.com/dp/B0B6CTYD6S","https://images-na.ssl-images-amazon.com/images/I/61fmgFB1-KL._AC_UL600_SR600,400_.jpg","false","false","1","2026-02-22T11:30:54.621Z"
"B08WPLW4VN","BIOptimizers Magnesium Breakthrough Supplement with 500mg - 7 Forms of Magnesium: Glycinate, Malate, Citrate, and More - Natural Support for Sleep and Cognitive Function -60 Capsules- Calming Vitamins","$39.95","4.6","16539","","Health & Household","111","Magnesium Mineral Supplements","3","","","3","4","FBA","$4,477,421.49","128,206","https://www.amazon.com/dp/B08WPLW4VN","https://images-na.ssl-images-amazon.com/images/I/71wVwMsV58L._AC_UL600_SR600,400_.jpg","false","false","1","2026-02-22T11:30:54.622Z"
"B08XXHCGZT","Nature Made Magnesium Glycinate 200 mg per Serving, Magnesium Supplement for Muscle, Heart, Nerve and Bone Support, 60 Magnesium Bisglycinate Capsules, 30 Day Supply","$16.50","4.6","19934","","Health & Household","131","Magnesium Mineral Supplements","4","","","2","20","AMZ","$1,660,766.69","90,374","https://www.amazon.com/dp/B08XXHCGZT","https://images-na.ssl-images-amazon.com/images/I/711zilbEUGL._AC_UL600_SR600,400_.jpg","false","false","1","2026-02-22T11:30:54.622Z"
"B006P536E6","Life Extension Neuro-Mag Magnesium L-Threonate, Memory Health, Quick Thinking, Cognitive Health Support, Vegetarian, Non-GMO, 90 Vegetarian Capsules (144 mg from 2000 mg Magtein magnesium L-threonate","$31.50","4.6","23296","","Health & Household","147","Magnesium Mineral Supplements","5","Diet & Sports Nutrition","17","1","5","AMZ","$2,996,034.64","101,057","https://www.amazon.com/dp/B006P536E6","https://images-na.ssl-images-amazon.com/images/I/71ZkI71L96L._AC_UL600_SR600,400_.jpg","false","false","1","2026-02-22T11:30:54.623Z"
"B07TNJRN9N","BioEmblem Triple Magnesium Complex | 300mg Magnesium Glycinate, Malate & Citrate | High Absorption Chelated Formula | Vegan, Non-GMO, Gluten-Free | 90 Capsules","$27.99","4.6","30191","","Health & Household","212","Magnesium Mineral Supplements","6","","","1","3","FBA","$2,157,248.68","86,014","https://www.amazon.com/dp/B07TNJRN9N","https://images-na.ssl-images-amazon.com/images/I/71MnMgRtSBL._AC_UL600_SR600,400_.jpg","false","false","1","2026-02-22T11:30:54.623Z"
"B00H5PJ0HW","Nature's Bounty Magnesium 500 mg Tablets, High Potency Magnesium Supplement for Bone & Muscle Health, Whole Body Support, 200 Count (Pack of 1)","$11.89","4.7","101581","","Health & Household","226","Magnesium Mineral Supplements","7","Sales & Deals","27","3","9","AMZ","$1,089,497.87","83,295","https://www.amazon.com/dp/B00H5PJ0HW","https://images-na.ssl-images-amazon.com/images/I/71+s3D0i-JL._AC_UL600_SR600,400_.jpg","false","false","1","2026-02-22T11:30:54.624Z"
"B000BD0RT0","Doctor's Best High Absorption Magnesium Glycinate Lysinate Supplement for Sleep Support - Chelated Magnesium Tablets for Women & Men, 200mg per Serving, Supports Calm & Relaxation, Vegan - 240 Count","$20.99","4.5","74604","","Health & Household","278","Magnesium Mineral Supplements","8","Sales & Deals","48","2","3","FBA","$1,299,637.02","68,240","https://www.amazon.com/dp/B000BD0RT0","https://images-na.ssl-images-amazon.com/images/I/61A-zRQCJiL._AC_UL600_SR600,400_.jpg","false","false","1","2026-02-22T11:30:54.625Z"
"B0F5XYHRPV","THORNE - Magnesium Glycinate - Supports Restful Sleep, Muscle Relaxation, Heart Health & Metabolism* - Chelated Magnesium Capsules - Third-Party Certified - Gluten, Dairy & Soy-Free - 90 Servings","$25.00","4.7","1245","","Health & Household","287","Magnesium Mineral Supplements","9","","","3","1","FBA","$1,812,204.38","72,488","https://www.amazon.com/dp/B0F5XYHRPV","https://images-na.ssl-images-amazon.com/images/I/71BwFPGbYaL._AC_UL600_SR600,400_.jpg","false","false","1","2026-02-22T11:30:54.625Z"
"B0C88BJYX2","Naturebell Pure Magnesium Glycinate 500mg, 240 Veggie Capsules | 100% Chelated & Purified – 3rd Party Tested, Vegan Friendly, Non-GMO","$19.95","4.7","15844","","Health & Household","294","Magnesium Mineral Supplements","10","","","2","4","FBA","$1,521,020.45","78,773","https://www.amazon.com/dp/B0C88BJYX2","https://images-na.ssl-images-amazon.com/images/I/81pSEdYFGBL._AC_UL600_SR600,400_.jpg","false","false","1","2026-02-22T11:30:54.626Z"
"B01M4GM9R1","Magnesium L Threonate, Magtein, Sleep and Cognitive Support – High Absorption – Most Bioavailable Form of Magnesium – 2,000 mg – 120 Capsules","$29.95","4.6","18394","","Health & Household","426","Magnesium Mineral Supplements","11","","","1","3","FBA","$1,825,858.57","60,964","https://www.amazon.com/dp/B01M4GM9R1","https://images-na.ssl-images-amazon.com/images/I/61iCwueXtEL._AC_UL600_SR600,400_.jpg","false","false","1","2026-02-22T11:30:54.627Z"
"B0F11Q5NVH","Molecular H2TAB Hydrogen Water Tablets with Magnesium -12 PPM Hydrogen Tablets for Drinking Water -Rich in Antioxidants, Supports Cellular Health, Recovery & Cognitive Function (30 Counts, Raspberry)","$22.99","4.3","1961","","Health & Household","517","Magnesium Mineral Supplements","12","","","2","1","FBA","$1,245,849.88","43,456","https://www.amazon.com/dp/B0F11Q5NVH","https://images-na.ssl-images-amazon.com/images/I/61X9l7NZ5fL._AC_UL600_SR600,400_.jpg","false","false","1","2026-02-22T11:30:54.627Z"
"B0CRY2SVPV","Magnesium Complex Supplement 8 Elemental 1000mg - Magnesium Glycinate, Citrate, Malate, Taurate, Chelated for Easy Absorption for Bones, Muscle, Recovery, Energy, Vegan Non-GMO 90 Capsules","$26.97","4.6","4126","","Health & Household","521","Magnesium Mineral Supplements","13","","","8","1","FBA","$800,514.80","28,008","https://www.amazon.com/dp/B0CRY2SVPV","https://images-na.ssl-images-amazon.com/images/I/81GGlmjmqzL._AC_UL600_SR600,400_.jpg","false","false","1","2026-02-22T11:30:54.628Z"
"B0CV2RSRFX","Nutricost Magnesium Glycinate Capsules (180 Capsules, 210 mg Per Serving) - Magnesium Glycinate Supplement for Gentle Absorption","$13.50","4.7","1843","","Health & Household","583","Magnesium Mineral Supplements","14","","","5","1","FBA","$442,986.29","25,099","https://www.amazon.com/dp/B0CV2RSRFX","https://images-na.ssl-images-amazon.com/images/I/61ZGNlfqi9L._AC_UL600_SR600,400_.jpg","false","false","1","2026-02-22T11:30:54.629Z"
"B07BSP6GDT","Magnesium Citrate Complex 500 MG for Constipation & Digestion Support | High Absorption Magnesium Supplement | Citrato de Magnesio | Calm & Relaxation | Non-GMO Soy-Free | 60 Mag Citrate Capsules","$19.95","4.6","26657","","Health & Household","590","Magnesium Mineral Supplements","15","","","6","1","FBA","$851,163.28","41,159","https://www.amazon.com/dp/B07BSP6GDT","https://images-na.ssl-images-amazon.com/images/I/810iAVyGXqL._AC_UL600_SR600,400_.jpg","false","false","1","2026-02-22T11:30:54.630Z"
"B07CDWT8WM","Nature Made Magnesium Oxide 400 mg Softgels, Extra Strength Magnesium Supplements for Men and Women, Support for Muscle, Nerve, Bone and Heart, 110 Day Supply","$17.99","4.7","43542","","Health & Household","632","Magnesium Mineral Supplements","16","","","5","11","AMZ","$555,133.54","43,119","https://www.amazon.com/dp/B07CDWT8WM","https://images-na.ssl-images-amazon.com/images/I/71LnTBa64uL._AC_UL600_SR600,400_.jpg","false","false","1","2026-02-22T11:30:54.630Z"
"B0CWM5K6W6","Magnesium Glycinate 500mg | High Absorption | Sleep, Muscle, Bone, Heart Health & Relaxation Support for Women & Men | Chelated Mag Glycinate | Magnesium Supplement | Vegan & Non-GMO | 120 Capsules","$14.95","4.6","4784","","Health & Household","676","Magnesium Mineral Supplements","17","","","5","1","FBA","$432,069.58","26,955","https://www.amazon.com/dp/B0CWM5K6W6","https://images-na.ssl-images-amazon.com/images/I/71DDiPUWzQL._AC_UL600_SR600,400_.jpg","false","false","1","2026-02-22T11:30:54.631Z"
"B0F2GXWLPG","Recess Mood Magnesium Supplement Drink Calming Beverage, 12 Ounce (Variety Pack, 12 Pack) *Greatest Hits Sampler*","$35.88","4.3","6121","","Health & Household","760","Magnesium Mineral Supplements","18","","","12","1","FBA","$1,633,553.27","43,100","https://www.amazon.com/dp/B0F2GXWLPG","https://images-na.ssl-images-amazon.com/images/I/71Xv3pnKbVL._AC_UL600_SR600,400_.jpg","false","false","1","2026-02-22T11:30:54.632Z"
"B0058HWV70","Pure Encapsulations Magnesium (Citrate) - Supplement for Sleep, Heart Health, Cognitive Health, Bone Health, Energy, Muscles, and Metabolism* - with Premium Magnesium - 90 Capsules","$20.50","4.7","13155","","Health & Household","782","Magnesium Mineral Supplements","19","","","2","1","FBA","$863,704.76","32,339","https://www.amazon.com/dp/B0058HWV70","https://images-na.ssl-images-amazon.com/images/I/71RoQma433L._AC_UL600_SR600,400_.jpg","false","false","1","2026-02-22T11:30:54.633Z"
"B00CU3SX4K","Nature Made Magnesium Citrate 250 mg per serving, Magnesium Supplements for Men and Women, Support for Muscle, Nerve, Bone and Heart, 120 Softgels, 60 Day Supply","$15.01","4.6","23765","","Health & Household","787","Magnesium Mineral Supplements","20","","","3","12","AMZ","$454,378.14","34,919","https://www.amazon.com/dp/B00CU3SX4K","https://images-na.ssl-images-amazon.com/images/I/71z32fq3HEL._AC_UL600_SR600,400_.jpg","false","false","1","2026-02-22T11:30:54.634Z"
"B09L57WWMY","SOLARAY Magnesium Glycinate Capsules, Chelated Magnesium Bisglycinate w/BioPerine, Higher Absorption Magnesium Supplement - Bones, Muscles, Heart Support, Vegan (30 Servings, 120 VegCaps)","$18.39","4.7","7550","","Health & Household","836","Magnesium Mineral Supplements","21","","","6","10","FBA","$905,363.60","39,236","https://www.amazon.com/dp/B09L57WWMY","https://images-na.ssl-images-amazon.com/images/I/6183M0fcpFL._AC_UL600_SR600,400_.jpg","false","false","1","2026-02-22T11:30:54.634Z"
"B0DL6JVD1Z","Dr. Berg Magnesium Glycinate 150ct – 4-in-1 Chelated for Muscle, Nerve, Sleep & Stress Support*– w/ D3, B6 & Zinc – 4X Lab-Tested – No Fillers – Formulated in USA, GMP-Certified","$29.99","4.8","3258","","Health & Household","902","Magnesium Mineral Supplements","22","","","2","1","FBA","$772,857.76","31,147","https://www.amazon.com/dp/B0DL6JVD1Z","https://images-na.ssl-images-amazon.com/images/I/71oLPV9iLKL._AC_UL600_SR600,400_.jpg","false","false","1","2026-02-22T11:30:54.635Z"
"B0CTJ5K5GQ","Organics Ocean Pure Magnesium Glycinate with Zinc - Maximum Strength Chelated Magnesium Supplement for Women and Men for Muscle Cramps and Sleep Support - 90 Capsule","$34.99","4.6","5661","","Health & Household","960","Magnesium Mineral Supplements","23","","","4","2","FBA","$1,186,945.71","27,850","https://www.amazon.com/dp/B0CTJ5K5GQ","https://images-na.ssl-images-amazon.com/images/I/61jkPs39KWL._AC_UL600_SR600,400_.jpg","false","false","1","2026-02-22T11:30:54.636Z"
"B00BPUY3W0","Natural Vitality Calm Magnesium 16oz Powder | Raspberry Lemon Flavored Supplement | Non-GMO, Vegan & Gluten Free Formula","$22.70","4.6","49097","","Health & Household","1104","Magnesium Mineral Supplements","24","Diet & Sports Nutrition","138","3","4","AMZ","$614,664.86","22,363","https://www.amazon.com/dp/B00BPUY3W0","https://images-na.ssl-images-amazon.com/images/I/714F2Dgzc0L._AC_UL600_SR600,400_.jpg","false","false","1","2026-02-22T11:30:54.637Z"
"B0DH23CS1J","Vitalibre 10 in 1 Magnesium Complex, 420mg Elemental Magnesium | Ultra Strength, Max Absorption | Chelated Magnesium Supplement for Nerves, Bone & Heart Health | Non-GMO, 120 Vegan Capsules","$9.98","4.7","5194","","Health & Household","1121","Magnesium Mineral Supplements","25","","","4","1","FBA","$284,382.71","26,614","https://www.amazon.com/dp/B0DH23CS1J","https://images-na.ssl-images-amazon.com/images/I/71oToe8oHhL._AC_UL600_SR600,400_.jpg","false","false","1","2026-02-22T11:30:54.638Z"
"B0FHH4CCD9","Magnesium Complex 700mg – 12-in-1 Magnesium Supplement with Glycinate, Citrate, Malate, Oxide, Taurate & More – High Absorption for Muscle, Heart, Sleep, Bone, Nerve Support –120 Capsules","$9.99","4.7","1109","","Health & Household","1172","Magnesium Mineral Supplements","26","","","1","1","FBA","$133,968.11","13,410","https://www.amazon.com/dp/B0FHH4CCD9","https://images-na.ssl-images-amazon.com/images/I/819caFbPYjL._AC_UL600_SR600,400_.jpg","false","false","1","2026-02-22T11:30:54.639Z"
"B078KJLT6G","Natural Vitality Calm Magnesium Gummies | 330mg Per Serving | Raspberry Lemon Flavored Supplement | Gluten-Free & Vegan | 240 Count","$32.98","4.5","25793","","Health & Household","1288","Magnesium Mineral Supplements","27","","","3","1","AMZ","$763,721.64","23,430","https://www.amazon.com/dp/B078KJLT6G","https://images-na.ssl-images-amazon.com/images/I/71RIxIVrJyL._AC_UL600_SR600,400_.jpg","false","false","1","2026-02-22T11:30:54.640Z"
"B0CKGDP313","Qunol Magnesium Capsules 420mg, 100% DV, High Absorption Magnesium Supplement, Extra Strength, Bone and Muscle Health Supplement, 180 Count","$17.39","4.7","8698","","Health & Household","1291","Magnesium Mineral Supplements","28","","","2","1","AMZ","$368,650.68","21,744","https://www.amazon.com/dp/B0CKGDP313","https://images-na.ssl-images-amazon.com/images/I/612AclobyDL._AC_UL600_SR600,400_.jpg","false","false","1","2026-02-22T11:30:54.641Z"
"B0CTQYGJSZ","Bronson Magnesium Glycinate 200 MG per Serving Chelated for High Absorption, Gentle On Stomach, Non-GMO, 60 Vegetarian Capsules","$9.99","4.6","3880","","Health & Household","1321","Magnesium Mineral Supplements","29","","","4","1","FBA","$359,430.67","29,560","https://www.amazon.com/dp/B0CTQYGJSZ","https://images-na.ssl-images-amazon.com/images/I/71dV+DkYgVL._AC_UL600_SR600,400_.jpg","false","false","1","2026-02-22T11:30:54.641Z"
"B0DBMX2YPV","Qunol Magnesium Glycinate 300mg, 100% Glycinate Chelated Magnesium Supplement, 90ct Tablets","$19.99","4.6","4218","","Health & Household","1337","Magnesium Mineral Supplements","30","","","2","1","AMZ","$512,728.47","26,442","https://www.amazon.com/dp/B0DBMX2YPV","https://images-na.ssl-images-amazon.com/images/I/71HmUxteBqL._AC_UL600_SR600,400_.jpg","false","false","1","2026-02-22T11:30:54.642Z"
"B0C8DMMYTC","Innate Vitality Magnesium Glycinate 500mg | 70mg Elemental Magnesium Supplement - High Absorption, Non Buffered, Non-GMO & No Gluten - Vegan - Nerve Health - 120 Capsules (Pack of 1)","$18.86","4.7","10535","","Health & Household","1386","Magnesium Mineral Supplements","31","","","4","2","FBA","$430,574.67","21,201","https://www.amazon.com/dp/B0C8DMMYTC","https://images-na.ssl-images-amazon.com/images/I/71yVCJsY6RL._AC_UL600_SR600,400_.jpg","false","false","1","2026-02-22T11:30:54.643Z"
"B09L96GQQJ","New Chapter Magnesium + Ashwagandha Supplement, 325 mg with Magnesium Glycinate for Muscle Relaxation & Recovery, Heart, Nerve & Bone Health, 2.5X Absorption, Non-GMO - 60 ct (2 Month Supply)","$19.48","4.5","8013","","Health & Household","1462","Magnesium Mineral Supplements","32","","","4","3","AMZ","$442,202.65","22,970","https://www.amazon.com/dp/B09L96GQQJ","https://images-na.ssl-images-amazon.com/images/I/61f52Pr2cCL._AC_UL600_SR600,400_.jpg","false","false","1","2026-02-22T11:30:54.644Z"
"B0DFYLM2T8","Kids Magnesium Liquid Drops-Magnesium Glycinate Liquid for Kids Supplement-w/L-theanine, Omega-3, Vitamin B6, D3 - for Sleep, Relaxation, Brain, Bones - 2 Fl Oz Children's Calm, Strawberry Flavor","$18.99","4.6","1354","","Health & Household","1479","Magnesium Mineral Supplements","33","","","16","1","FBA","$425,264.27","22,484","https://www.amazon.com/dp/B0DFYLM2T8","https://images-na.ssl-images-amazon.com/images/I/71+vTmZWYCL._AC_UL600_SR600,400_.jpg","false","false","1","2026-02-22T11:30:54.645Z"
"B0CZLC95Q2","Totaria Magnesium Complex 700mg 12 in 1 Magnesium Supplement with Glycinate Citrate Malate Oxide Taurate Aspartate Orotate Magnesium Relaxation,Muscle,Heart Support, Vegan 120 Capsules","$24.99","4.6","4060","","Health & Household","1513","Magnesium Mineral Supplements","34","","","2","1","FBA","$549,608.47","20,017","https://www.amazon.com/dp/B0CZLC95Q2","https://images-na.ssl-images-amazon.com/images/I/71Y2xBL7r6L._AC_UL600_SR600,400_.jpg","false","false","1","2026-02-22T11:30:54.646Z"
"B0CBVZ9B2G","Nature Made High Absorption Magnesium Glycinate Gummies 100 mg per Serving, Muscle, Nerve, Bone and Heart Support, Magnesium Supplement, 40 Magnesium Gummies, 20 Day Supply","$12.85","4.6","2713","","Health & Household","1519","Magnesium Mineral Supplements","35","","","1","14","AMZ","$158,097.86","13,475","https://www.amazon.com/dp/B0CBVZ9B2G","https://images-na.ssl-images-amazon.com/images/I/71DV-0sahBL._AC_UL600_SR600,400_.jpg","false","false","1","2026-02-22T11:30:54.647Z"
"B0DDK4XJ7Z","Magnesium Glycinate Gummies for Adults & Kids 4+, Sugar Free Magnesium Bisglycinate Supplement 400/200mg with B6D3, 5HTP, L-Theanine for Sleep & Relaxation, Brain, Muscle, Melatonin Free Gummies,1Pack","$19.99","4.6","874","","Health & Household","1529","Magnesium Mineral Supplements","36","","","1","1","FBA","$294,275.52","14,721","https://www.amazon.com/dp/B0DDK4XJ7Z","https://images-na.ssl-images-amazon.com/images/I/818G4pZi6cL._AC_UL600_SR600,400_.jpg","false","false","1","2026-02-22T11:30:54.648Z"
"B07CJX4M8K","SlowMag Muscle & Heart Magnesium Chloride Supplement with Calcium, 120 Count, Supports Muscle Relaxation, Heart, Nerve & Bone Health, High Absorption","$17.88","4.7","10585","","Health & Household","1588","Magnesium Mineral Supplements","37","","","3","7","AMZ","$475,092.53","21,279","https://www.amazon.com/dp/B07CJX4M8K","https://images-na.ssl-images-amazon.com/images/I/71VY5fnU2KL._AC_UL600_SR600,400_.jpg","false","false","1","2026-02-22T11:30:54.649Z"
"B081FXFHLJ","MegaFood Magnesium Glycinate, Citrate, Malate 300mg Supplement - Highly Absorbable Blend to Support Heart, Nerve Health & Relaxation, Triple Magnesium Complex Supplement, 60 Capsules (30 Servings)","$15.99","4.6","3694","","Health & Household","1628","Magnesium Mineral Supplements","38","","","2","2","FBA","$565,068.80","25,355","https://www.amazon.com/dp/B081FXFHLJ","https://images-na.ssl-images-amazon.com/images/I/71kfoPTwR3L._AC_UL600_SR600,400_.jpg","false","false","1","2026-02-22T11:30:54.650Z"
"B0C415SWFX","Adndale 90 CT Magnesium Glycinate Gummies 400 mg/Serv with Ashwagandha, Magnesium Malate & Taurate, Sugar Free Magnesium Gummies for Adults & Kids.","$23.25","4.6","2432","","Health & Household","1644","Magnesium Mineral Supplements","39","","","5","1","FBA","$586,957.31","21,392","https://www.amazon.com/dp/B0C415SWFX","https://images-na.ssl-images-amazon.com/images/I/71PVasL7muL._AC_UL600_SR600,400_.jpg","false","false","1","2026-02-22T11:30:54.651Z"
"B07NWMVMT1","NOW Foods Supplements, Magnesium Glycinate 100 mg, Highly Absorbable Form, 180 Tablets","$18.99","4.7","7288","","Health & Household","1687","Magnesium Mineral Supplements","40","","","2","11","FBA","$386,058.56","20,122","https://www.amazon.com/dp/B07NWMVMT1","https://images-na.ssl-images-amazon.com/images/I/717mZ0CmDkL._AC_UL600_SR600,400_.jpg","false","false","1","2026-02-22T11:30:54.652Z"
"B0DJ1T6ZWZ","Magnesium Glycinate Gummies 600mg, Sugar Free Magnesium Gummies for Adults, Chewable Potassium Supplements for Body Support, Zzz and Relaxation, 120 Count","$23.99","4.5","2857","","Health & Household","1690","Magnesium Mineral Supplements","41","","","16","6","FBA","$390,349.22","18,274","https://www.amazon.com/dp/B0DJ1T6ZWZ","https://images-na.ssl-images-amazon.com/images/I/81xgJzz6BZL._AC_UL600_SR600,400_.jpg","false","false","1","2026-02-22T11:30:54.653Z"
"B0014M1VII","NOW Supplements, Magnesium Citrate, Enzyme Function*, Nervous System Support*, 120 Veg Capsules","$9.59","4.7","24375","","Health & Household","1695","Magnesium Mineral Supplements","42","","","4","13","AMZ","$237,150.71","12,586","https://www.amazon.com/dp/B0014M1VII","https://images-na.ssl-images-amazon.com/images/I/71yjMUf5-lL._AC_UL600_SR600,400_.jpg","false","false","1","2026-02-22T11:30:54.654Z"
"B0D3VPJTMJ","Sports Research® Magnesium Glycinate - Supports Restful Sleep & Enzymatic Processes - 160 mg Chelated Magnesium - Vegan Capsule - 90 Count","$17.95","4.7","2323","","Health & Household","1719","Magnesium Mineral Supplements","43","","","3","2","FBA","$422,627.30","19,764","https://www.amazon.com/dp/B0D3VPJTMJ","https://images-na.ssl-images-amazon.com/images/I/61wKw24zUoL._AC_UL600_SR600,400_.jpg","false","false","1","2026-02-22T11:30:54.656Z"
"B0DHVQ9XWY","VEV Deep Calm Magnesium Complex14-in-1 Gummies – with Ashwagandha, L-Theanine, Vitamin D3 & Zinc – Magnesium Complex for Women and Men – No Added Sugar Vegan Magnesium Glycinate – 90 Gummies","$22.55","4.6","2295","","Health & Household","1720","Magnesium Mineral Supplements","44","","","2","3","FBA","$343,528.41","14,364","https://www.amazon.com/dp/B0DHVQ9XWY","https://images-na.ssl-images-amazon.com/images/I/71C8F0lCCmL._AC_UL600_SR600,400_.jpg","false","false","1","2026-02-22T11:30:54.657Z"
"B00Q78C1EW","Seven Minerals Pure Magnesium Oil Spray, Big 12oz, USP Grade, Extra Strength, for Feet, Sleep, Muscle Pain & Cramps - Mined in The USA","$19.95","4.3","36869","","Health & Household","1738","Magnesium Mineral Supplements","45","","","4","3","FBA","$291,113.87","16,170","https://www.amazon.com/dp/B00Q78C1EW","https://images-na.ssl-images-amazon.com/images/I/71D2Ewgg0JL._AC_UL600_SR600,400_.jpg","false","false","1","2026-02-22T11:30:54.658Z"
"B085V638VB","Nature Made High Absorption Magnesium Citrate 200 mg per serving, Magnesium Supplement for Muscle, Nerve, Bone and Heart Support, 60 Magnesium Gummies, 30 Day Supply","$12.49","4.5","10869","","Health & Household","1799","Magnesium Mineral Supplements","46","","","4","19","AMZ","$398,743.33","16,870","https://www.amazon.com/dp/B085V638VB","https://images-na.ssl-images-amazon.com/images/I/71EHYoNNUhL._AC_UL600_SR600,400_.jpg","false","false","1","2026-02-22T11:30:54.659Z"
"B00U9LEEYI","NaturalSlim MagicMag Magnesium Citrate Powder Drink for Relaxation, Stress, Constipation, Better Rest & Digestive Health, Magnesium Supplement for Women and Men, Strawberry & Lime Flavored 8oz","$23.95","4.7","26918","","Health & Household","1857","Magnesium Mineral Supplements","47","","","10","1","FBA","$585,442.67","19,433","https://www.amazon.com/dp/B00U9LEEYI","https://images-na.ssl-images-amazon.com/images/I/71hw-UYOoLL._AC_UL300_SR300,200_.jpg","false","false","1","2026-02-22T11:30:54.660Z"
"B09KCMXXXF","Garden of Life Magnesium Citrate Supplement Gummies with Prebiotics & Probiotics for Stress, Sleep & Recovery - Vegan, Gluten Free, Kosher, Non-GMO, No Added Sugars, Raspberry Flavor, 60 Count","$11.99","4.3","5387","","Health & Household","1866","Magnesium Mineral Supplements","48","","","4","7","AMZ","$255,431.04","19,169","https://www.amazon.com/dp/B09KCMXXXF","https://images-na.ssl-images-amazon.com/images/I/71kpr7buvlL._AC_UL300_SR300,200_.jpg","false","false","1","2026-02-22T11:30:54.661Z"
"B0B336FCWC","Sports Research® Magnesium L-Threonate Capsules 2000mg - High-Absorption Magtein® for Enhanced Brain Health, Memory, Focus & Restful Sleep Support - Vegan · Non-GMO · Gluten Free - 90 Count","$29.95","4.7","1983","","Health & Household","1872","Magnesium Mineral Supplements","49","","","2","5","FBA","$698,015.17","19,382","https://www.amazon.com/dp/B0B336FCWC","https://images-na.ssl-images-amazon.com/images/I/61i20cLrvkL._AC_UL300_SR300,200_.jpg","false","false","1","2026-02-22T11:30:54.663Z"
"B08MTNZH1L","Kappa Nutrition Powered by Magbrain™ Magnesium L-Threonate Plant-Based, 420mg Elemental Magnesium (3 Capsules) from 2,253mg, 120 Vegan Capsules, Brain, Sleep & Muscle Support.","$27.99","4.7","5947","","Health & Household","1908","Magnesium Mineral Supplements","50","","","5","2","FBA","$532,604.64","21,200","https://www.amazon.com/dp/B08MTNZH1L","https://images-na.ssl-images-amazon.com/images/I/71VDc+q26BL._AC_UL300_SR300,200_.jpg","false","false","1","2026-02-22T11:30:54.664Z"
"B0DMTV24LR","Life Extension Magnesium Glycinate, Heart Health, Bone Health, Nerve and Muscle Support, Highly absorbable, Gluten-Free, Non-GMO, Vegetarian, 90 Capsules","$15.30","4.7","1538","","Health & Household","2009","Magnesium Mineral Supplements","51","","","1","2","AMZ","$233,197.33","14,395","https://www.amazon.com/dp/B0DMTV24LR","https://images-na.ssl-images-amazon.com/images/I/71QJDDxd70L._AC_UL600_SR600,400_.jpg","false","false","1","2026-02-22T11:32:26.055Z"
"B08ZBGPGZ9","Organixx Magnesium Glycinate Supplement for Support Sleep, Muscle & Heart Health, 7 Type Magnesium Complex with Vitamin B6, Manganese Citrate, Gluten Free, Vegan, Non GMO, High Absorption, 60 Capsules","$37.95","4.5","3165","","Health & Household","2016","Magnesium Mineral Supplements","52","","","6","1","FBA","$687,034.13","17,356","https://www.amazon.com/dp/B08ZBGPGZ9","https://images-na.ssl-images-amazon.com/images/I/81Ung3ueMXL._AC_UL600_SR600,400_.jpg","false","false","1","2026-02-22T11:32:26.055Z"
