asin,title,price,rating,reviews,countryOfOrigin,category1,bsr1,category2,bsr2,category3,bsr3,variations,sellers,fulfillment,revenue30d,unitSales30d,url,image,isPrime,isSponsored,pageNum,scrapedAt
"B09GHFMQ99","Puracy Organic Hand Soap, Professional Hand Washers We've All Become, Moisturizing Natural Gel Hand Wash Soap, Liquid Hand Soap Refills for Soft Skin (Refill Lavender & Vanilla, 48 Ounce)","$29.99","4.5","3954","","Industrial & Scientific","594","Bulk Quantity Hand Soaps","1","","","12","2","FBA","$166,743.11","6,667","https://www.amazon.com/dp/B09GHFMQ99","https://images-na.ssl-images-amazon.com/images/I/716cSqnHWkL._AC_UL600_SR600,400_.jpg","false","false","1","2026-02-22T12:17:07.313Z"
"B0CDZN8N7C","Dial Antibacterial Defense Foaming Hand Soap + Aloe, Fresh Pear Scent, 30 Fl Oz Hand Soap Refill (Pack of 4), Dermatologist-Tested, Gentle on Skin","$25.56","4.8","1339","","Industrial & Scientific","2382","Bulk Quantity Hand Soaps","2","","","3","1","AMZ","$190,170.75","7,903","https://www.amazon.com/dp/B0CDZN8N7C","https://images-na.ssl-images-amazon.com/images/I/81TBz0OnaBL._AC_UL600_SR600,400_.jpg","false","false","1","2026-02-22T12:17:07.313Z"
"B000CCOK6Q","GOJO NATURAL ORANGE Pumice Hand Cleaner, 1 Gallon Quick Acting Lotion Hand Cleaner with Pumice Pump Bottle (Pack of 1) – 0955-02","$28.23","4.7","9403","","Industrial & Scientific","1676","Bulk Quantity Hand Soaps","3","Garage & Shop Products","116","8","54","AMZ","$69,677.98","2,326","https://www.amazon.com/dp/B000CCOK6Q","https://images-na.ssl-images-amazon.com/images/I/71uTL5aTpKL._AC_UL600_SR600,400_.jpg","false","false","1","2026-02-22T12:17:07.314Z"
"B0BJL743XX","GOJO Premium Lotion Soap, Waterfall Fragrance, 800 mL Lotion Hand Soap Refill 800 Series Bag-In-Box Soap Dispenser (Pack of 12) - 9106-12","$64.26","4.8","307","","Industrial & Scientific","3009","Bulk Quantity Hand Soaps","4","Hand Wash","160","2","61","MERCH","$75,358.28","1,290","https://www.amazon.com/dp/B0BJL743XX","https://images-na.ssl-images-amazon.com/images/I/81nNvDaRFeL._AC_UL600_SR600,400_.jpg","false","false","1","2026-02-22T12:17:07.315Z"
"B087RSYRW1","GOJO FMX-12 Luxury Foam Handwash, Cranberry Scent, EcoLogo Certified, 1250 mL Foam Soap Refill for GOJO FMX-12 Push-Style Dispenser (Pack of 4) – 5161-04","$66.90","4.8","579","","Industrial & Scientific","3028","Bulk Quantity Hand Soaps","5","","","2","63","FBA","$104,223.02","1,526","https://www.amazon.com/dp/B087RSYRW1","https://images-na.ssl-images-amazon.com/images/I/718Iojf1GcL._AC_UL600_SR600,400_.jpg","false","false","1","2026-02-22T12:17:07.315Z"
"B071NXJVK2","Grip Clean Heavy Duty Hand Cleaner for Mechanics – Natural Pumice & Clay-Infused Technology Removes Grease, Oil & Grime – Moisturizing Liquid Hand Soap for Shop, Garage & Industrial Use – 32oz","$22.97","4.6","4009","","Beauty & Personal Care","14158","Bulk Quantity Hand Soaps","6","Hand Wash","151","4","2","FBA","$50,308.55","2,034","https://www.amazon.com/dp/B071NXJVK2","https://images-na.ssl-images-amazon.com/images/I/7179ncL6KJL._AC_UL600_SR600,400_.jpg","false","false","1","2026-02-22T12:17:07.316Z"
"B0CPDMNVXB","Zenex Magic Hand Soap - Industrial Hand Cleaner for Auto Mechanics | Shop Soap | Walnut Shell Scrubbers to Remove Grease, Oil, Ink & Paint | Moisturizing Ingredients | 3.55 L (4 Pack)","$138.99","4.7","440","","Beauty & Personal Care","20995","Bulk Quantity Hand Soaps","7","Hand Wash","195","6","1","FBA","$88,429.24","1,015","https://www.amazon.com/dp/B0CPDMNVXB","https://images-na.ssl-images-amazon.com/images/I/71f5NiqRo8L._AC_UL600_SR600,400_.jpg","false","false","1","2026-02-22T12:17:07.317Z"
"B08XZTDCWK","Zep Commercial Antimicrobial Hand Soap, 1 Gallon, R46124, 128 Fl Oz (Pack of 1)","$20.69","4.4","375","","Beauty & Personal Care","32236","Bulk Quantity Hand Soaps","8","Hand Wash","268","2","11","AMZ","$22,678.56","637","https://www.amazon.com/dp/B08XZTDCWK","https://images-na.ssl-images-amazon.com/images/I/41LsPMmLpDL._AC_UL600_SR600,400_.jpg","false","false","1","2026-02-22T12:17:07.317Z"
"B008UTCWNQ","GOJO Pomeberry Foam Handwash, Pomegranate Scent, 1200 mL Hand Soap Refill LTX-12 Dispenser (Pack of 2) - 1916-02","$57.63","4.6","1356","","Beauty & Personal Care","8252","Bulk Quantity Hand Soaps","9","Hand Wash","98","6","58","AMZ","$215,207.75","3,885","https://www.amazon.com/dp/B008UTCWNQ","https://images-na.ssl-images-amazon.com/images/I/81g7arD5t3L._AC_UL600_SR600,400_.jpg","false","false","1","2026-02-22T12:17:07.318Z"
"B075ND7N9F","PURELL Brand HEALTHY SOAP Gentle and Free Foam, Fragrance Free, 1200 mL Refill for PURELL ES8 Automatic Soap Dispenser (Pack of 2) - 7772-02 - Manufactured by GOJO, Inc.","$39.93","4.6","274","","Beauty & Personal Care","25786","Bulk Quantity Hand Soaps","10","Foot & Hand Care","386","3","52","FBA","$24,615.08","528","https://www.amazon.com/dp/B075ND7N9F","https://images-na.ssl-images-amazon.com/images/I/61Wg8kU-NNL._AC_UL600_SR600,400_.jpg","false","false","1","2026-02-22T12:17:07.319Z"
"B07MQMN4DC","MRS. MEYER'S CLEAN DAY foaming Hand Soap, Rainwater Scent (10 Fl Oz (Pack of 1))","$13.75","4.7","2884","","Industrial & Scientific","6726","Bulk Quantity Hand Soaps","11","","","17","5","AMZ","$104,105.24","7,380","https://www.amazon.com/dp/B07MQMN4DC","https://images-na.ssl-images-amazon.com/images/I/61MQVg6C5IL._AC_UL600_SR600,400_.jpg","false","false","1","2026-02-22T12:17:07.319Z"
"B01BMKO0SY","DEB-AZU1L - Deb Refresh Azure FOAM Wash 1000ml Refill, 6/CS","$59.25","4.6","164","","Industrial & Scientific","7191","Bulk Quantity Hand Soaps","12","","","2","24","MERCH","$43,345.55","732","https://www.amazon.com/dp/B01BMKO0SY","https://images-na.ssl-images-amazon.com/images/I/71+cv+Ob4tL._AC_UL600_SR600,400_.jpg","false","false","1","2026-02-22T12:17:07.320Z"
"B00F0VXDG2","Proforce/Members Mark Commercial Foaming Antibacterial Hand Soap 2 Pack Refills, 33.8 Fl. Oz","$24.49","4.6","750","","Beauty & Personal Care","27781","Bulk Quantity Hand Soaps","13","Hand Wash","238","2","20","MERCH","$16,357.13","672","https://www.amazon.com/dp/B00F0VXDG2","https://images-na.ssl-images-amazon.com/images/I/81+CR+lwbYL._AC_UL600_SR600,400_.jpg","false","false","1","2026-02-22T12:17:07.321Z"
"B002389W7E","GOJO Cherry Gel Pumice Hand Cleaner, Cherry Scent, 10 Oz Bottle","$8.49","4.7","1143","","Beauty & Personal Care","33395","Bulk Quantity Hand Soaps","14","Hand Wash","278","2","12","AMZ","$5,355.24","544","https://www.amazon.com/dp/B002389W7E","https://images-na.ssl-images-amazon.com/images/I/61YnSHT1axL._AC_UL600_SR600,400_.jpg","false","false","1","2026-02-22T12:17:07.322Z"
"B004OZTQ8Y","Provon Antimicrobial Lotion Soap - 16 oz Pump","$11.50","4.6","2229","","Beauty & Personal Care","33526","Bulk Quantity Hand Soaps","15","Hand Wash","279","1","18","FBA","$7,088.24","605","https://www.amazon.com/dp/B004OZTQ8Y","https://images-na.ssl-images-amazon.com/images/I/71vRa4LvqUL._AC_UL600_SR600,400_.jpg","false","false","1","2026-02-22T12:17:07.322Z"
"B0D9VCSBMN","Dial Professional Spring Water Antibacterial Defense Foaming Hand Wash, 1 Gallon Refill Bottle, 128 Fl Oz","$32.13","4.3","214","","Beauty & Personal Care","35049","Bulk Quantity Hand Soaps","16","Hand Wash","291","3","7","AMZ","$27,958.65","826","https://www.amazon.com/dp/B0D9VCSBMN","https://images-na.ssl-images-amazon.com/images/I/61ezWSHfLkL._AC_UL600_SR600,400_.jpg","false","false","1","2026-02-22T12:17:07.323Z"
"B0BJN9D3DR","Mrs. MEYER'S CLEAN DAY Liquid Hand Soap Bottle, 12.5 Fl Oz Lilac, Rose, Mint, Lemon, Lavender, Basil (Pack of 6) (Variety Pack)","$35.81","4.7","1288","","Industrial & Scientific","9487","Bulk Quantity Hand Soaps","17","","","10","2","MERCH","$12,829.79","495","https://www.amazon.com/dp/B0BJN9D3DR","https://images-na.ssl-images-amazon.com/images/I/61H-6N4IHXL._AC_UL600_SR600,400_.jpg","false","false","1","2026-02-22T12:17:07.324Z"
"B073W8RHJT","P&G PROFESSIONAL Antibacterial Hand Soap from Safeguard Professional, Bulk Liquid Hand Soap Refill, 1 Gal. (Case of 2)","$47.92","4.5","1183","","Beauty & Personal Care","36536","Bulk Quantity Hand Soaps","18","Hand Wash","299","2","40","AMZ","$25,533.66","532","https://www.amazon.com/dp/B073W8RHJT","https://images-na.ssl-images-amazon.com/images/I/81X5Gg3DlWL._AC_UL600_SR600,400_.jpg","false","false","1","2026-02-22T12:17:07.324Z"
"B087RRBLPG","GOJO Luxury Foam Antibacterial Handwash, Fresh Fruit Fragrance, 1250 mL Foam Hand Soap Refill FMX-12 Push-Style Dispenser (Pack of 4) – 5162-04","$74.00","4.5","334","","Industrial & Scientific","9937","Bulk Quantity Hand Soaps","19","Hand Wash","300","3","48","AMZ","$38,729.24","532","https://www.amazon.com/dp/B087RRBLPG","https://images-na.ssl-images-amazon.com/images/I/61gaiZ8kj8L._AC_UL600_SR600,400_.jpg","false","false","1","2026-02-22T12:17:07.325Z"
"B0B1316WVK","Zep Cherry Bomb Hand Cleaner - 1 Gallon (Case of 4) 95124 - Removes Stubborn Industrial Soils Such As Grease, Tar, Carbon, Asphalt, Inks, Resins, Paints and Adhesives","$112.99","4.8","282","","Beauty & Personal Care","37933","Bulk Quantity Hand Soaps","20","Hand Wash","309","2","7","MERCH","$50,065.31","434","https://www.amazon.com/dp/B0B1316WVK","https://images-na.ssl-images-amazon.com/images/I/81haR4X-hTL._AC_UL600_SR600,400_.jpg","false","false","1","2026-02-22T12:17:07.326Z"
"B0040ZOK66","Scott Professional Foam Hand Soap with Moisturizers (91552), 1.0 L, Foaming, Pink, Floral Scent, Manual Refills (6 Bottles)","$62.22","4.7","215","","Industrial & Scientific","10278","Bulk Quantity Hand Soaps","21","","","2","32","AMZ","$33,170.81","587","https://www.amazon.com/dp/B0040ZOK66","https://images-na.ssl-images-amazon.com/images/I/71zbfkKOL+L._AC_UL600_SR600,400_.jpg","false","false","1","2026-02-22T12:17:07.327Z"
"B0DK7Z4VHK","Health Guard Foaming Antibacterial Hand Soap #21352, for use with discontinued Member's Mark/Sam's Club/Ecolab soap dispenser, same formula as discontinued soap #915169, 4/1000 mL refill bags","$51.20","4.5","110","","Industrial & Scientific","10625","Bulk Quantity Hand Soaps","22","","","1","2","FBA","$31,612.56","618","https://www.amazon.com/dp/B0DK7Z4VHK","https://images-na.ssl-images-amazon.com/images/I/51qa1eEzmGL._AC_UL600_SR600,400_.jpg","false","false","1","2026-02-22T12:17:07.328Z"
"B0B8SYRDYB","Soapbox Liquid Hand Soap & Body Wash, Sea Minerals & Blue Iris - Gentle, Moisturizing Hand & Body Cleanser, Vegan, Cruelty Free Hand Soap Refill for Bathroom, Kitchen, Professional Use - Gallon Size","$36.49","4.4","490","","Beauty & Personal Care","18932","Bulk Quantity Hand Soaps","23","Hand Wash","343","4","1","FBA","$49,632.85","1,370","https://www.amazon.com/dp/B0B8SYRDYB","https://images-na.ssl-images-amazon.com/images/I/61qAJ9MIo9L._AC_UL600_SR600,400_.jpg","false","false","1","2026-02-22T12:17:07.329Z"
"B0BK9V7ZPJ","Mrs. MEYER'S Liquid Hand Soap Refill, Oat Blossom 33 Fl Oz. (Pack of 2)","$21.99","4.7","34929","","Beauty & Personal Care","1171","Hand Wash","17","Bulk Quantity Hand Soaps","24","23","3","MERCH","$350,497.95","23,047","https://www.amazon.com/dp/B0BK9V7ZPJ","https://images-na.ssl-images-amazon.com/images/I/61b7oh3z9RL._AC_UL600_SR600,400_.jpg","false","false","1","2026-02-22T12:17:07.329Z"
"B0D15LJLNL","SC Johnson Professional REFRESH CLEAR FOAM HAND SOAP 1 LITER, 6 PACK","$61.44","4.9","10","","Industrial & Scientific","11719","Bulk Quantity Hand Soaps","25","Hand Wash","345","2","14","AMZ","$19,605.34","406","https://www.amazon.com/dp/B0D15LJLNL","https://images-na.ssl-images-amazon.com/images/I/71QOtyS44nL._AC_UL600_SR600,400_.jpg","false","false","1","2026-02-22T12:17:07.330Z"
"B00PS50LLA","Genuine Joe 02105CT Hand Soap Lotion Dispenser Refill 1Gal 4/CT Pink","$44.19","4.2","1298","","Industrial & Scientific","11836","Bulk Quantity Hand Soaps","26","Hand Wash","330","2","34","MERCH","$20,576.28","555","https://www.amazon.com/dp/B00PS50LLA","https://images-na.ssl-images-amazon.com/images/I/81MwqbscJVL._AC_UL600_SR600,400_.jpg","false","false","1","2026-02-22T12:17:07.331Z"
"B0083N4PJ8","Lava 10185 Heavy-Duty Hand Cleaner with Moisturizers, 5.75 oz. (Pack of 12)","$29.00","4.9","1948","","Industrial & Scientific","12144","Bulk Quantity Hand Soaps","27","","","2","13","FBA","$15,395.53","560","https://www.amazon.com/dp/B0083N4PJ8","https://images-na.ssl-images-amazon.com/images/I/71-iBFPntwL._AC_UL600_SR600,400_.jpg","false","false","1","2026-02-22T12:17:07.332Z"
"B0C7LQQ45Z","Grip Clean Ultra Heavy Duty Hand Cleaner for Mechanics – Walnut Shell & Clay-Infused Technology Removes Grease, Oil & Paint – Pro-Grade Industrial Hand Soap with Cherry Scent - 32 Fl Oz","$19.97","4.6","161","","Industrial & Scientific","13063","Bulk Quantity Hand Soaps","28","","","3","2","FBA","$8,330.96","463","https://www.amazon.com/dp/B0C7LQQ45Z","https://images-na.ssl-images-amazon.com/images/I/71JHjEHKR4L._AC_UL600_SR600,400_.jpg","false","false","1","2026-02-22T12:17:07.333Z"
"B094YS8Q2T","Mrs. MEYER'S Liquid Hand Soap, Rainwater Scent, Set includes 33 oz. Refill & 12.5 oz. bottle","$20.98","4.7","1374","","Beauty & Personal Care","39163","Bulk Quantity Hand Soaps","29","Hand Wash","322","4","2","FBA","$8,711.44","415","https://www.amazon.com/dp/B094YS8Q2T","https://images-na.ssl-images-amazon.com/images/I/51sFJ-FCoxL._AC_UL600_SR600,400_.jpg","false","false","1","2026-02-22T12:17:07.334Z"
"B087RS7F4V","GOJO Green Certified Foam Hand Cleaner, Fragrance Free, 1250 mL Hand Soap Refill FMX-12 Push-Style Dispenser (Pack of 4) - 5165-04","$55.00","4.4","177","","Industrial & Scientific","15058","Bulk Quantity Hand Soaps","30","Hand Wash","390","4","44","MERCH","$33,659.03","465","https://www.amazon.com/dp/B087RS7F4V","https://images-na.ssl-images-amazon.com/images/I/81GO+d4pboL._AC_UL600_SR600,400_.jpg","false","false","1","2026-02-22T12:17:07.335Z"
"B0DPR38L42","SC Johnson Professional Refresh Azure FOAM, Foam Hand Wash, Foaming Hand Soap, 1 Liter Cartridge, 2 Count, for Professional Use Only","$28.00","4.6","49","","Industrial & Scientific","15555","Bulk Quantity Hand Soaps","31","Hand Wash","408","1","5","FBA","$10,274.23","367","https://www.amazon.com/dp/B0DPR38L42","https://images-na.ssl-images-amazon.com/images/I/61fpMTT7VLL._AC_UL300_SR300,200_.jpg","false","false","1","2026-02-22T12:17:07.336Z"
"B07D56CJ76","ECOS PRO Liquid Hand Soap, Free & Clean Scent, 1 gal Bottle","$29.70","4.8","35","","Industrial & Scientific","15832","Bulk Quantity Hand Soaps","32","Hand Wash","412","1","9","MERCH","$4,495.42","154","https://www.amazon.com/dp/B07D56CJ76","https://images-na.ssl-images-amazon.com/images/I/51wzPTzpH7L._AC_UL300_SR300,200_.jpg","false","false","1","2026-02-22T12:17:07.337Z"
"B09TFW8MQ2","Dial Professional Basics MP Free Liquid Hand Soap, Honeysuckle, 3.78 L Refill Bottle","$22.13","4.6","84","","Industrial & Scientific","16726","Bulk Quantity Hand Soaps","33","Hand Wash","424","1","24","MERCH","$6,052.01","267","https://www.amazon.com/dp/B09TFW8MQ2","https://images-na.ssl-images-amazon.com/images/I/61ZdvOH6G9L._AC_UL300_SR300,200_.jpg","false","false","1","2026-02-22T12:17:07.338Z"
"B08H4PF47T","PURELL Brand HEALTHY SOAP Mild Foam, 1200 mL refill for PURELL CS6 Automatic Hand Soap Dispenser 2 count (Pack of 1) - 6574-02 - Manufactured by GOJO, Inc","$47.71","4.3","69","","Industrial & Scientific","19124","Bulk Quantity Hand Soaps","34","","","3","62","AMZ","$19,171.13","375","https://www.amazon.com/dp/B08H4PF47T","https://images-na.ssl-images-amazon.com/images/I/71XEB6b0KdL._AC_UL300_SR300,200_.jpg","false","false","1","2026-02-22T12:17:07.339Z"
"B0040ZOJYO","WypAll PowerClean ProScrub Heavy Duty Wet Towels (91371), Dual Action Cleaning, Large 9.5"" x 12"" Wipes, Bucket Included (6 Containers of 75 Sheets, 450 Sheet Total)","$84.15","4.4","502","","Industrial & Scientific","13586","Bulk Quantity Hand Soaps","35","Commercial Disposable Wipes","35","3","31","AMZ","$24,795.61","319","https://www.amazon.com/dp/B0040ZOJYO","https://images-na.ssl-images-amazon.com/images/I/71c5aVLkrjL._AC_UL300_SR300,200_.jpg","false","false","1","2026-02-22T12:17:07.340Z"
"B0040ZOKES","Scott Professional Green Certified Foam Hand Soap (91565), 1.0 L, Foaming, Clear, No Fragrance Added, Manual Refills, Ecologo, NSF E-1 Rated (6 Bottles)","$56.56","4.4","182","","Beauty & Personal Care","43510","Bulk Quantity Hand Soaps","36","Hand Wash","348","3","29","MERCH","$16,645.36","354","https://www.amazon.com/dp/B0040ZOKES","https://images-na.ssl-images-amazon.com/images/I/71vzRWp+B+L._AC_UL300_SR300,200_.jpg","false","false","1","2026-02-22T12:17:07.341Z"
"B0CV2KZKVF","Zep Cherry Bomb Hand Cleaner and Zep D-4000 Hand Soap Dispenser - 1 Gal (Case of 4) - 95124 - Heavy-Duty Shop Grade Formula","$164.99","4.7","72","","Industrial & Scientific","20077","Bulk Quantity Hand Soaps","37","Hand Wash","473","1","1","MERCH","$43,320.69","263","https://www.amazon.com/dp/B0CV2KZKVF","https://images-na.ssl-images-amazon.com/images/I/81FNIBF2LQL._AC_UL300_SR300,200_.jpg","false","false","1","2026-02-22T12:17:07.342Z"
"B07XJ7YZHZ","Zep Heavy-Duty TKO Industrial Hand Cleaner - 1 Gallon (Case of 4) - 1049524 - For Industrial Professionals Such As Mechanics, Four Pumps Included","$114.99","4.7","327","","Industrial & Scientific","20924","Bulk Quantity Hand Soaps","38","","","1","9","MERCH","$38,116.99","331","https://www.amazon.com/dp/B07XJ7YZHZ","https://images-na.ssl-images-amazon.com/images/I/81bsEqlHviL._AC_UL300_SR300,200_.jpg","false","false","1","2026-02-22T12:17:07.343Z"
"B075MT2122","PURELL Brand HEALTHY SOAP Foam, Fresh Scent, 1200 mL Refill for PURELL ES6 Automatic Soap Dispenser (Pack of 2) - 6477-02 - Manufactured by GOJO, Inc.","$44.99","4.3","243","","Beauty & Personal Care","66071","Bulk Quantity Hand Soaps","39","Foot & Hand Care","1005","2","26","MERCH","$14,980.69","298","https://www.amazon.com/dp/B075MT2122","https://images-na.ssl-images-amazon.com/images/I/71+FgbEqwVL._AC_UL300_SR300,200_.jpg","false","false","1","2026-02-22T12:17:07.344Z"
"B0FWKWZK8Q","Zep Cherry Bomb Hand Cleaner - 32 Oz (Pack of 1) 95104 - Blasts away dirt, grease, and grime","$14.99","5.0","4","","Industrial & Scientific","21716","Bulk Quantity Hand Soaps","40","","","1","1","AMZ","$1,495.53","107","https://www.amazon.com/dp/B0FWKWZK8Q","https://images-na.ssl-images-amazon.com/images/I/719uJt4yqaL._AC_UL300_SR300,200_.jpg","false","false","1","2026-02-22T12:17:07.345Z"
"B07D3NTY2Y","Dial 154013M Liquid Gold Antimicrobial Soap, 1 Gallon (pack of 1)","$27.53","4.6","325","","Industrial & Scientific","22304","Bulk Quantity Hand Soaps","41","Hand Wash","500","1","19","AMZ","$5,955.53","227","https://www.amazon.com/dp/B07D3NTY2Y","https://images-na.ssl-images-amazon.com/images/I/61fe6Rxtn2L._AC_UL300_SR300,200_.jpg","false","false","1","2026-02-22T12:17:07.346Z"
"B00DIFLGLQ","Extreme Green Power Hand Scrub, 64 oz Tub (Formerly Mean Green) - Removes Oil, Grease, Dirt, Filth without Harsh Chemicals","$33.50","4.6","1567","","Industrial & Scientific","22883","Bulk Quantity Hand Soaps","42","","","2","2","FBA","$4,441.28","153","https://www.amazon.com/dp/B00DIFLGLQ","https://images-na.ssl-images-amazon.com/images/I/81gboYYV78L._AC_UL300_SR300,200_.jpg","false","false","1","2026-02-22T12:17:07.348Z"
"B0745D4YVV","Spic and Span Disinfecting All-Purpose Spray And Glass Cleaner, Fresh Scent, 1 Gal Bottle","$56.09","4.6","92","","Industrial & Scientific","23287","Bulk Quantity Hand Soaps","43","Hand Wash","512","2","44","AMZ","$9,790.14","167","https://www.amazon.com/dp/B0745D4YVV","https://images-na.ssl-images-amazon.com/images/I/81Ckl+jJIIL._AC_UL300_SR300,200_.jpg","false","false","1","2026-02-22T12:17:07.349Z"
"B00BKZQLIE","Dial Liquid Hand Soap, Vanilla Honey with Protein Packed Yogurt, 7.5 Fl Oz, Packaging may vary","$6.99","4.6","949","","Industrial & Scientific","23663","Bulk Quantity Hand Soaps","44","","","2","3","AMZ","$7,962.16","2,260","https://www.amazon.com/dp/B00BKZQLIE","https://images-na.ssl-images-amazon.com/images/I/8144xJBpOBL._AC_UL300_SR300,200_.jpg","false","false","1","2026-02-22T12:17:07.350Z"
"B0BJL69JWQ","PURELL Brand HEALTHY SOAP Gentle & Free Foam, Fragrance-Free, 17.4 fl oz Hand Soap Table Top Pump Bottle (Pack of 4) - 5016-04","$43.58","4.8","64","","Industrial & Scientific","24421","Bulk Quantity Hand Soaps","45","Foot & Hand Care","1095","1","15","FBA","$7,114.00","157","https://www.amazon.com/dp/B0BJL69JWQ","https://images-na.ssl-images-amazon.com/images/I/71Zsc24-W3L._AC_UL300_SR300,200_.jpg","false","false","1","2026-02-22T12:17:07.351Z"
"B0CCN4MB6T","Grit Go Industrial Hand Soap – Heavy-Duty Gritty Hand Cleaner for Mechanics, Construction Workers & More – Removes Grease, Oil, Rust & Paint – Moisturizing & Exfoliating Hand Paste (1 lb)","$13.99","4.6","158","","Industrial & Scientific","24624","Bulk Quantity Hand Soaps","46","Body Skin Care Products","5424","2","1","FBA","$3,074.03","188","https://www.amazon.com/dp/B0CCN4MB6T","https://images-na.ssl-images-amazon.com/images/I/71bOMJEXCUL._AC_UL300_SR300,200_.jpg","false","false","1","2026-02-22T12:17:07.352Z"
"B0BTR6YRWB","ATTITUDE Liquid Hand Soap, EWG Verified, Plant and Mineral-Based, Vegan Personal Care Products, Bergamot and Ylang Ylang, 67.6 Fl Oz","$35.99","4.3","389","","Beauty & Personal Care","16480","Bulk Quantity Hand Soaps","47","Hand Wash","168","9","1","AMZ","$44,310.82","1,463","https://www.amazon.com/dp/B0BTR6YRWB","https://images-na.ssl-images-amazon.com/images/I/61d+3hlaOmL._AC_UL300_SR300,200_.jpg","false","false","1","2026-02-22T12:17:07.354Z"
"B0CB911HHH","PURELL HEALTHY SOAP Premium Lotion Handwash, Waterfall Fragrance, 1000 mL Refill for CS2 and NXT Soap Dispensers (Pack of 8) - 4171-08","$94.93","4.5","22","","Industrial & Scientific","25518","Bulk Quantity Hand Soaps","48","Foot & Hand Care","1133","1","34","MERCH","$10,213.61","128","https://www.amazon.com/dp/B0CB911HHH","https://images-na.ssl-images-amazon.com/images/I/81wz8gu7SKL._AC_UL300_SR300,200_.jpg","false","false","1","2026-02-22T12:17:07.355Z"
"B001ECQ3Y0","EO Sulfate-Free Moisturizing Hand Soap, French Lavender, 12 Oz, 3 Count","$26.55","4.7","965","","Beauty & Personal Care","57963","Bulk Quantity Hand Soaps","49","Hand Wash","440","4","17","FBA","$4,343.79","188","https://www.amazon.com/dp/B001ECQ3Y0","https://images-na.ssl-images-amazon.com/images/I/71BvjXLCswL._AC_UL300_SR300,200_.jpg","false","false","1","2026-02-22T12:17:07.356Z"
"B000P1FTAA","Zep TKO Hand Cleaner","$30.56","4.8","504","","Industrial & Scientific","27101","Bulk Quantity Hand Soaps","50","Hand Wash","555","1","18","AMZ","$4,327.86","141","https://www.amazon.com/dp/B000P1FTAA","https://images-na.ssl-images-amazon.com/images/I/81iqUw4FY0L._AC_UL300_SR300,200_.jpg","false","false","1","2026-02-22T12:17:07.357Z"