asin,title,price,rating,reviews,countryOfOrigin,category1,bsr1,category2,bsr2,category3,bsr3,variations,sellers,fulfillment,revenue30d,unitSales30d,url,image,isPrime,isSponsored,pageNum,scrapedAt
"B07RRRV5CT","Quest Nutrition Nacho Cheese Tortilla Style Protein Chips, 18g Protein, 4g Net Carb, Gluten Free, 1.1 oz (Pack of 12)","$25.44","4.5","99761","","Health & Household","99","Sports Nutrition Chips & Crisps Snacks","1","","","32","3","AMZ","$3,094,410.20","147,194","https://www.amazon.com/dp/B07RRRV5CT","https://images-na.ssl-images-amazon.com/images/I/81IqKdsFOvL._AC_UL600_SR600,400_.jpg","false","false","1","2026-02-22T10:59:37.696Z"
"B09WCWK8LM","Quest Nutrition Protein Chips Variety Pack, BBQ, Cheddar & Sour Cream, Sour Cream & Onion, High Protein, Low Carb, 1.1 oz (Pack of 12)","$29.98","4.4","27261","","Health & Household","459","Sports Nutrition Chips & Crisps Snacks","2","","","10","1","AMZ","$1,241,969.93","51,933","https://www.amazon.com/dp/B09WCWK8LM","https://images-na.ssl-images-amazon.com/images/I/81rfpq4TkZL._AC_UL600_SR600,400_.jpg","false","false","1","2026-02-22T10:59:37.697Z"
"B0B9WDZ7K9","WILDE Protein Chips Variety Pack, High Protein Snacks for Adults, Keto Chips, Gluten Free, Low Carb Snack Box Made with Real Ingredients 1.34oz Bags, Pack of 12","$35.99","4.2","3469","","Health & Household","1977","Sports Nutrition Chips & Crisps Snacks","3","","","6","1","FBA","$643,718.82","18,435","https://www.amazon.com/dp/B0B9WDZ7K9","https://images-na.ssl-images-amazon.com/images/I/81zNFlXbISL._AC_UL600_SR600,400_.jpg","false","false","1","2026-02-22T10:59:37.698Z"
"B0CS51LG55","Pure Protein Popped Crisps - Variety Pack: Hickory Barbecue, Sour Cream & Onion, Sweet Chili - 12g Plant Based Protein, Gluten Free, Non GMO, Vegan, Air Popped & Puffed Crisps – Healthy Protein Snacks – 12 Pack","$23.76","4.4","1543","","Health & Household","3982","","","","","14","5","AMZ","$221,545.44","9,447","https://www.amazon.com/dp/B0CS51LG55","https://images-na.ssl-images-amazon.com/images/I/81xKQ5rPnfL._AC_UL600_SR600,400_.jpg","false","false","1","2026-02-22T10:59:37.699Z"
"B0D6RXFR47","Legendary Foods Cheesy Nacho Protein Chips – Popped Tortilla Style – 22g High Protein, 4g Net Carbs, Low Sugar, Gluten Free, Keto Snack Packs – 10 Count – Healthy Crunchy Chips","$35.99","4.4","768","","Health & Household","4670","Sports Nutrition Chips & Crisps Snacks","5","","","6","1","FBA","$296,919.69","8,969","https://www.amazon.com/dp/B0D6RXFR47","https://images-na.ssl-images-amazon.com/images/I/71P9LOUVROL._AC_UL600_SR600,400_.jpg","false","false","1","2026-02-22T10:59:37.700Z"
"B0CFSQTWR3","Quest Nutrition Cheese Crackers, Spicy Cheddar, 10g of Protein, Low Carb, Made with Real Cheese, Protein Snack, 4 Count","$7.48","4.4","8090","","Health & Household","6294","Sports Nutrition Chips & Crisps Snacks","6","","","7","1","AMZ","$474,100.70","27,078","https://www.amazon.com/dp/B0CFSQTWR3","https://images-na.ssl-images-amazon.com/images/I/813pmg4KM9L._AC_UL600_SR600,400_.jpg","false","false","1","2026-02-22T10:59:37.702Z"
"B09YCJSTPJ","Flock Keto Chicken Skin Chips – 4 Flavors Variety Pack, Low Carb, High Protein, Gluten-Free Chicken Crisps, Keto Snack, Low Carb Chips, Protein Crackers, Diet Snacks, 8-Pack (1oz)","$29.00","3.1","8323","","Health & Household","6502","Sports Nutrition Chips & Crisps Snacks","7","","","8","2","FBA","$88,913.65","3,076","https://www.amazon.com/dp/B09YCJSTPJ","https://images-na.ssl-images-amazon.com/images/I/71GxPKeIL6L._AC_UL600_SR600,400_.jpg","false","false","1","2026-02-22T10:59:37.703Z"
"B07CBQCM15","Moon Cheese Cheddar Believe It, 10 Ounce, 2-Pack, Crunchy, Protein-Rich Cheese Snack, Keto Friendly, 100% Real Cheese","$29.99","4.3","5458","","Health & Household","6730","Sports Nutrition Chips & Crisps Snacks","8","","","10","2","FBA","$129,918.47","5,168","https://www.amazon.com/dp/B07CBQCM15","https://images-na.ssl-images-amazon.com/images/I/71BxtXsL4FL._AC_UL600_SR600,400_.jpg","false","false","1","2026-02-22T10:59:37.704Z"
"B0BFKD24CF","Wilde Snacks Chips Protein Seasalt Vingar 4 OZ","$5.99","4.3","384","","Health & Household","10516","Sports Nutrition Chips & Crisps Snacks","9","","","2","13","AMZ","$27,430.90","4,051","https://www.amazon.com/dp/B0BFKD24CF","https://images-na.ssl-images-amazon.com/images/I/81MryQF8uoL._AC_UL600_SR600,400_.jpg","false","false","1","2026-02-22T10:59:37.705Z"
"B0BFKCLNYQ","Wilde Snacks Chips Protein Buffalo 4 OZ","$5.99","4.3","307","","Health & Household","11427","Sports Nutrition Chips & Crisps Snacks","10","","","2","14","AMZ","$27,083.74","4,165","https://www.amazon.com/dp/B0BFKCLNYQ","https://images-na.ssl-images-amazon.com/images/I/81qJAGK3zTL._AC_UL600_SR600,400_.jpg","false","false","1","2026-02-22T10:59:37.707Z"
"B0CBVQ9CYS","Natural Endurance Protein Chips - Nacho Chips, Low Carb Chips, High Protein Snack, Vegan Protein with Avocado Oil, 14g Protein Per Bag, Gluten Free - Nacho Flavor, 1.38 oz Bags (Pack of 12)","$24.99","4.1","756","","Health & Household","15651","Sports Nutrition Chips & Crisps Snacks","11","","","3","1","FBA","$53,489.97","2,140","https://www.amazon.com/dp/B0CBVQ9CYS","https://images-na.ssl-images-amazon.com/images/I/81Z7tgexU0L._AC_UL600_SR600,400_.jpg","false","false","1","2026-02-22T10:59:37.708Z"
"B0CBZWY1KY","Wilde Snacks Chips Protein Bbq 4 OZ","$6.97","4.3","239","","Health & Household","16888","Sports Nutrition Chips & Crisps Snacks","12","","","2","11","AMZ","$15,079.51","2,109","https://www.amazon.com/dp/B0CBZWY1KY","https://images-na.ssl-images-amazon.com/images/I/81LHF6E+QwL._AC_UL600_SR600,400_.jpg","false","false","1","2026-02-22T10:59:37.709Z"
"B0D7NZZZ8H","Moon Cheese Variety Pack, Cheddar, White Cheddar, Gouda, Garlic Parm & Pepper Jack, Protein-Rich Cheese Snack, Gluten Free, Keto Friendly, 100% Real Cheese, 2 Ounce (Pack of 5)","$21.99","4.4","307","","Health & Household","21388","Sports Nutrition Chips & Crisps Snacks","13","","","5","2","FBA","$40,656.60","1,828","https://www.amazon.com/dp/B0D7NZZZ8H","https://images-na.ssl-images-amazon.com/images/I/71e6jnFCVsL._AC_UL600_SR600,400_.jpg","false","false","1","2026-02-22T10:59:37.711Z"
"B07NSSQ5H3","WILDE BRANDS Himalayan Pink Salt Chicken Chips, 2.25 OZ","$4.99","4.1","1184","","Health & Household","23801","Sports Nutrition Chips & Crisps Snacks","14","","","1","8","AMZ","$6,914.40","1,580","https://www.amazon.com/dp/B07NSSQ5H3","https://images-na.ssl-images-amazon.com/images/I/817OdZVvDOL._AC_UL600_SR600,400_.jpg","false","false","1","2026-02-22T10:59:37.712Z"
"B0CDMFX9DH","Pure Protein Cheesy Crackers, Cheddar, High Protein Snack, 10G Protein, 1.06 Oz (Pack of 12)","$23.99","4.0","638","","Health & Household","24129","Sports Nutrition Chips & Crisps Snacks","15","","","4","3","AMZ","$29,577.84","1,266","https://www.amazon.com/dp/B0CDMFX9DH","https://images-na.ssl-images-amazon.com/images/I/81r39YgFkeL._AC_UL600_SR600,400_.jpg","false","false","1","2026-02-22T10:59:37.713Z"
"B0DPPV2PQP","Moon Cheese Space Spice, Variety Pack, Crunchy, Protein-Rich Cheese Snack, Keto Friendly, 100% Real Cheese, Low Carb, Gluten-Free, Low Sugar, 2 Oz bags (Pack of 3, 1 of Each Flavor)","$14.99","4.1","250","","Health & Household","27674","Sports Nutrition Chips & Crisps Snacks","16","","","4","1","FBA","$19,010.34","1,269","https://www.amazon.com/dp/B0DPPV2PQP","https://images-na.ssl-images-amazon.com/images/I/8132FKKkAWL._AC_UL600_SR600,400_.jpg","false","false","1","2026-02-22T10:59:37.713Z"
"B09CVBD22X","PURIS Organic Pea Protein Crisps, Certified Organic Pea Protein Isolate, Keto Protein Crunch, Made 100% in The USA, Non-GMO, Gluten Free, No Sugar, No Soy, 18g Protein, 7g Carbs, Unflavored","$29.99","4.5","213","","Health & Household","39276","Sports Nutrition Chips & Crisps Snacks","17","","","4","1","FBA","$7,206.95","201","https://www.amazon.com/dp/B09CVBD22X","https://images-na.ssl-images-amazon.com/images/I/71vM-+l52eL._AC_UL600_SR600,400_.jpg","false","false","1","2026-02-22T10:59:37.714Z"
"B0BS8L2DR5","Flock Keto Chicken Skin Chips | Hattie Bs Nashville Hot Flavor | Keto Friendly, Low Carb, High Protein, Flavor Packed, Gluten Free Single Serve Snack | (2.5oz) 4-Pack","$24.99","3.4","343","","Health & Household","48305","Sports Nutrition Chips & Crisps Snacks","18","","","5","2","FBA","$6,092.90","209","https://www.amazon.com/dp/B0BS8L2DR5","https://images-na.ssl-images-amazon.com/images/I/71PxwEfEFEL._AC_UL600_SR600,400_.jpg","false","false","1","2026-02-22T10:59:37.715Z"
"B082XHCPB5","Moon Cheese Bites, Get Pepper Jacked, 10-Ounce 2-Pack, 100% Real Cheese Snack, Protein, Keto, After-School or Lunch Snack","$29.99","4.6","285","","Health & Household","54720","Sports Nutrition Chips & Crisps Snacks","19","","","1","1","FBA","$17,341.44","578","https://www.amazon.com/dp/B082XHCPB5","https://images-na.ssl-images-amazon.com/images/I/811srj-4ciL._AC_UL600_SR600,400_.jpg","false","false","1","2026-02-22T10:59:37.716Z"
"B0F5F8W39S","Power Crunch Protein CRISPS Variety Pack, Cheddar, Salt & Vinegar, BBQ, a Potato Style Protein Chip Snack, 12g of protein, 1.05 ounces per serving (2 of Each Flavor)","$24.27","4.1","28","","Health & Household","56558","Sports Nutrition Chips & Crisps Snacks","20","","","1","1","AMZ","$10,263.51","432","https://www.amazon.com/dp/B0F5F8W39S","https://images-na.ssl-images-amazon.com/images/I/81S+CwF4haL._AC_UL600_SR600,400_.jpg","false","false","1","2026-02-22T10:59:37.717Z"
"B09VMWPZ12","Sonoma Creamery - Cheese Crisps, Pepper Jack, 10 Oz (3 Count) | High Protein | Low Carb | Gluten Free | Keto-Friendly","$39.99","4.4","8684","","Health & Household","57095","Sports Nutrition Chips & Crisps Snacks","21","","","20","2","FBA","$20,090.35","689","https://www.amazon.com/dp/B09VMWPZ12","https://images-na.ssl-images-amazon.com/images/I/61aGzdkS1BL._AC_UL600_SR600,400_.jpg","false","false","1","2026-02-22T10:59:37.718Z"
"B0FQFCB2ZP","PURIS Pea Protein Crisps – Plant-Based Crunch | 18g Protein Per Serving | Non-GMO Gluten-Free Soy-Free | No Sugar | Clean Label Inclusion for Snacks, Bars & Baking | Made in USA | Unflavored | 1 lb","$23.99","4.5","46","","Health & Household","63146","Sports Nutrition Chips & Crisps Snacks","22","","","3","2","FBA","$4,373.53","159","https://www.amazon.com/dp/B0FQFCB2ZP","https://images-na.ssl-images-amazon.com/images/I/71fmnSAMAfL._AC_UL600_SR600,400_.jpg","false","false","1","2026-02-22T10:59:37.719Z"
"B0CL7LB7RZ","Sonoma Creamery - Cheese Crisps, Bacon Cheddar, 10 Oz (2 Count) | Savory Snack Cracker | High Protein | Low Carb | Gluten Free | Wheat Free","$29.84","4.5","180","","Health & Household","65252","Sports Nutrition Chips & Crisps Snacks","23","","","7","2","FBA","$22,990.53","643","https://www.amazon.com/dp/B0CL7LB7RZ","https://images-na.ssl-images-amazon.com/images/I/71K1AJ9jynL._AC_UL600_SR600,400_.jpg","false","false","1","2026-02-22T10:59:37.719Z"
"B09WBTZZG1","Atkins Nacho Cheese Protein Chips, 4g Net Carbs, 13g Protein, Gluten Free, Low Glycemic, Keto Friendly, 12 Count","","4.2","6221","","Health & Household","73543","Sports Nutrition Chips & Crisps Snacks","24","","","7","1","AMZ","$2,890.50","123","https://www.amazon.com/dp/B09WBTZZG1","https://images-na.ssl-images-amazon.com/images/I/810McY42zZL._AC_UL600_SR600,400_.jpg","false","false","1","2026-02-22T10:59:37.720Z"
"B0CVYN1C4T","Wilde Brands Protein Chips, Chicken & Waffles, 8 Bags, 1.34 oz (38 g) Each","$18.63","4.6","107","","Health & Household","79384","Sports Nutrition Chips & Crisps Snacks","25","","","1","29","FBA","$2,732.49","141","https://www.amazon.com/dp/B0CVYN1C4T","https://images-na.ssl-images-amazon.com/images/I/71kjimlUO4L._AC_UL600_SR600,400_.jpg","false","false","1","2026-02-22T10:59:37.721Z"
"B0G1D1YMJZ","Get Strong Foods Cheddar Cheese Crackers - High Protein Crackers - Keto Friendly, Low Carb, High Fiber Cheese Crisp - Low Calorie, Healthy Snack for Adults and GLP-1, Pack of 8","$23.99","3.7","53","","Health & Household","83966","Sports Nutrition Chips & Crisps Snacks","26","","","3","1","FBA","$8,342.41","443","https://www.amazon.com/dp/B0G1D1YMJZ","https://images-na.ssl-images-amazon.com/images/I/71bEtV0qhCL._AC_UL600_SR600,400_.jpg","false","false","1","2026-02-22T10:59:37.722Z"
"B0FKD1PXGJ","Magos Egg Chips Variety Pack – Healthy Snack, High Protein Low Carb, Light Cracker-Style Crunch, 1.1 oz Bags – Includes Garlic Parmesan, Salt & Pepper, Huevos Rancheros – Keto, Vegetarian & Carnivore Friendly, No Gluten Ingredients (3-Pack)","$13.99","2.7","23","","Health & Household","98500","Sports Nutrition Chips & Crisps Snacks","27","","","2","1","FBA","$4,412.00","187","https://www.amazon.com/dp/B0FKD1PXGJ","https://images-na.ssl-images-amazon.com/images/I/71H5qeLaybL._AC_UL600_SR600,400_.jpg","false","false","1","2026-02-22T10:59:37.724Z"
"B0CVSJ454R","Whisps Cheese Crisps Cheddar Cheese | Protein Chips | Healthy Snacks | Protein Snacks, Gluten Free, High Protein, Low Carb Keto Food (6 Oz, 2 Pack)","$27.28","3.3","27","","Health & Household","99038","Sports Nutrition Chips & Crisps Snacks","28","","","1","3","FBA","$331.84","13","https://www.amazon.com/dp/B0CVSJ454R","https://images-na.ssl-images-amazon.com/images/I/81oE9XpTOfL._AC_UL600_SR600,400_.jpg","false","false","1","2026-02-22T10:59:37.725Z"
"B074XG2VJB","WonderSlim Protein Snack Chips, Party Mix, Low Fat & Gluten Free (10ct)","$27.99","3.9","1818","","Health & Household","103053","Sports Nutrition Chips & Crisps Snacks","29","","","4","1","FBA","$7,367.31","263","https://www.amazon.com/dp/B074XG2VJB","https://images-na.ssl-images-amazon.com/images/I/61-+9PLIm+L._AC_UL600_SR600,400_.jpg","false","false","1","2026-02-22T10:59:37.726Z"
"B0D2S2SFQ9","Twin Peaks Ingredients Low Carb, Keto Friendly Protein Puffs, (Variety Pack, 2.1 Ounce), 2 Servings, 3 Pack (60g, 42g Protein, 4g Carbs)","$20.99","3.4","14990","","Health & Household","109383","Sports Nutrition Chips & Crisps Snacks","30","","","11","1","FBA","$7,098.01","274","https://www.amazon.com/dp/B0D2S2SFQ9","https://images-na.ssl-images-amazon.com/images/I/71Pw0kd8lmL._AC_UL600_SR600,400_.jpg","false","false","1","2026-02-22T10:59:37.727Z"
"B0FLF7JK5T","Goodness Plant Bangkok Bites Protein Chips – Tom Yum Flavor, 30g | High-Protein Plant-Based Snack, Vegan & Gluten-Free, Crunchy Thai Street Food Inspired Chips","$8.99","4.8","8","","Health & Household","111850","Sports Nutrition Chips & Crisps Snacks","31","","","8","1","FBA","$1,317.76","91","https://www.amazon.com/dp/B0FLF7JK5T","https://images-na.ssl-images-amazon.com/images/I/81mZCE5fTPL._AC_UL300_SR300,200_.jpg","false","false","1","2026-02-22T10:59:37.728Z"
"B09KLCNY7J","Nordic Catch Freeze Dried Cod Bites Seafood Snacks - Chips made from Wild Caught Icelandic Cod Fish - Healthy Dry Fish Snack, Rich in Omega 3 Fatty Acids, Protein Packed Keto Friendly Dried Fish Jerky - 35g Resealable Bag - 1pk","","3.6","708","","Health & Household","111942","Sports Nutrition Chips & Crisps Snacks","32","","","4","1","FBA","$11,515.15","282","https://www.amazon.com/dp/B09KLCNY7J","https://images-na.ssl-images-amazon.com/images/I/71+FqZSr9OL._AC_UL300_SR300,200_.jpg","false","false","1","2026-02-22T10:59:37.729Z"
"B0G1F4DGWD","Gym Snack Cheddar Cheeze Crisps – High Protein Plant-Based Crisps | Crunchy Pea Protein Snack with Bold Cheesy Flavor | Low Carb, Gluten-Free, Vegan-Friendly Protein Snack for On-the-Go Fuel","$4.99","3.8","10","","Health & Household","115365","Sports Nutrition Chips & Crisps Snacks","33","","","3","1","MERCH","$1,149.94","172","https://www.amazon.com/dp/B0G1F4DGWD","https://images-na.ssl-images-amazon.com/images/I/71Fh-Y2oEZL._AC_UL300_SR300,200_.jpg","false","false","1","2026-02-22T10:59:37.731Z"
"B0D7QY91D5","Power Crunch Protein CRISPS, a Potato Style Protein Chip, Hot & Spicy, 12g of protein, 1.05 ounces per serving (Pack of 6)","$26.96","3.8","61","","Health & Household","116394","Sports Nutrition Chips & Crisps Snacks","34","","","1","3","AMZ","$3,326.36","123","https://www.amazon.com/dp/B0D7QY91D5","https://images-na.ssl-images-amazon.com/images/I/71Rvh0VH6dL._AC_UL300_SR300,200_.jpg","false","false","1","2026-02-22T10:59:37.732Z"
"B07XS7Y3KX","Iwon Organics Organic Mesquite BBQ Protein Stix, 5 OZ","$7.99","4.4","170","","Health & Household","117266","Sports Nutrition Chips & Crisps Snacks","35","","","2","2","AMZ","$913.68","185","https://www.amazon.com/dp/B07XS7Y3KX","https://images-na.ssl-images-amazon.com/images/I/81F661NXTwL._AC_UL300_SR300,200_.jpg","false","false","1","2026-02-22T10:59:37.733Z"
"B0F77V6D3Y","Power Crunch Protein CRISPS Variety Pack, Cheddar, Salt & Vinegar, BBQ, Hot & Spicy, a Potato Style Protein Chip Snack, 12g of protein, 1.05 ounces per serving (1 of Each Flavor)","$17.51","3.8","51","","Health & Household","120567","Sports Nutrition Chips & Crisps Snacks","36","","","1","1","AMZ","$1,904.25","117","https://www.amazon.com/dp/B0F77V6D3Y","https://images-na.ssl-images-amazon.com/images/I/71-tkt1mkOL._AC_UL300_SR300,200_.jpg","false","false","1","2026-02-22T10:59:37.735Z"
"B09Z9T53J1","Crispy Spicy Seaweed Snacks by Nora, Thick Nori Sheets Snack Strips, Low-Carb Healthy Snacks for Adults, Asian Snacks, Vegan, Gluten-Free, Non-GMO, 6-Pack","$32.99","4.6","1115","","Health & Household","125586","Sports Nutrition Chips & Crisps Snacks","37","","","12","1","FBA","$41,826.27","1,223","https://www.amazon.com/dp/B09Z9T53J1","https://images-na.ssl-images-amazon.com/images/I/81r29RpySfL._AC_UL300_SR300,200_.jpg","false","false","1","2026-02-22T10:59:37.737Z"
"B0G1DFM72D","Gym Snack Jalepeno Cheddar Cheeze Crisps – High Protein Plant-Based Crisps | Crunchy Pea Protein Snack with Bold Cheesy Flavor | Low Carb, Gluten-Free, Vegan-Friendly Protein Snack for On-the-Go Fuel","$4.99","2.6","4","","Health & Household","128144","Sports Nutrition Chips & Crisps Snacks","38","","","3","1","MERCH","$702.81","104","https://www.amazon.com/dp/B0G1DFM72D","https://images-na.ssl-images-amazon.com/images/I/71R5ullTX8L._AC_UL300_SR300,200_.jpg","false","false","1","2026-02-22T10:59:37.738Z"
"B09N56NT29","PROTIFIT - High Protein Diet Zipper Snacks, 15g Protein, Low Calorie, Low Sugar, Low Fat, Ideal Protein Compatible, 7 Servings Per Box (Sour Cream & Fine Herb)","$18.49","3.7","33","","Health & Household","129090","Sports Nutrition Chips & Crisps Snacks","39","","","4","4","FBA","$714.32","39","https://www.amazon.com/dp/B09N56NT29","https://images-na.ssl-images-amazon.com/images/I/719gcWo1rrL._AC_UL300_SR300,200_.jpg","false","false","1","2026-02-22T10:59:37.740Z"
"B07SRVVVK4","Protein Chips, 14g Protein, 3g-4g Net Carbs, Gluten Free, Keto Snacks, Low Carb Snacks, Protein Crisps, Keto-Friendly, Made in USA (Barbecue & Sea Salt Vinegar, 6 Pack)","$19.95","3.4","1131","","Health & Household","141549","Sports Nutrition Chips & Crisps Snacks","40","","","8","2","FBA","$1,460.45","94","https://www.amazon.com/dp/B07SRVVVK4","https://images-na.ssl-images-amazon.com/images/I/71Sn3c5+nEL._AC_UL300_SR300,200_.jpg","false","false","1","2026-02-22T10:59:37.742Z"
"B081MC9C5D","Moon Cheese Bites Bundle, Cheddar, White Cheddar, Parm, Gouda & Get Pepper Jacked, 2-Ounce, 5-Pack, Lunch or Snack","$33.00","4.2","1994","","Health & Household","144956","Sports Nutrition Chips & Crisps Snacks","41","","","1","3","FBA","$2,391.59","72","https://www.amazon.com/dp/B081MC9C5D","https://images-na.ssl-images-amazon.com/images/I/81Z0-WbeQYL._AC_UL300_SR300,200_.jpg","false","false","1","2026-02-22T10:59:37.744Z"
"B0G84YN52R","Ready® Protein Puffs – Guilt-Free, High-Protein Crunchy Snack – 25g of Protein – Gluten-Free, No Artificial Flavors – Movie Theater Popcorn (Case of 6, 2.5oz Bags)","$24.99","4.2","15","","Health & Household","145977","Sports Nutrition Chips & Crisps Snacks","42","","","5","2","FBA","$2,457.47","109","https://www.amazon.com/dp/B0G84YN52R","https://images-na.ssl-images-amazon.com/images/I/712iO+TNkoL._AC_UL300_SR300,200_.jpg","false","false","1","2026-02-22T10:59:37.746Z"
"B0FKKPTK5X","WILDE Protein Chips Buffalo Style – High Protein Crispy Chips Made from Chicken Breast, Egg Whites & Bone Broth – Gluten Free, Bold Flavor – 8.5 oz Bag (2 PACKS)","$38.75","3.3","3","","Health & Household","152616","Sports Nutrition Chips & Crisps Snacks","43","","","1","2","FBA","$1,890.15","49","https://www.amazon.com/dp/B0FKKPTK5X","https://images-na.ssl-images-amazon.com/images/I/71I5hwOhErL._AC_UL300_SR300,200_.jpg","false","false","1","2026-02-22T10:59:37.748Z"
"B0G3YJ9VGN","Gym Snack Everything Bagel Crisps – High Protein Plant-Based Crisps | Crunchy Pea Protein Snack with Bold Everything Bagel Seasoning | Low Carb, Gluten-Free, Vegan-Friendly Protein Snack for On-the-Go Fuel","$4.99","3.4","8","","Health & Household","152940","Sports Nutrition Chips & Crisps Snacks","44","","","3","1","MERCH","$729.16","107","https://www.amazon.com/dp/B0G3YJ9VGN","https://images-na.ssl-images-amazon.com/images/I/71-huErzilL._AC_UL300_SR300,200_.jpg","false","false","1","2026-02-22T10:59:37.749Z"
"B0D9MXDL6K","Power Crunch Protein CRISPS Variety Pack, Cheddar, Hot & Spicy, BBQ, a Potato Style Protein Chip Snack, 12g of protein, 1.05 ounces per serving (2 of Each Flavor)","$24.27","3.7","192","","Health & Household","156306","Sports Nutrition Chips & Crisps Snacks","45","","","1","1","AMZ","$2,844.58","118","https://www.amazon.com/dp/B0D9MXDL6K","https://images-na.ssl-images-amazon.com/images/I/81rnAzNeqzL._AC_UL300_SR300,200_.jpg","false","false","1","2026-02-22T10:59:37.751Z"
"B07BQ5HVVS","Weight Loss Systems - Honey Mustard Double Bites - High Protein Snack - Low Calorie - Low Fat - Diet Chip - Gluten Free - 7 Bags","$22.95","3.7","118","","Health & Household","158706","Sports Nutrition Chips & Crisps Snacks","46","","","2","4","MERCH","$853.93","42","https://www.amazon.com/dp/B07BQ5HVVS","https://images-na.ssl-images-amazon.com/images/I/815ISeGiQbL._AC_UL300_SR300,200_.jpg","false","false","1","2026-02-22T10:59:37.752Z"
"B0D4ZN2X3H","Day Out Protein Snack Balls | Cookie Dough 8 Pack Snack Bites | Gluten-Free, Dairy-Free, Vegan Treat | Convenient Ready to Eat Healthy Dessert Energy Bites | Includes 8 x 2oz Packs (16oz Total) | 12g Protein","$29.99","3.5","54","","Health & Household","168813","Sports Nutrition Chips & Crisps Snacks","47","","","5","1","FBA","$3,410.93","114","https://www.amazon.com/dp/B0D4ZN2X3H","https://images-na.ssl-images-amazon.com/images/I/71zzbhhO-HL._AC_UL300_SR300,200_.jpg","false","false","1","2026-02-22T10:59:37.753Z"
"B0FGK7T7WK","SinFit Protein Chips, 20g Protein/Bag, 50g-Bag, High Fiber, Low Carb, Gluten Free,7/box (7 Bags, Sour Cream & Onion)","$24.99","3.9","11","","Health & Household","173872","Sports Nutrition Chips & Crisps Snacks","48","","","8","1","FBA","$1,214.91","49","https://www.amazon.com/dp/B0FGK7T7WK","https://images-na.ssl-images-amazon.com/images/I/71PgqiQtyQL._AC_UL300_SR300,200_.jpg","false","false","1","2026-02-22T10:59:37.754Z"
"B0FW6S3D73","Moon Cheese Space Spice, Out Of This World Pizza, Crunchy, Protein-Rich Cheese Snack Chips, Keto Friendly, 100% Real Cheese, Low Carb, Gluten-Free, No Sugar, 10 oz Bags (Pack of 2)","$29.99","4.4","27","","Health & Household","179966","Sports Nutrition Chips & Crisps Snacks","49","","","1","1","FBA","$1,097.38","37","https://www.amazon.com/dp/B0FW6S3D73","https://images-na.ssl-images-amazon.com/images/I/81VLXDEnWPL._AC_UL300_SR300,200_.jpg","false","false","1","2026-02-22T10:59:37.756Z"
"B0CVHHSPNQ","Bare Apple Organic Variety Pack, Crispy Reds & Cinnamon – Healthy Snacks for Kids & Adults – For Snack Boxes, Road Trips, Christmas Snacks & Holiday Treats – 8 ct, 0.53 oz each in ComboCreations Box","$19.94","4.2","52","","Health & Household","183577","Sports Nutrition Chips & Crisps Snacks","50","","","1","2","MERCH","$1,237.35","62","https://www.amazon.com/dp/B0CVHHSPNQ","https://images-na.ssl-images-amazon.com/images/I/8126-atCMDL._AC_UL300_SR300,200_.jpg","false","false","1","2026-02-22T10:59:37.757Z"
"B0CZ7M76RJ","Wilde Protein Chips, Sweet and Savory Flavors Variety Pack (1.34 oz Bags, Pack of 12) - Crafted From Real Ingredients: Protein Snacks, Keto Chips, Gluten and Grain Free…","$93.35","4.4","241","","Health & Household","187236","Sports Nutrition Chips & Crisps Snacks","51","","","1","1","FBA","$5,358.36","57","https://www.amazon.com/dp/B0CZ7M76RJ","https://images-na.ssl-images-amazon.com/images/I/81g21LG5DqL._AC_UL600_SR600,400_.jpg","false","false","1","2026-02-22T11:01:05.727Z"
"B0FW5TH8BF","Moon Cheese Space Spice, Spicy Lunar Lime, Crunchy, Protein-Rich Cheese Snack Chips, Keto Friendly, 100% Real Cheese, Low Carb, Gluten-Free, No Sugar, 10 oz Bags (Pack of 2)","$29.99","4.6","30","","Health & Household","192307","Sports Nutrition Chips & Crisps Snacks","52","","","1","1","FBA","$1,436.69","48","https://www.amazon.com/dp/B0FW5TH8BF","https://images-na.ssl-images-amazon.com/images/I/71ChNvzPhYL._AC_UL600_SR600,400_.jpg","false","false","1","2026-02-22T11:01:05.728Z"
"B07GX7D6NZ","IWON Organics Cheddar Cheese Flavor Protein Puff, High Protein and Organic Healthy Snacks, 8 Bags","$24.44","4.5","1280","","Health & Household","193937","Sports Nutrition Chips & Crisps Snacks","53","","","4","3","MERCH","$2,182.85","87","https://www.amazon.com/dp/B07GX7D6NZ","https://images-na.ssl-images-amazon.com/images/I/711yMj2lwUL._AC_UL600_SR600,400_.jpg","false","false","1","2026-02-22T11:01:05.729Z"
"B0FKDF4ZB6","Magos Egg Chips – Huevos Rancheros, Healthy Snack, High Protein Low Carb, Light Cracker-Style Crunch, 1.1 oz Bags – Keto, Vegetarian & Carnivore Friendly, No Gluten Ingredients (3-Pack)","$13.99","2.3","13","","Health & Household","194161","Sports Nutrition Chips & Crisps Snacks","54","","","2","1","FBA","$889.05","40","https://www.amazon.com/dp/B0FKDF4ZB6","https://images-na.ssl-images-amazon.com/images/I/714dwwri2KL._AC_UL600_SR600,400_.jpg","false","false","1","2026-02-22T11:01:05.729Z"
