asin,title,price,rating,reviews,countryOfOrigin,category1,bsr1,category2,bsr2,category3,bsr3,variations,sellers,fulfillment,revenue30d,unitSales30d,url,image,isPrime,isSponsored,pageNum,scrapedAt
"B0FRMCRBLW","Cat Litter Deodorizer Plug in - Ozone-Free Negative Ion Air Purifier for Litter Box, Compact Odor Eliminator for Strong Pet Odors, Quiet Air Freshener for Home, Bedroom, Kitchen","$19.99","4.3","52","","Home & Kitchen","137131","Home Air Ionizers","54","","","4","1","FBA","$486.89","24","https://www.amazon.com/dp/B0FRMCRBLW","https://images-na.ssl-images-amazon.com/images/I/61j7A4r5gzL._AC_UL600_SR600,400_.jpg","false","false","1","2026-02-01T21:13:54.944Z"
"B0G5LR8WD3","2026 New Upgraded Plug In Ionic Air Purifier with 4 Negative Ion Outlet, Small Air Ionizers for Home,Quiet Operation Air Freshener Mobile Ion Air Purifier for Bedroom,Living Room,Bathroom(2)","$29.99","4.7","22","","Home & Kitchen","138990","Home Air Ionizers","55","","","5","1","FBA","$3,144.52","105","https://www.amazon.com/dp/B0G5LR8WD3","https://images-na.ssl-images-amazon.com/images/I/61XupPV7-9L._AC_UL600_SR600,400_.jpg","false","false","1","2026-02-01T21:13:54.944Z"
"B0FWJS72NJ","Plug In Air Ionizer - 6Pack Air Purifier with 3 LED Night Light,Negative Air Ionizer for Home Use,Mini Filterless Mobile Air Cleaner for Odor,Smoke Dust,Pets,Quiet Operation Air Freshener for Home","$42.99","5.0","8","","Home & Kitchen","139410","Home Air Ionizers","56","","","3","1","FBA","$2,756.70","67","https://www.amazon.com/dp/B0FWJS72NJ","https://images-na.ssl-images-amazon.com/images/I/61JBBUmh6NL._AC_UL600_SR600,400_.jpg","false","false","1","2026-02-01T21:13:54.945Z"
"B085LSL9Y2","OdorStop Professional Grade Ozone Generators (900 Sq Ft)","$119.99","4.4","1026","","Home & Kitchen","143289","Home Air Ionizers","57","","","7","1","FBA","$44,643.27","259","https://www.amazon.com/dp/B085LSL9Y2","https://images-na.ssl-images-amazon.com/images/I/61OGBVxUTxL._AC_UL600_SR600,400_.jpg","false","false","1","2026-02-01T21:13:54.946Z"
"B0G19HQWDH","Cat Litter Deodorizer 99% Ozone Odor Eliminator Negative Ion 2-IN-1, Plug In Ionic Air Purifier Filter-free Quiet Portable for Home, Pets, Kitchen, Toilet, Wardrobe, Shoe, Garage Room","$29.99","5.0","6","","Home & Kitchen","144714","Home Air Ionizers","58","","","1","1","FBA","$1,577.11","43","https://www.amazon.com/dp/B0G19HQWDH","https://images-na.ssl-images-amazon.com/images/I/616TPuiyYgL._AC_UL600_SR600,400_.jpg","false","false","1","2026-02-01T21:13:54.947Z"
"B0FZV74BDN","Oneluner Air Ionizers for Home, 4-Pack Negative Ion Air Purifiers & Odor Eliminators Quiet Plug-in for Bedroom, Office, Living Room Compact Freshener for Pet, Smoke, and Kitchen Odor","$39.99","5.0","30","","Home & Kitchen","146992","Home Air Ionizers","59","","","5","2","FBA","$6,863.23","172","https://www.amazon.com/dp/B0FZV74BDN","https://images-na.ssl-images-amazon.com/images/I/61S1IQ4UcxL._AC_UL600_SR600,400_.jpg","false","false","1","2026-02-01T21:13:54.947Z"
"B01635K1AO","OdorFree Villa 3000 Ozone Generator for Eliminating Odors, permanently removing Tobacco, Pet and Musty Odors at their Source - Easily Treats Up To 3000 Sq Ft","$379.00","4.5","610","","Home & Kitchen","147379","Home Air Ionizers","60","","","4","1","FBA","$50,647.06","138","https://www.amazon.com/dp/B01635K1AO","https://images-na.ssl-images-amazon.com/images/I/71BQ6l7NYqL._AC_UL600_SR600,400_.jpg","false","false","1","2026-02-01T21:13:54.948Z"
"B0GF94CTM5","2026 New3 Pack Plug In Air Ionizers-Negative Ion Air Purifier for Home Silent Work Air Cleaner for Bathroom,Living Room,Office,Kitchen,Pet Room,Portable Ionic Air Purifier for Bedroom(3)","$25.99","5.0","15","","Home & Kitchen","148973","Home Air Ionizers","61","","","2","1","FBA","$1,775.61","67","https://www.amazon.com/dp/B0GF94CTM5","https://images-na.ssl-images-amazon.com/images/I/61gRwfpyuFL._AC_UL600_SR600,400_.jpg","false","false","1","2026-02-01T21:13:54.949Z"
"B0GHN4M3MM","Air Ionizers for Home (3 Pack）, 99% Odor Eliminator for Pet Odors, Negative Ion Plug in Air Purifiers Ionizer for Home, Bedroom for Bedroom, Kitchen, Office - Dust, Smoke Smell","$26.99","5.0","2","","Home & Kitchen","151966","Home Air Ionizers","62","","","2","1","N/A","$108.25","2","https://www.amazon.com/dp/B0GHN4M3MM","https://images-na.ssl-images-amazon.com/images/I/715NlpIN2pL._AC_UL600_SR600,400_.jpg","false","false","1","2026-02-01T21:13:54.949Z"
"B0CMWP168L","ONAMOR Digital Ozone Generator Odor Eliminator 180,000mg, High Capacity Ozone Machine Odor Removal Up to 8,000 Sq.Ft, Ionizer Deodorizer Ozonator for Home, Car, Smoke, Pet Room","$129.98","4.5","401","","Home & Kitchen","153553","Home Air Ionizers","63","","","5","1","FBA","$19,384.26","160","https://www.amazon.com/dp/B0CMWP168L","https://images-na.ssl-images-amazon.com/images/I/61k-KhJTf3L._AC_UL600_SR600,400_.jpg","false","false","1","2026-02-01T21:13:54.950Z"
"B071XFBXC3","Mammoth Ion and Ozone Generator 3000 mg/hour, Adjustable up to 3,500 SqFt Ionizer & Deodorizer Ozone Odor Eliminator- Ozone Machine Wooden Design Ideal for Dust, Pollen, Pets & Smoke Smell","$129.75","4.3","985","","Home & Kitchen","154216","Home Air Ionizers","64","","","2","1","FBA","$31,056.23","235","https://www.amazon.com/dp/B071XFBXC3","https://images-na.ssl-images-amazon.com/images/I/71LLtcal04L._AC_UL600_SR600,400_.jpg","false","false","1","2026-02-01T21:13:54.951Z"
"B0G4RLXLFG","Air Ionizers (4 Pack）- Plug In Negative Ion Air Purifiers - Quiet Air Freshener for Home, Bedroom, Office, Basement - Portable Air Purifier Odor, Smoke, Dust, Pet Smell - Mini Air Cleaner White","$79.99","","","","Home & Kitchen","155157","Home Air Ionizers","65","","","1","2","N/A","$0.00","N/A","https://www.amazon.com/dp/B0G4RLXLFG","https://images-na.ssl-images-amazon.com/images/I/71ICxF7MuPL._AC_UL600_SR600,400_.jpg","false","false","1","2026-02-01T21:13:54.952Z"
"B0CJV48FJK","VEVOR Ozone Generator, 36000mg/h Ozone Machine, High Capacity Commercial/Industrial Ozone Generator Machine with 0-120 min Time Setting for Rooms, Cars","$40.99","4.6","123","","Home & Kitchen","156852","Home Air Ionizers","66","","","3","1","AMZ","$11,672.58","276","https://www.amazon.com/dp/B0CJV48FJK","https://images-na.ssl-images-amazon.com/images/I/71BDTIC4y1L._AC_UL600_SR600,400_.jpg","false","false","1","2026-02-01T21:13:54.953Z"
"B000HEB99A","Envion - Ionic Pro CA200, Compact Air Purifier Tower For Rooms Up to 200 Sq. Ft. (Black)","$179.95","4.3","1196","","Home & Kitchen","158139","Home Air Ionizers","67","","","1","1","FBA","$22,969.59","128","https://www.amazon.com/dp/B000HEB99A","https://images-na.ssl-images-amazon.com/images/I/616kNSA4R5L._AC_UL600_SR600,400_.jpg","false","false","1","2026-02-01T21:13:54.953Z"
"B07CYTR8XK","Airthereal B50 Mini Ozone Generator Air Purifier- Removes Odors and Sterilizes Air in Small Spaces Up To 320 Sq Ft - Plug in Mini Air Ionizer, Adjustable Ozone Output of 10-50 mg/h","$27.99","4.2","1361","","Home & Kitchen","161185","Home Air Ionizers","68","","","2","1","FBA","$11,514.22","325","https://www.amazon.com/dp/B07CYTR8XK","https://images-na.ssl-images-amazon.com/images/I/61ih+4sGQnL._AC_UL600_SR600,400_.jpg","false","false","1","2026-02-01T21:13:54.954Z"
"B0BDG2XGL8","Maleb Ozone Generator 320,000mg/h - Ozone Machine Odor Removal Odor Eliminator Ionizer Deodorizer Ozonator Ozone Generator Air Purifier for Home/Car/Smoke/Pet Odor","$59.99","4.5","771","","Home & Kitchen","161668","Home Air Ionizers","69","","","1","1","FBA","$26,063.32","372","https://www.amazon.com/dp/B0BDG2XGL8","https://images-na.ssl-images-amazon.com/images/I/61etWHH3U8S._AC_UL600_SR600,400_.jpg","false","false","1","2026-02-01T21:13:54.955Z"
"B07TT5BBH9","VTAR Ozone Machine, 500mg/h Multipurpose Ozone Machine Purify Air, Water, Fruits, Vegetables, Toothbrushes, Aquarium. Fruit Cleaner Device in Water","$49.99","4.6","367","","Home & Kitchen","168381","Home Air Ionizers","70","","","2","1","FBA","$15,127.04","242","https://www.amazon.com/dp/B07TT5BBH9","https://images-na.ssl-images-amazon.com/images/I/81EMA6myiJL._AC_UL600_SR600,400_.jpg","false","false","1","2026-02-01T21:13:54.956Z"
"B0FMXSMX2C","VANSU Mini Battery Powered 20mg/h Ozone Machine for Hunting Home Shoes cabinet Fridge Cat litter(White)","$24.99","4.1","58","","Home & Kitchen","168522","Home Air Ionizers","71","","","3","1","FBA","$5,134.75","205","https://www.amazon.com/dp/B0FMXSMX2C","https://images-na.ssl-images-amazon.com/images/I/61oXGRwUX6L._AC_UL600_SR600,400_.jpg","false","false","1","2026-02-01T21:13:54.956Z"
"B0G6ML22BT","EdenPURE Thunderstorm III Air Purifier – Small Plug-In Ozone Generator & Ionizer – Eliminates Odors, Pet Smells, Smoke, Mold – Filter-Free Portable Cleaner for Home, Travel, Car, Office Use","$129.00","4.1","160","","Home & Kitchen","181567","Home Air Ionizers","72","","","3","2","MERCH","$14,481.02","112","https://www.amazon.com/dp/B0G6ML22BT","https://images-na.ssl-images-amazon.com/images/I/61RYhwaNCHL._AC_UL600_SR600,400_.jpg","false","false","1","2026-02-01T21:13:54.957Z"
"B0CHRNZBFP","0zone Generator, 3500 Sq/Ft 0zone Machine Ionizer for Industrial, Commercial, Home, Car, Basement","$179.99","4.6","57","","Home & Kitchen","182576","Home Air Ionizers","73","","","2","1","FBA","$23,659.72","114","https://www.amazon.com/dp/B0CHRNZBFP","https://images-na.ssl-images-amazon.com/images/I/61pt+VmlcZL._AC_UL600_SR600,400_.jpg","false","false","1","2026-02-01T21:13:54.958Z"
"B08V8N5XNQ","Airthereal PA1K-GO 1,000mg/h Portable Ozone Generator - Cordless Battery Powered Odor Eliminator for Car, Hotel Rooms, Offices, Bathrooms, and Small Spaces (Blue)","$79.99","4.1","589","","Home & Kitchen","186206","Home Air Ionizers","74","","","2","1","FBA","$14,708.05","184","https://www.amazon.com/dp/B08V8N5XNQ","https://images-na.ssl-images-amazon.com/images/I/616HvZA+r1L._AC_UL600_SR600,400_.jpg","false","false","1","2026-02-01T21:13:54.959Z"
"B0FP2C177C","Plug In Air Ionizers - 4Pack Negative Ion Technology Air Purifier, Quiet Mini Air Freshener for Home, Bedroom, Office, Basement - Portable Air Purifiers for Odor, Dust, Smoke, Pets Smell","$38.99","3.9","96","","Home & Kitchen","186671","Home Air Ionizers","75","","","1","1","FBA","$6,018.81","154","https://www.amazon.com/dp/B0FP2C177C","https://images-na.ssl-images-amazon.com/images/I/61x2NZtqcHL._AC_UL600_SR600,400_.jpg","false","false","1","2026-02-01T21:13:54.960Z"
"B07WSF4J3D","i-Wave-R/iWave-R, Residential IAQ ION Generator, Sold Each","$359.99","4.5","221","","Patio, Lawn & Garden","30815","Home Air Ionizers","76","Outdoor Generators","232","1","2","FBA","$28,756.49","80","https://www.amazon.com/dp/B07WSF4J3D","https://images-na.ssl-images-amazon.com/images/I/41bYOWAF1uL._AC_UL600_SR600,400_.jpg","false","false","1","2026-02-01T21:13:54.961Z"
"B0GF7G2CT2","Lmhaichao Home Air Purifier for 99% Strong Odor Pets Poof Cat Litter Deodorizer Plug in Ionizers Air Freshener for Bedroom Kitchen Toilet Pets Litter Box Shoe Cabinet(1)","$25.99","5.0","30","","Home & Kitchen","195740","Home Air Ionizers","77","","","5","1","FBA","$4,455.11","159","https://www.amazon.com/dp/B0GF7G2CT2","https://images-na.ssl-images-amazon.com/images/I/61kniT6MNhL._AC_UL600_SR600,400_.jpg","false","false","1","2026-02-01T21:13:54.962Z"
"B00KSVJH50","AirTamer A310 Rechargeable Personal Air Purifier, Proven Performance, Virus and Pollutant Tested*, Black with Metal Travel Case","$149.99","4.3","1068","","Home & Kitchen","200677","Home Air Ionizers","78","","","2","1","FBA","$25,264.34","173","https://www.amazon.com/dp/B00KSVJH50","https://images-na.ssl-images-amazon.com/images/I/71Nkyefl14L._AC_UL600_SR600,400_.jpg","false","false","1","2026-02-01T21:13:54.962Z"
"B0FVF45HGG","Air Ionizer Plug In-6Pack Negative Ion Air Purifiers Ionizer,Quiet Air Freshener Indoor Portable Cleaner,Wall Plug In Negative Air Purifier for Home,Bedroom,Office,Odor Reducer Pets,Smoke Smell","$39.99","4.9","20","","Home & Kitchen","200931","Home Air Ionizers","79","","","3","1","FBA","$5,018.51","125","https://www.amazon.com/dp/B0FVF45HGG","https://images-na.ssl-images-amazon.com/images/I/61MGTj-ioFL._AC_UL600_SR600,400_.jpg","false","false","1","2026-02-01T21:13:54.963Z"
"B0G2LF946H","Medvoe 0zone Generator for Water & Air - O3 Air Purifier for Home & Car, Ozone Machine Odor Removal for Smoke & Pet (Black)","$69.99","4.5","30","","Home & Kitchen","206404","Home Air Ionizers","80","","","1","1","FBA","$34,727.85","663","https://www.amazon.com/dp/B0G2LF946H","https://images-na.ssl-images-amazon.com/images/I/61vZAleHwVL._AC_UL600_SR600,400_.jpg","false","false","1","2026-02-01T21:13:54.964Z"
"B079C665FN","Ivation 5-in-1 HEPA Air Purifier & Ozone Generator, Ionizer & Deodorizer for Up to 3,700 Sq/Ft – Included HEPA, Carbon and Photocatalytic Filters, with UV Light and Negative Ion Generator","$229.99","4.4","1648","","Home & Kitchen","207337","Home Air Ionizers","81","","","1","1","FBA","$23,964.83","104","https://www.amazon.com/dp/B079C665FN","https://images-na.ssl-images-amazon.com/images/I/71szSzne8EL._AC_UL300_SR300,200_.jpg","false","false","1","2026-02-01T21:13:54.965Z"
"B07K3ZCCFV","Ozone Machine Generator, Multifunctional with Timer, 500mg/h Portable Ozone Machine for Home, Kitchen, Office, Cleaning Water, Fruits and Vegetables","$49.99","4.4","243","","Home & Kitchen","209852","Home Air Ionizers","82","","","2","1","FBA","$4,483.48","87","https://www.amazon.com/dp/B07K3ZCCFV","https://images-na.ssl-images-amazon.com/images/I/61WuYZoDUNL._AC_UL300_SR300,200_.jpg","false","false","1","2026-02-01T21:13:54.966Z"
"B0FRMNPNL2","EEland Cat Litter Deodorizer – 99% Odor Removal, Ozone Air Purifier for Pets, Strong Odor Eliminator for Litter Box, Toilet, Closet, Cabinet, Shoe, Garage","$39.99","4.3","139","","Home & Kitchen","226609","Home Air Ionizers","83","","","3","1","FBA","$5,820.99","149","https://www.amazon.com/dp/B0FRMNPNL2","https://images-na.ssl-images-amazon.com/images/I/61uh4rHzCvL._AC_UL300_SR300,200_.jpg","false","false","1","2026-02-01T21:13:54.967Z"
"B0DP4HVBYD","NAMOWELL Ozone Generator 70000mg, High Capacity Ozone Machine Odor Removal Up to 6000 Sq.Ft, Ozone Odor Eliminator, Ionizer Ozonator for Smoke, Car, Basement, And Pet Room, Blue","$69.99","4.6","191","","Home & Kitchen","249997","Home Air Ionizers","84","","","5","1","FBA","$4,240.89","73","https://www.amazon.com/dp/B0DP4HVBYD","https://images-na.ssl-images-amazon.com/images/I/71TJT8vqWfL._AC_UL300_SR300,200_.jpg","false","false","1","2026-02-01T21:13:54.968Z"
"B014MNU0Z0","Fresh-Aire UV Blue-Tube UV Low Voltage (24-32V) System with 2 Year UV-C Lamp","$337.96","4.4","161","","Home & Kitchen","118796","Home Air Ionizers","85","","","2","1","FBA","$38,291.22","227","https://www.amazon.com/dp/B014MNU0Z0","https://images-na.ssl-images-amazon.com/images/I/51KvZNQtFiL._AC_UL300_SR300,200_.jpg","false","false","1","2026-02-01T21:13:54.969Z"
"B0CCCGGKN4","ELIXRION Ozone Generator – 80,000mg/h High-Capacity O3 Air Purifier for Odor Control Home, Kitchen, Car, Office, Basement, Pets, and Smoke – Covers Up to 6,000 Sq Ft","$99.99","4.6","94","","Home & Kitchen","269224","Home Air Ionizers","86","","","1","1","FBA","$15,028.28","150","https://www.amazon.com/dp/B0CCCGGKN4","https://images-na.ssl-images-amazon.com/images/I/713sd7HCjNL._AC_UL300_SR300,200_.jpg","false","false","1","2026-02-01T21:13:54.970Z"
"B0FSZJ359G","Cat Litter Deodorizer, Cat Odor Eliminator for Home, Litter Box Deodorizer, Quiet Portable Plug In Air Purifiers for Bedroom, Kitchen, Bathroom, Office, Air Ionizers for Smoke, Formaldehyde, Dust","$28.97","4.3","9","","Home & Kitchen","273898","Home Air Ionizers","87","","","1","1","FBA","$1,518.21","48","https://www.amazon.com/dp/B0FSZJ359G","https://images-na.ssl-images-amazon.com/images/I/612uqldfMjL._AC_UL300_SR300,200_.jpg","false","false","1","2026-02-01T21:13:54.971Z"
"B0F3J1NNK7","Ozone Generator 90,000mg, 3-Level Ozone Adjustment and Triple-Layer Ozone Output Board–Ozone Machine for Areas Up to 5,500 sq. ft,Ozone Odor Eliminator for Home, Cars, Rooms, Smoke, and Pet (Green)","$77.97","4.6","86","","Home & Kitchen","275275","Home Air Ionizers","88","","","1","1","FBA","$74,847.71","960","https://www.amazon.com/dp/B0F3J1NNK7","https://images-na.ssl-images-amazon.com/images/I/716jKgbFluL._AC_UL300_SR300,200_.jpg","false","false","1","2026-02-01T21:13:54.972Z"
"B0GFDSSZ3S","2PCS Magair Air Purifier for Mold, Magair Air Purifier Plug in, Mag Air Purifiers, Magair Ionic Air Purifi-er, Suitable for Bedrooms, Toilets, Living Room, Closets, Pet Room","$19.99","5.0","3","","Home & Kitchen","276576","Home Air Ionizers","89","","","1","1","FBA","$275.22","14","https://www.amazon.com/dp/B0GFDSSZ3S","https://images-na.ssl-images-amazon.com/images/I/51B2BFNRNkL._AC_UL300_SR300,200_.jpg","false","false","1","2026-02-01T21:13:54.973Z"
"B0FD8QH7MW","Plug In Negative Ion Air Purifiers,Air Ionizers,Negative Ion Filtration System,Quiet Mini Air Cleaner, Bedroom,Office,Basement-Portable Air Purifier Odor,Smoke,Dust,Pet Smell.4 Pack","$27.49","4.4","38","","Home & Kitchen","277875","Home Air Ionizers","90","","","3","1","FBA","$2,853.68","115","https://www.amazon.com/dp/B0FD8QH7MW","https://images-na.ssl-images-amazon.com/images/I/61Bj6XIbqIL._AC_UL300_SR300,200_.jpg","false","false","1","2026-02-01T21:13:54.975Z"
"B0FCRTTYPG","COMTAR Air Ionizers for Home (4 Pack), Negative Ion Filtration System, Quiet Air Freshener for Bedroom, Office, Kitchen, Portable Air Filter Odor, Smoke Dust, Pets, Eliminator, Mini Air Cleaner","$18.32","3.6","87","","Home & Kitchen","280659","Home Air Ionizers","91","","","1","1","FBA","$854.59","45","https://www.amazon.com/dp/B0FCRTTYPG","https://images-na.ssl-images-amazon.com/images/I/61oO8FNUelL._AC_UL300_SR300,200_.jpg","false","false","1","2026-02-01T21:13:54.976Z"
"B0F2MS128F","Ozone Generator Odor Eliminator Machine - 2-In-1 Air Ionizer Purifier 160,000mg/H High Capacity O3 Deodorizer With Temp/Humidity Display, Ozonator For Home, Car, House, Hotel, Kitchen, & Pet Areas","$69.99","4.3","9","","Home & Kitchen","283914","Home Air Ionizers","92","","","1","1","FBA","$3,417.66","48","https://www.amazon.com/dp/B0F2MS128F","https://images-na.ssl-images-amazon.com/images/I/71DA9TnYTuL._AC_UL300_SR300,200_.jpg","false","false","1","2026-02-01T21:13:54.977Z"
"B0FNRJB4KW","Air Ionizers (4 Pack）- Plug In Negative Ion Air Purifiers - Quiet Air Freshener for Home, Bedroom, Office, Basement - Portable Air Purifier Odor, Smoke, Dust, Pet Smell - Mini Air Cleaner White","$59.99","4.1","126","","Home & Kitchen","284148","Home Air Ionizers","93","","","1","2","FBA","$14,726.49","245","https://www.amazon.com/dp/B0FNRJB4KW","https://images-na.ssl-images-amazon.com/images/I/71ICxF7MuPL._AC_UL300_SR300,200_.jpg","false","false","1","2026-02-01T21:13:54.978Z"
"B08QZ5RZNH","Negative Ion Air Purifier Plug-in,Portable Negative Ion Generator for Home, For Use in Rooms With Odors, Smoke& More Suitable for Bedrooms, Study Rooms, Toilets, Garages，Small Room","$8.99","4.0","937","","Home & Kitchen","284816","Home Travel-Size Air Purifiers","71","Home Air Ionizers","94","2","1","FBA","$2,174.07","119","https://www.amazon.com/dp/B08QZ5RZNH","https://images-na.ssl-images-amazon.com/images/I/61BOre4Pw4L._AC_UL300_SR300,200_.jpg","false","false","1","2026-02-01T21:13:54.979Z"
"B0FR4TVWLS","Ozone Odor Eliminator for Strong Odor 10,000mAh Rechargeable Cat Litter Deodorizer Dog Poof Odor Removal Ozone Air Purifier for Bedroom Toilet Kitchen Pets Shoe Smoke Car Formaldehyde Air Freshener","$49.98","4.0","18","","Home & Kitchen","285731","Home Air Ionizers","95","","","3","1","FBA","$2,215.68","44","https://www.amazon.com/dp/B0FR4TVWLS","https://images-na.ssl-images-amazon.com/images/I/71Tr-JxS+4L._AC_UL300_SR300,200_.jpg","false","false","1","2026-02-01T21:13:54.980Z"
"B09ZXWWBN5","Ionizing Air Blower Fan Ion Anti-Static Elimination Discharge ESD Blower Fan 110V Ionizer Desktop Fan Eliminator","$54.58","3.8","17","","Home & Kitchen","285849","Home Air Ionizers","96","","","1","2","FBA","$1,869.57","39","https://www.amazon.com/dp/B09ZXWWBN5","https://images-na.ssl-images-amazon.com/images/I/81Xani7lxlL._AC_UL300_SR300,200_.jpg","false","false","1","2026-02-01T21:13:54.982Z"
"B0FDWVCPQB","Air Ionizers Plug In Negative Ion Air Purifiers Quiet Air Freshener for Home Bedroom Office Basement - Portable Mini Air Cleaner Odor, Smoke, Dust, Pet Smell (2, White)","$23.99","4.1","340","","Home & Kitchen","66526","Home Air Ionizers","97","","","6","1","FBA","$37,411.93","1,045","https://www.amazon.com/dp/B0FDWVCPQB","https://images-na.ssl-images-amazon.com/images/I/713jbNDhAxL._AC_UL300_SR300,200_.jpg","false","false","1","2026-02-01T21:13:54.983Z"
"B076PB2HD4","WSTA Portable Ozone Generator,Multipurpose Ozone Machine with Timer for Home,Room,Office,Hunting","$49.99","4.5","872","","Home & Kitchen","290442","Home Air Ionizers","98","","","1","1","FBA","$4,258.39","85","https://www.amazon.com/dp/B076PB2HD4","https://images-na.ssl-images-amazon.com/images/I/71SY6ohBfTL._AC_UL300_SR300,200_.jpg","false","false","1","2026-02-01T21:13:54.984Z"
"B0BRS3WBJD","Mini USB Fridge Deodorizer with Led Display, Rechargeable Refrigerator Deodorizer, Reusable Fridge Odor Eliminator for Fridge, Car, Closet, Wardrobe, More Effective Than Baking Soda and Charcoal Bags","$18.99","3.8","938","","Home & Kitchen","284765","Home Air Ionizers","99","","","2","1","FBA","$1,053.63","55","https://www.amazon.com/dp/B0BRS3WBJD","https://images-na.ssl-images-amazon.com/images/I/51lh9eoSlqL._AC_UL300_SR300,200_.jpg","false","false","1","2026-02-01T21:13:54.985Z"
"B0FLC89VJC","Portable Air Purifier– Wearable Personal Ionizer for Cleaner Air Necklace, Compact & Rechargeable, Ideal for Travel, Office, and Outdoor Use – 120 million Ions","$49.59","4.2","11","","Home & Kitchen","293975","Home Air Ionizers","100","","","2","1","FBA","$3,692.97","91","https://www.amazon.com/dp/B0FLC89VJC","https://images-na.ssl-images-amazon.com/images/I/718IEGRePyL._AC_UL300_SR300,200_.jpg","false","false","1","2026-02-01T21:13:54.986Z"