asin,title,price,rating,reviews,countryOfOrigin,category1,bsr1,category2,bsr2,category3,bsr3,variations,sellers,fulfillment,revenue30d,unitSales30d,url,image,isPrime,isSponsored,pageNum,scrapedAt
"B0CYCL5T9F","Ozone Generator 45,000mg/h, Industrial O3 Deodorizer for Areas of 2500 Square Feet - High Capacity Ozone Machine Air Ionizer Odor Clean","$40.60","4.8","2348","","Home & Kitchen","1947","Home Air Ionizers","1","","","1","2","FBA","$314,850.76","5,387","https://www.amazon.com/dp/B0CYCL5T9F","https://images-na.ssl-images-amazon.com/images/I/71OJU4+xf3L._AC_UL600_SR600,400_.jpg","false","false","1","2026-02-01T21:12:23.920Z"
"B0DK2YVGQR","Ozone Generator 48,000mg, Commercial Ozone Machine Odor Removal, High Capacity O3 Ionizer Air Purifier Deodorizer, Portable Mini for Car, Home, Smoke, Pets, Industrial, for 4000 Square Feet -Black","$64.31","4.6","1027","","Home & Kitchen","2195","Home Air Ionizers","2","","","2","1","AMZ","$312,805.02","7,721","https://www.amazon.com/dp/B0DK2YVGQR","https://images-na.ssl-images-amazon.com/images/I/71HWCR0HSWL._AC_UL600_SR600,400_.jpg","false","false","1","2026-02-01T21:12:23.921Z"
"B0F83XMKHC","LabCharge Small Ionic Air Purifier for Home & Bedroom – Silent HEPA Filter – Covers 250 Sq Ft - Free Cleaner for Pets, Hair, Smoke, Dust, Odors & Dander – Compact & Black Design - Pack of 2","$89.99","4.1","469","","Home & Kitchen","9894","Home Air Ionizers","3","","","3","1","FBA","$225,212.60","2,541","https://www.amazon.com/dp/B0F83XMKHC","https://images-na.ssl-images-amazon.com/images/I/61c8CfkM8UL._AC_UL600_SR600,400_.jpg","false","false","1","2026-02-01T21:12:23.921Z"
"B0D54RSQLS","Air Ionizers for Home (3 Pack), Negative Ion Generator, Quiet Air Freshener for Bedroom, Office, Kitchen, Portable Air Filter Odor, Smoke Dust, Pets, Eliminator, Mini Air Cleaner","$29.99","4.1","634","","Home & Kitchen","18072","Home Air Ionizers","4","","","3","3","FBA","$46,192.36","1,445","https://www.amazon.com/dp/B0D54RSQLS","https://images-na.ssl-images-amazon.com/images/I/71OHuE8pmYL._AC_UL600_SR600,400_.jpg","false","false","1","2026-02-01T21:12:23.922Z"
"B0G5N4CMFM","2026 Upgraded Air Ionizers for Home & Dust Mites Plug in Air Purifier with Negative Ion Generator, Quiet Odor Eliminator for Bedroom, Office, Kitchen, Pet Odor, Smoke, Dust,8 Pack","","5.0","7","","Home & Kitchen","21328","Home Air Ionizers","5","","","4","1","FBA","$14,854.24","304","https://www.amazon.com/dp/B0G5N4CMFM","https://images-na.ssl-images-amazon.com/images/I/61igycU2vaL._AC_UL600_SR600,400_.jpg","false","false","1","2026-02-01T21:12:23.923Z"
"B00JAP7388","Enerzen Ozone Generator 60,000mg Industrial O3 Air Purifier Deodorizer (60,000mg - Black)","$74.95","4.6","26533","","Home & Kitchen","26022","Home Air Ionizers","6","","","3","1","FBA","$140,997.82","1,203","https://www.amazon.com/dp/B00JAP7388","https://images-na.ssl-images-amazon.com/images/I/61ZcJLVApfL._AC_UL600_SR600,400_.jpg","false","false","1","2026-02-01T21:12:23.924Z"
"B0795P2674","Airthereal MA5000 Commercial Ozone Generator, High Capacity Ozone Machine Odor Removal - Home Air Ionizers O3 Deodorizer for Rooms, Smoke, Cars and Pets, Eliminate Odors up to 2000sq.ft., Blue","$69.99","4.6","7655","","Home & Kitchen","29686","Home Air Ionizers","7","","","4","2","FBA","$84,889.25","1,507","https://www.amazon.com/dp/B0795P2674","https://images-na.ssl-images-amazon.com/images/I/71Y+RuT49iL._AC_UL600_SR600,400_.jpg","false","false","1","2026-02-01T21:12:23.924Z"
"B0DFTHNWWW","Medvoe 0zone Generator 65000mg - O3 Air Purifier for Home & Car, Ozone Machine Odor Removal for Smoke & Pet (Black)","$49.98","4.5","1379","","Home & Kitchen","32983","Home Air Ionizers","8","","","4","4","FBA","$95,040.35","1,461","https://www.amazon.com/dp/B0DFTHNWWW","https://images-na.ssl-images-amazon.com/images/I/61SRSyFih2L._AC_UL600_SR600,400_.jpg","false","false","1","2026-02-01T21:12:23.925Z"
"B0F1F6JS4D","6Pack Air Ionizer Plug In, Filterless Home Negative Air Purifier, Quiet Air Freshener Portable Cleaner for Odors Smoke Dust, Air Purifiers for Home Office, Bedroom, Bathroom","$45.99","4.2","253","","Home & Kitchen","34478","Home Air Ionizers","9","","","2","1","FBA","$34,755.46","725","https://www.amazon.com/dp/B0F1F6JS4D","https://images-na.ssl-images-amazon.com/images/I/71sa4z+x+mL._AC_UL600_SR600,400_.jpg","false","false","1","2026-02-01T21:12:23.926Z"
"B0GF23HW7T","2Pcs Indoor Air Purification Dust Removal Magic Box,Multi-Functional Air Magic Box,Automatic Dust Collection Air Box for Home,Odor Eliminator Air Freshener,Automatic Air Essence Box for Home,Bathroom","$28.99","4.2","2","","Home & Kitchen","41284","Home Air Ionizers","10","","","1","1","FBA","$5,959.42","260","https://www.amazon.com/dp/B0GF23HW7T","https://images-na.ssl-images-amazon.com/images/I/71F8cqTHvpL._AC_UL600_SR600,400_.jpg","false","false","1","2026-02-01T21:12:23.926Z"
"B0FC6BMNZP","Morrerfresh Cat Litter Deodorizer – 99% Odor Eliminator for Strong Pet Odors, Plug In Negative Ion Air Purifier for Litter Box, Home, Kitchen, Bathroom, Ozone-Free & Quiet Portable (Unscented)","$29.99","3.9","853","","Home & Kitchen","41426","Home Air Ionizers","11","","","3","1","FBA","$56,689.45","1,667","https://www.amazon.com/dp/B0FC6BMNZP","https://images-na.ssl-images-amazon.com/images/I/51qb4NzkT8L._AC_UL600_SR600,400_.jpg","false","false","1","2026-02-01T21:12:23.927Z"
"B0FPKPWVBT","Morrerfresh Cat Litter Deodorizer & Pet Odor Eliminator for Home, Ozone Air Purifier Plug in for Strong Dog Poof, Litter Box Deodorizer with 5 Mode for Smoke, Wardrobe, Garage, Car","$39.99","4.7","63","","Home & Kitchen","43255","Home Air Ionizers","12","","","2","1","FBA","$47,471.95","1,161","https://www.amazon.com/dp/B0FPKPWVBT","https://images-na.ssl-images-amazon.com/images/I/61xDgImjXSL._AC_UL600_SR600,400_.jpg","false","false","1","2026-02-01T21:12:23.928Z"
"B0D2Q9XCV1","PowerScale Ozone Generator 90,000mg/h O3 Intelligent Control Ozone Odor Eliminator Commercial Ozone Machine Odor Removal, For Home, Car, Pet Room - High Capacity Ionizer Ozone Air Purifier, Black","$47.99","4.6","595","","Home & Kitchen","44467","Home Air Ionizers","13","","","3","1","FBA","$89,154.33","1,211","https://www.amazon.com/dp/B0D2Q9XCV1","https://images-na.ssl-images-amazon.com/images/I/71k48wWc1WL._AC_UL600_SR600,400_.jpg","false","false","1","2026-02-01T21:12:23.929Z"
"B0FC5WKTTT","Plug in Air Ionizers 60 Million Negative Ions Out Put, 2 in 1 Ozone Odor Eliminator and Air Ionizers for Home, Kitchen, Bedroom, Office, Mini Air Cleaner for Dust, Smoke, Pets, 2 Pack","$45.99","4.5","40","","Home & Kitchen","47329","Home Air Ionizers","14","","","1","1","FBA","$2,917.38","49","https://www.amazon.com/dp/B0FC5WKTTT","https://images-na.ssl-images-amazon.com/images/I/71vtQkGwlJL._AC_UL600_SR600,400_.jpg","false","false","1","2026-02-01T21:12:23.929Z"
"B0CLHWTJ22","Morrerfresh Ozone Odor Eliminator for Strong Odor 99% Cat Litter Deodorizer Dog Poof Odor Removal Air Ionizers for Home Portable Air Purifier for Pets Toilet Wardrobe Shoe Garage Room Cabinet White","$38.99","4.2","721","","Home & Kitchen","51831","Home Air Ionizers","15","","","1","2","FBA","$34,261.20","1,009","https://www.amazon.com/dp/B0CLHWTJ22","https://images-na.ssl-images-amazon.com/images/I/71qft4KbE9L._AC_UL600_SR600,400_.jpg","false","false","1","2026-02-01T21:12:23.930Z"
"B09GFWRW9N","ONAMOR Ozone Generator 77000mg, Ozone Machine Ionizer O3 Deodorizer for Home, Basement, Smoke, and Pet Room (Eliminating Odors Area up to 4000 Square Feet, All Metallic Black)","$39.99","4.5","1688","","Home & Kitchen","52292","Home Air Ionizers","16","","","2","1","FBA","$52,260.83","1,187","https://www.amazon.com/dp/B09GFWRW9N","https://images-na.ssl-images-amazon.com/images/I/71UV3IotgLL._AC_UL600_SR600,400_.jpg","false","false","1","2026-02-01T21:12:23.931Z"
"B0DKNS19HX","Ozone Odor Eliminator for Strong Odor 99% Cat Litter Deodorizer Pets Poof Odor Removal Air Ionizers Home Plug-in Air Purifier for Bedroom, Toilet, Kitchen, Shoe, Smoke, Formaldehyde Air Freshener","$31.98","4.3","1111","","Home & Kitchen","20358","Home Air Ionizers","17","","","2","1","FBA","$36,974.30","1,229","https://www.amazon.com/dp/B0DKNS19HX","https://images-na.ssl-images-amazon.com/images/I/71Cg1mGCjVL._AC_UL600_SR600,400_.jpg","false","false","1","2026-02-01T21:12:23.932Z"
"B0FZKB8KQV","2026 New Plug in Air Purifiers Air Ionizers for Dust Mites, Odor Eliminator for Home with Negative Ion Generator, Quiet Portable Air Freshener Plug In for Bedroom,Office,Kitchen,Smoke,Dust (8Pack)","$59.98","5.0","25","","Home & Kitchen","37649","Home Air Ionizers","18","","","2","1","FBA","$60.74","1","https://www.amazon.com/dp/B0FZKB8KQV","https://images-na.ssl-images-amazon.com/images/I/61+RMdgrnxL._AC_UL600_SR600,400_.jpg","false","false","1","2026-02-01T21:12:23.933Z"
"B0CHJCGPLQ","Ozone Generator 68,000mg/h, Commercial Ozone Machine Odor Removal, High Capacity Ozone Machine, Home Ozone Generator for Car, Home, Smoke, Pet, etc (Black) - by TTDMK","$37.98","4.5","2158","","Home & Kitchen","53503","Home Air Ionizers","19","","","6","2","FBA","$47,896.40","1,015","https://www.amazon.com/dp/B0CHJCGPLQ","https://images-na.ssl-images-amazon.com/images/I/71vglX7jB1L._AC_UL600_SR600,400_.jpg","false","false","1","2026-02-01T21:12:23.933Z"
"B0FJRYY3R4","PVACG 4Pack Plug In Air Purifier for Home Mini Ionic Air Purifier for Small Room Quiet Working Air Ionizers for Home,Office, Bedroom,Living Room,Portable Air Freshener for Odor,Pets Smell(4)","$34.99","4.8","48","","Home & Kitchen","55986","Home Air Ionizers","20","","","5","2","FBA","$13,248.86","379","https://www.amazon.com/dp/B0FJRYY3R4","https://images-na.ssl-images-amazon.com/images/I/61xUNDIqYTL._AC_UL600_SR600,400_.jpg","false","false","1","2026-02-01T21:12:23.934Z"
"B0G3PF49NC","Air Purifier Ozone & Negative Ion 99% Odor Eliminator for Pet,Cat Litter Deodorizer,Dog Poop Odor Removal | Plug-In Air Ionizer Ozone Generator Air Purifier for Home, Pets, Cars,Bedroom-White","$37.31","4.9","35","","Home & Kitchen","57467","Home Air Ionizers","21","","","4","1","FBA","$16,710.57","445","https://www.amazon.com/dp/B0G3PF49NC","https://images-na.ssl-images-amazon.com/images/I/51+J6txYJVL._AC_UL600_SR600,400_.jpg","false","false","1","2026-02-01T21:12:23.935Z"
"B0G52581WZ","2026 Upgraded Air Ionizers for Dust Mites Plug in Air Purifier with Negative Ion Generator Quiet Odor Eliminator for Home, Bedroom, Office, Kitchen, Pet Odor, Smoke, Dust,6 Pack(Black)","$45.99","5.0","18","","Home & Kitchen","58666","Home Air Ionizers","22","","","3","1","FBA","$91.98","2","https://www.amazon.com/dp/B0G52581WZ","https://images-na.ssl-images-amazon.com/images/I/61JaUNxqtEL._AC_UL600_SR600,400_.jpg","false","false","1","2026-02-01T21:12:23.936Z"
"B0CZ8WQ739","ONAMOR Ozone Generator Odor Eliminator 70000mg, High Capacity Ozone Machine Odor Removal Up to 6000 Sq.Ft, Ionizer Ozonator for Smoke, Car, Basement And Pet Room, Black","$49.99","4.6","759","","Home & Kitchen","61050","Home Air Ionizers","23","","","2","1","FBA","$58,728.93","1,194","https://www.amazon.com/dp/B0CZ8WQ739","https://images-na.ssl-images-amazon.com/images/I/71z8HSCIOuL._AC_UL600_SR600,400_.jpg","false","false","1","2026-02-01T21:12:23.937Z"
"B0F6NFB6CK","HHGM 198,000mg/h Dual-Fan Ozone Machine Generator High Capacity Ozone Odor Eliminator Odor Removal Air Purifier Ionizer & Deodorizer for Car, Home, Smoke, Pets, Industrial, Basement, Commercial","$93.39","4.5","467","","Home & Kitchen","63920","Home Air Ionizers","24","","","3","2","FBA","$56,106.73","803","https://www.amazon.com/dp/B0F6NFB6CK","https://images-na.ssl-images-amazon.com/images/I/71S-x73S6aL._AC_UL600_SR600,400_.jpg","false","false","1","2026-02-01T21:12:23.938Z"
"B00FBMJK9Y","OION Technologies B-1000 Permanent Filter Ionic Air Purifier Pro Ionizer with UV-C, New","","4.1","13666","","Home & Kitchen","64076","Home Air Ionizers","25","","","1","1","FBA","$69,900.50","699","https://www.amazon.com/dp/B00FBMJK9Y","https://images-na.ssl-images-amazon.com/images/I/61Uujew57NL._AC_UL600_SR600,400_.jpg","false","false","1","2026-02-01T21:12:23.939Z"
"B0F83PJLN9","2026 Upgraded Ozone Generator, High Capacity Ozone Machine Odor Removal Up to 6000 Sq.Ft, for Car/Home/Smoke/Pet Odor, Black","$59.99","4.6","232","","Home & Kitchen","64625","Home Air Ionizers","26","","","3","1","FBA","$50,090.68","989","https://www.amazon.com/dp/B0F83PJLN9","https://images-na.ssl-images-amazon.com/images/I/81DYK-SPAzL._AC_UL600_SR600,400_.jpg","false","false","1","2026-02-01T21:12:23.939Z"
"B0F2J1JK9Y","Ozone Generator 160,000mg/H with Temp/Humidity Display - 120 Min Timer O3 Ionizer Air Purifier for Large Spaces (5000 Sq.Ft) - Upgraded Ozone Machine for Cars, Homes, Hotels, Kitchens & Pet Areas","$69.99","4.5","171","","Home & Kitchen","64636","Home Air Ionizers","27","","","2","1","FBA","$73,899.87","1,092","https://www.amazon.com/dp/B0F2J1JK9Y","https://images-na.ssl-images-amazon.com/images/I/71AhAc4nAeL._AC_UL600_SR600,400_.jpg","false","false","1","2026-02-01T21:12:23.940Z"
"B0DGPT12B1","Ozone Generator 90,000mg/h for Up to 6,000 Sq Ft, High-Capacity Commercial Ozone Machine with Timer, Portable Air Purifier & Deodorizer for Home, Basement, Smoke, Pets, Car, Office","$39.00","4.6","179","","Home & Kitchen","66258","Home Air Ionizers","28","","","1","1","FBA","$33,989.03","955","https://www.amazon.com/dp/B0DGPT12B1","https://images-na.ssl-images-amazon.com/images/I/51yaIUdOlJL._AC_UL600_SR600,400_.jpg","false","false","1","2026-02-01T21:12:23.941Z"
"B07YN9385D","Clarifion - Air Ionizers for Home (3 Pack), Negative Ion Filtration System, Quiet Air Freshener for Bedroom, Office, Kitchen, Portable Air Filter Odor, Smoke Dust, Pets, Eliminator, Mini Air Cleaner","$110.91","4.0","15491","","Home & Kitchen","66328","Home Air Ionizers","29","","","2","1","FBA","$91,949.49","891","https://www.amazon.com/dp/B07YN9385D","https://images-na.ssl-images-amazon.com/images/I/71-LBzA03YL._AC_UL600_SR600,400_.jpg","false","false","1","2026-02-01T21:12:23.942Z"
"B0DPQHDWGW","Powerscale Ozone Generator 55,000 mg/h, Compact, 10s Safety Evacuation, Precision Electronic Control, O3 Odor Eliminator for Home, Car, Pet Smell, and Basement up to 2400 Sq.Ft - OZE1, Black","$19.99","4.3","54","","Home & Kitchen","66556","Home Air Ionizers","30","","","1","1","FBA","$943.97","42","https://www.amazon.com/dp/B0DPQHDWGW","https://images-na.ssl-images-amazon.com/images/I/61tKPB38ckL._AC_UL600_SR600,400_.jpg","false","false","1","2026-02-01T21:12:23.943Z"
"B0FC5YZ1C5","Plug-In Ionic Air Purifier (4), Home Air Ionizer, Silent Filterless Air Purifier, Silent Filterless Air Purifier for Home, Portable Negative Ion Air Freshener for Pet Odors, Dust, and Smoke.","$39.99","4.2","222","","Home & Kitchen","68026","Home Air Ionizers","31","","","3","1","FBA","$24,455.86","520","https://www.amazon.com/dp/B0FC5YZ1C5","https://images-na.ssl-images-amazon.com/images/I/61+80sa7MAL._AC_UL300_SR300,200_.jpg","false","false","1","2026-02-01T21:12:23.944Z"
"B0FVFSCG3N","Home Negative Ion Air Purifier 4 Pack, Plug In Air Purifier & Mini Portable Silent Air Freshener for Dust Mites in Bedroom, Study, Kitchen, Bathroom, Living Room (4)","$29.99","4.8","17","","Home & Kitchen","70131","Home Air Ionizers","32","","","2","1","N/A","$7,699.90","193","https://www.amazon.com/dp/B0FVFSCG3N","https://images-na.ssl-images-amazon.com/images/I/618B55DesYL._AC_UL300_SR300,200_.jpg","false","false","1","2026-02-01T21:12:23.945Z"
"B0DBZT9VDY","Ozone Generator 60000mg/h, Industrial/Home Ozone Machine, Odor Removal for Areas of 6,000 Square Feet, High Capacity Odor Eliminator for Car, Rooms, Smoke, Pets, O3 Air Purifier Deodorizes (Black)","$37.99","4.5","544","","Home & Kitchen","71935","Home Air Ionizers","33","","","1","1","FBA","$35,602.35","914","https://www.amazon.com/dp/B0DBZT9VDY","https://images-na.ssl-images-amazon.com/images/I/81GjDJllfaL._AC_UL300_SR300,200_.jpg","false","false","1","2026-02-01T21:12:23.946Z"
"B0FFP2WY67","Timeage Ozone Generator for Car, 2-in-1 Ozone Machine+ Air Ionizer to Clean Pet Odor, Cigarette Smell, Dust,Pollen for Travel, Home, Portable Size, Filterless, Rechargeable,Odor Deodorizer","$58.59","4.9","11","","Home & Kitchen","75555","Home Air Ionizers","34","","","2","1","FBA","$12,707.13","216","https://www.amazon.com/dp/B0FFP2WY67","https://images-na.ssl-images-amazon.com/images/I/71iXmUnfN4L._AC_UL300_SR300,200_.jpg","false","false","1","2026-02-01T21:12:23.947Z"
"B00NHR6S22","OdorStop OS2500UV Professional Grade Ozone Generator Ionizer for Areas of 2500 Square Feet+, For Deodorizing and Purifying Medium Size Areas Such as Hotel Rooms, Offices, and Basements","$279.99","4.4","1105","","Home & Kitchen","82968","Home Air Ionizers","35","","","3","1","FBA","$113,107.03","378","https://www.amazon.com/dp/B00NHR6S22","https://images-na.ssl-images-amazon.com/images/I/61WQlJioioL._AC_UL300_SR300,200_.jpg","false","false","1","2026-02-01T21:12:23.948Z"
"B0DQ238RWD","Amgwhhoo Ozone Generator Machine160,000mg/h, High Capacity Ozone Odor Eliminator Removal Air Purifier for Home Car Pet & Basement Odor, Suitable for Spaces up to 7,000 Square Feet, Blue","$63.70","4.6","233","","Home & Kitchen","83187","Home Air Ionizers","36","","","2","1","FBA","$42,675.58","673","https://www.amazon.com/dp/B0DQ238RWD","https://images-na.ssl-images-amazon.com/images/I/71UJ3q4s7ML._AC_UL300_SR300,200_.jpg","false","false","1","2026-02-01T21:12:23.950Z"
"B0D7CH7JRB","Ozone Odor Eliminator for Strong Odor 99% Cat Litter Deodorizer Dog Poof Odor Removal Air Ionizers Home Plug-in Air Purifier for Bedroom, Toilet, Kitchen, Pets, Shoe, Smoke, Formaldehyde Air Freshener","$29.98","4.2","662","","Home & Kitchen","84714","Home Air Ionizers","37","","","3","1","FBA","$1,677.05","56","https://www.amazon.com/dp/B0D7CH7JRB","https://images-na.ssl-images-amazon.com/images/I/61uJCCiE62L._AC_UL300_SR300,200_.jpg","false","false","1","2026-02-01T21:12:23.951Z"
"B0CYNHWF9V","Ion Pure Plug In Air Purifier for Home | Negative Ion Technology for Allergen and Odor Reduction No Filter Compact, Quiet Operation Air Ionizers for Home Kitchen, Bedroom, Bathroom Air Purifiers","$44.99","4.0","720","","Home & Kitchen","85548","Home Air Ionizers","38","","","1","1","MERCH","$21,903.66","487","https://www.amazon.com/dp/B0CYNHWF9V","https://images-na.ssl-images-amazon.com/images/I/716Wq1NAfjL._AC_UL300_SR300,200_.jpg","false","false","1","2026-02-01T21:12:23.952Z"
"B07YN91J8M","Clarifion - Air Ionizers for Home (1 Pack), Negative Ion Filtration System, Quiet Air Freshener for Bedroom, Office, Kitchen, Portable Air Filter Odor, Smoke Dust, Pets, Eliminator, Mini Air Cleaner","","4.0","13452","","Home & Kitchen","88390","Home Air Ionizers","39","","","1","1","FBA","$85,954.70","1,914","https://www.amazon.com/dp/B07YN91J8M","https://images-na.ssl-images-amazon.com/images/I/71ETltMP1QL._AC_UL300_SR300,200_.jpg","false","false","1","2026-02-01T21:12:23.953Z"
"B0GGN5MWK3","Air Ionizers for Home 4Pack,2026 Upgraded Plug-in Air Purifier with Negative Ion Technology, Odor Eliminator for Pet, Smoke, Dust-Quiet Portable Air Freshener for Bedroom, Office, Kitchen, Litter Box","$39.99","4.9","31","","Home & Kitchen","89308","Home Air Ionizers","40","","","3","1","FBA","$2,039.49","51","https://www.amazon.com/dp/B0GGN5MWK3","https://images-na.ssl-images-amazon.com/images/I/71+VNyiNWML._AC_UL300_SR300,200_.jpg","false","false","1","2026-02-01T21:12:23.954Z"
"B07YN9M3LG","Clarifion - Air Ionizers for Home (6 Pack), Negative Ion Filtration System, Quiet Air Freshener for Bedroom, Office, Kitchen, Portable Air Filter Odor, Smoke Dust, Pets, Eliminator, Mini Air Cleaner","$214.99","4.1","4940","","Home & Kitchen","89327","Home Air Ionizers","41","","","2","1","FBA","$170,765.91","794","https://www.amazon.com/dp/B07YN9M3LG","https://images-na.ssl-images-amazon.com/images/I/71Wj8w4bQtL._AC_UL300_SR300,200_.jpg","false","false","1","2026-02-01T21:12:23.955Z"
"B0G2BFL1JD","Plug In Air Ionizers for Home & Dust Mites, Air Purifier Negative Ion Generator, Portable Quiet Filterless Air Freshener Odor Eliminators for Office Kitchen, Mini Air Cleaner for Pet Odor,Smoke Smell","","4.6","18","","Home & Kitchen","90831","Home Air Ionizers","42","","","2","1","FBA","$5,635.46","188","https://www.amazon.com/dp/B0G2BFL1JD","https://images-na.ssl-images-amazon.com/images/I/71F81DSq76L._AC_UL300_SR300,200_.jpg","false","false","1","2026-02-01T21:12:23.956Z"
"B0FFGLY1TK","120,000mg/h Ozone Generator, High-Capacity Ozone Odor Eliminator with Negative Ion, Ozone Machine Odor Removal for Car, Home, Pets, Smoke, Commercial/Industrial Use - Covers Up to 6,000 Sq.Ft","$69.99","4.3","147","","Home & Kitchen","96977","Home Air Ionizers","43","","","3","1","FBA","$43,640.27","681","https://www.amazon.com/dp/B0FFGLY1TK","https://images-na.ssl-images-amazon.com/images/I/71BJyJHwnWL._AC_UL300_SR300,200_.jpg","false","false","1","2026-02-01T21:12:23.958Z"
"B0G2JN3HZM","KLVEU Ion Clear Air purifiers Plug in Air Ionizers for Home Portable and Quiet Ionic Air Purifiers for Bedroom Toilet Office Kitchen and Pets(2)","$29.99","5.0","10","","Home & Kitchen","97423","Home Air Ionizers","44","","","4","1","FBA","$2,077.94","69","https://www.amazon.com/dp/B0G2JN3HZM","https://images-na.ssl-images-amazon.com/images/I/51DDfD1ZTUL._AC_UL300_SR300,200_.jpg","false","false","1","2026-02-01T21:12:23.959Z"
"B0FYQHMTR2","PVACG 6Pack Plug In Ionic Air Purifier,Negative Ion Air Purifier for Home Portable Plug-In Air Ionizers for Smoke, Pets Smell Quiet Mini Air Freshener for Home, Bedroom, Office, Living Room (6)","$49.99","5.0","17","","Home & Kitchen","101308","Home Air Ionizers","45","","","3","1","FBA","$2,649.47","53","https://www.amazon.com/dp/B0FYQHMTR2","https://images-na.ssl-images-amazon.com/images/I/61wxD5DszIL._AC_UL300_SR300,200_.jpg","false","false","1","2026-02-01T21:12:23.960Z"
"B0FY6HBWXN","Air Purifier Plug In 4 Pack,Air Ionizer Purifier For Home Plug In,Portable Negative Ion Generator,Ionic Air Freshener For Pet Odor,Kitchen Odor,Dust,Smoke Smell","$39.99","4.3","61","","Home & Kitchen","108231","Home Air Ionizers","46","","","1","2","FBA","$43,814.31","1,096","https://www.amazon.com/dp/B0FY6HBWXN","https://images-na.ssl-images-amazon.com/images/I/71HqDaxr1gL._AC_UL300_SR300,200_.jpg","false","false","1","2026-02-01T21:12:23.961Z"
"B0DPD6X5F2","Ozone Generator 320,000mg/h, Ozone Machine Odor Removal Ozone Odor Eliminator Ozonator Air Ionizer Deodorizer for Home/Car/Smoke/Pet Odor","$69.99","4.6","263","","Home & Kitchen","110052","Home Air Ionizers","47","","","2","1","FBA","$28,071.69","420","https://www.amazon.com/dp/B0DPD6X5F2","https://images-na.ssl-images-amazon.com/images/I/61-vxs2r0qL._AC_UL300_SR300,200_.jpg","false","false","1","2026-02-01T21:12:23.962Z"
"B087M81KXC","Perfecore Water Ozonator - Odor Eliminator and Fresh Water Machine w/Diffuser Stones and Timer - For Home, Kitchen, Fruits & Vegetables - 600 mg/Hour","$16.98","4.4","208","","Home & Kitchen","114595","Home Air Ionizers","48","Kitchen Small Appliances","3034","1","2","FBA","$5,400.76","355","https://www.amazon.com/dp/B087M81KXC","https://images-na.ssl-images-amazon.com/images/I/418yUoigpMS._AC_UL300_SR300,200_.jpg","false","false","1","2026-02-01T21:12:23.964Z"
"B07D8MC68M","Airthereal MA10K-PRO Ozone Generator - High Capacity O3 Machine for Areas of 3500+ Square Feet, Home Ionizer Odor Remover, Yellow","$79.99","4.6","5263","","Home & Kitchen","115182","Home Air Ionizers","49","","","3","2","FBA","$42,975.48","337","https://www.amazon.com/dp/B07D8MC68M","https://images-na.ssl-images-amazon.com/images/I/71X6hKAx-kL._AC_UL300_SR300,200_.jpg","false","false","1","2026-02-01T21:12:23.965Z"
"B0FNNHV9DY","Ozone Generator & Ozone Odor Eliminator 60,000mg/h, Industrial & Home Ozone Machine with Temp/Humidity Display, Removing Odors for Rooms, Smoke, Cars, Pets, Basements, Farms(Green)","$49.99","4.6","50","","Home & Kitchen","123189","Home Air Ionizers","50","","","1","1","FBA","$11,327.35","231","https://www.amazon.com/dp/B0FNNHV9DY","https://images-na.ssl-images-amazon.com/images/I/61CIgbtaDCL._AC_UL300_SR300,200_.jpg","false","false","1","2026-02-01T21:12:23.966Z"
"B08YDCZVDD","Airthereal AH1000 Portable Ozone Machine for Water and Air - 1000 mg/h, Multipurpose Liquid Ozonator with Negative Ion and Timer","$54.00","4.5","476","","Home & Kitchen","124608","Home Air Ionizers","51","","","1","1","FBA","$13,772.40","197","https://www.amazon.com/dp/B08YDCZVDD","https://images-na.ssl-images-amazon.com/images/I/61LDLdM-qXL._AC_UL600_SR600,400_.jpg","false","false","1","2026-02-01T21:13:54.942Z"
"B0FDLD7PR1","120,000mg/h 0zone Generator High Capacity Ozone Machine & 1 Billion Negative Ion Air Purifier for Home, Car, Pet Odor Removal, O3 Odor Eliminator up to 8,000 Sq. Ft.(Blue)","$69.99","4.7","212","","Home & Kitchen","131468","Home Air Ionizers","52","","","4","1","FBA","$33,664.66","516","https://www.amazon.com/dp/B0FDLD7PR1","https://images-na.ssl-images-amazon.com/images/I/611cOrduOkL._AC_UL600_SR600,400_.jpg","false","false","1","2026-02-01T21:13:54.943Z"
"B0FHHXW5B4","Plug In Air purifier for Home,Negative Ion Air Ionizers Quiet Air Freshener for Bedroom,Office,Kitchen,Mini Portable Ionizer Air Purifiers for Small Space(4)","$29.99","5.0","12","","Home & Kitchen","134410","Home Air Ionizers","53","","","4","1","FBA","$6,588.63","220","https://www.amazon.com/dp/B0FHHXW5B4","https://images-na.ssl-images-amazon.com/images/I/61MZMnBYaeL._AC_UL600_SR600,400_.jpg","false","false","1","2026-02-01T21:13:54.943Z"
