asin,title,price,rating,reviews,countryOfOrigin,category1,bsr1,category2,bsr2,category3,bsr3,variations,sellers,fulfillment,revenue30d,unitSales30d,url,image,isPrime,isSponsored,pageNum,scrapedAt
"B0F992VKNG","JOY ANAN Baby Bath Rinse Cup with Suctions, 100% Food Grade Silicone, Rinser to Wash Hair and Body with Easy Grip Handle","$9.99","4.3","48","","Baby","6852","Kids' Bathroom Safety Products","58","","","3","1","FBA","$6,306.93","636","https://www.amazon.com/dp/B0F992VKNG","https://images-na.ssl-images-amazon.com/images/I/51fln9idTrL._AC_UL600_SR600,400_.jpg","false","false","1","2026-02-04T06:17:44.491Z"
"B01MQZAUHZ","Munchkin® Beak™ Bath Spout Cover Safety Guard with Built-in bubble bath dispenser, Yellow","$11.33","4.4","7851","","Baby","6868","Kids' Bathroom Safety Products","59","","","3","1","AMZ","$9,584.85","863","https://www.amazon.com/dp/B01MQZAUHZ","https://images-na.ssl-images-amazon.com/images/I/41hV9OgpfHL._AC_UL600_SR600,400_.jpg","false","false","1","2026-02-04T06:17:44.491Z"
"B071GRCP82","Shuiniba Baby Shower Bathing Cap Soft Shower Cap Hat Wash Hair Shield for Children Kids (Blue)","$5.90","3.5","2126","","Baby","6988","Kids' Bathroom Safety Products","60","","","3","1","FBA","$2,399.78","404","https://www.amazon.com/dp/B071GRCP82","https://images-na.ssl-images-amazon.com/images/I/51njHHWVySS._AC_UL600_SR600,400_.jpg","false","false","1","2026-02-04T06:17:44.492Z"
"B07M8N5T6P","Shampoo Buddy Portable Hair Wash Basin for Children, Toddlers, Kids, Teens | Portable Shampoo Bowl for use on Bathtub or Sink (Grey)","$44.50","4.4","4456","","Baby","7476","Bedside Shampoo Basins & Trays","3","Kids' Bathroom Safety Products","61","3","1","FBA","$65,964.17","1,485","https://www.amazon.com/dp/B07M8N5T6P","https://images-na.ssl-images-amazon.com/images/I/6151o1Qlk4L._AC_UL600_SR600,400_.jpg","false","false","1","2026-02-04T06:17:44.493Z"
"B0FH1XQLV6","Skyroku Duck-Tastic Faucet Extender for Toddlers – Kicking Legs Fun! Splash-Proof & Easy Install Sink Extender for Kids","$9.99","3.9","37","","Baby","7534","Kids' Bathroom Safety Products","62","","","3","1","FBA","$5,525.37","369","https://www.amazon.com/dp/B0FH1XQLV6","https://images-na.ssl-images-amazon.com/images/I/71jKoRRArcL._AC_UL600_SR600,400_.jpg","false","false","1","2026-02-04T06:17:44.494Z"
"B0F3XNZ3LY","Toddler Potty Training Set – Potty Training Watch with Musical/Vibration Alerts, Fun Board Book, Progress Chart & Reward Stickers – Interactive Toilet Learning Kit for Boys and Girls Ages 2-6","$22.99","4.1","163","","Baby","5277","Kids' Bathroom Safety Products","63","","","9","1","FBA","$18,336.41","798","https://www.amazon.com/dp/B0F3XNZ3LY","https://images-na.ssl-images-amazon.com/images/I/717+U+9DkQL._AC_UL600_SR600,400_.jpg","false","false","1","2026-02-04T06:17:44.495Z"
"B0D7CG7GPB","Baby Shower Cap Shield, Baby bath set shower cap, Visor Hat for Eye and Ear Protection for 0-9 Years Old Children,Cute Crown Shape Makes the Baby Bath More Fun (Pink)","$8.98","4.1","69","","Baby","7605","Kids' Bathroom Safety Products","64","","","4","1","FBA","$3,369.07","388","https://www.amazon.com/dp/B0D7CG7GPB","https://images-na.ssl-images-amazon.com/images/I/61enACBdhBL._AC_UL600_SR600,400_.jpg","false","false","1","2026-02-04T06:17:44.496Z"
"B0F91K9C9Z","mandoo Baby Bath Rinse Cup - Food Grade Silicone - Shampoo & Body Washing Rinser Cup for Kids with Easy Grip Handle to Rinse Baby Shampoo and Soap - Baby Essentials (Pink+Brush)","$9.99","4.7","274","","Baby","7678","Kids' Bathroom Safety Products","65","","","11","1","FBA","$5,110.47","507","https://www.amazon.com/dp/B0F91K9C9Z","https://images-na.ssl-images-amazon.com/images/I/512ZQT5mujL._AC_UL600_SR600,400_.jpg","false","false","1","2026-02-04T06:17:44.497Z"
"B0D2ZX6VL9","saicheek 60-Pack Upgarde Silicon-Gel Material Easy to Take Off Baby Ear Covers with Cotton Ball,Baby Shower Cap Ear Protection for Kids,Water-proof Ear Stickers for Bath Swimming (60Pcs)","$9.98","4.1","221","","Baby","7750","Kids' Bathroom Safety Products","66","","","2","1","FBA","$5,815.96","558","https://www.amazon.com/dp/B0D2ZX6VL9","https://images-na.ssl-images-amazon.com/images/I/71oAGvLs8fL._AC_UL600_SR600,400_.jpg","false","false","1","2026-02-04T06:17:44.498Z"
"B083XN4NB8","Ubbi Bathtub Drain Cover, Silicone Drain Stopper with Suction, Baby Bath Time Accessory, Gray","$5.99","4.4","3377","","Baby","7939","Kids' Bathroom Safety Products","67","","","4","2","AMZ","$3,160.75","468","https://www.amazon.com/dp/B083XN4NB8","https://images-na.ssl-images-amazon.com/images/I/61trmV2QqJL._AC_UL600_SR600,400_.jpg","false","false","1","2026-02-04T06:17:44.499Z"
"B0CYPT79SP","Baby Bath Rinse Cup, Bath Cup for rinsing Hair,The Silicone Material is Soft and Safe, a Good Choice for Baby Bath Products(Cat Beige)","$9.95","4.8","62","","Baby","8156","Kids' Bathroom Safety Products","68","","","4","1","FBA","$4,573.03","459","https://www.amazon.com/dp/B0CYPT79SP","https://images-na.ssl-images-amazon.com/images/I/614hgcRp9-L._AC_UL600_SR600,400_.jpg","false","false","1","2026-02-04T06:17:44.500Z"
"B0FDJLS4DS","Baby Proof Toilet Lock (2-Pack) - Child Safety Cabinet Locks for Toilet Seat, Drawers, Fridge, Doors | Easy Install with Strong 3M Adhesive | Non-Toxic & Adjustable Strap for Toddler & Pet Safety","$6.99","3.7","42","","Baby","8288","Kids' Bathroom Safety Products","69","","","2","1","FBA","$2,835.63","387","https://www.amazon.com/dp/B0FDJLS4DS","https://images-na.ssl-images-amazon.com/images/I/61bZTJMP8ZL._AC_UL600_SR600,400_.jpg","false","false","1","2026-02-04T06:17:44.501Z"
"B0FCRHZQCD","Baby Shower Cap Shield - Adjustable Waterproof Shower Visor for Kids, Soft Baby Hair Washing Shield with Ear Protection, Perfect for Toddlers & Children (Excavator)","$7.99","3.9","46","","Baby","8582","Kids' Bathroom Safety Products","70","","","3","1","FBA","$3,224.98","403","https://www.amazon.com/dp/B0FCRHZQCD","https://images-na.ssl-images-amazon.com/images/I/71ToA4xb-XL._AC_UL600_SR600,400_.jpg","false","false","1","2026-02-04T06:17:44.502Z"
"B0D2RCYRV3","DLUCKY Faucet Extender for Sink Easy Use Sink Faucet Extenders with Temperature Sensitive for Toddlers, Kids Hand Washing Faucet Extension for Bathroom Sink, Kitchen, Brown","$8.99","4.4","301","","Baby","8678","Kids' Bathroom Safety Products","71","","","4","1","FBA","$4,492.47","470","https://www.amazon.com/dp/B0D2RCYRV3","https://images-na.ssl-images-amazon.com/images/I/51XEIf7eM5L._AC_UL600_SR600,400_.jpg","false","false","1","2026-02-04T06:17:44.503Z"
"B0FL4V8G4M","2inch XL Baby Bath Kneeler and Elbow Rest Pad Set + Hooded Towel - Embroidered Kneeling Pad for Bathing Baby - Dual-Layer Memory Foam Bathtub Kneeler and Elbow Rest Set","$42.99","4.8","32","","Baby","8816","Kids' Bathroom Safety Products","72","","","2","1","FBA","$14,050.97","331","https://www.amazon.com/dp/B0FL4V8G4M","https://images-na.ssl-images-amazon.com/images/I/71zdoQTbZHL._AC_UL600_SR600,400_.jpg","false","false","1","2026-02-04T06:17:44.504Z"
"B0DFPW5J3R","BALAPET Hair Washing Station for Kids,Shampoo Foam Mat for Children Ergonomic Comfortable Support Hair Washing Mat on Sink Portable Foldable Shampoo Buddy Basin Essentials, Patent Pending (Purple)","$39.99","4.4","148","","Baby","9020","Kids' Bathroom Safety Products","73","","","4","1","FBA","$16,693.25","417","https://www.amazon.com/dp/B0DFPW5J3R","https://images-na.ssl-images-amazon.com/images/I/71MEn78lLsL._AC_UL600_SR600,400_.jpg","false","false","1","2026-02-04T06:17:44.505Z"
"B089LPX8T7","Rinse Shampoo Rinser Baby Rinse Cup Baby Bath Rinser Wash Hair Cup by Protecting Infant Eyes (Pink)","$9.77","4.2","298","","Baby","9206","Kids' Bathroom Safety Products","74","","","2","1","FBA","$3,008.28","308","https://www.amazon.com/dp/B089LPX8T7","https://images-na.ssl-images-amazon.com/images/I/619x9JErSuL._AC_UL600_SR600,400_.jpg","false","false","1","2026-02-04T06:17:44.506Z"
"B0CP129HSQ","Faucet Extender for Toddlers - Sink Extender for Kids Hand Washing, Bathroom Sink Spout Wash Helper for Children Baby Bathroom Safety Sink Extender for Kids, Faucet Extender for Kids","$3.00","3.9","116","","Baby","9392","Kids' Bathroom Safety Products","75","","","1","11","FBA","$840.63","264","https://www.amazon.com/dp/B0CP129HSQ","https://images-na.ssl-images-amazon.com/images/I/61mIjQP0iHL._AC_UL600_SR600,400_.jpg","false","false","1","2026-02-04T06:17:44.507Z"
"B07XB5XKSQ","Bath Kneeler and Elbow Rest Pad Set for Baby Bathtub, Thick Non-Slip Bathing Kneeling Mat Cushion Quick Drying Bathtub Knee Saver with Arm Support and Pockets for Bathroom Bathing time Comfort, Gray","$28.49","4.7","1758","","Baby","9461","Kids' Bathroom Safety Products","76","","","4","1","FBA","$12,147.62","396","https://www.amazon.com/dp/B07XB5XKSQ","https://images-na.ssl-images-amazon.com/images/I/61GLr9TWSkL._AC_UL600_SR600,400_.jpg","false","false","1","2026-02-04T06:17:44.508Z"
"B0BFDJTV2V","TOFOAN Baby Bath Pad for Infants & Newborns — Soft Petal Shape Bathtub & Sink Support Mat, Plush Washable Baby Bath Cushion, Safe & Comfortable Shower Essential Gift (31"", Pink)","$20.94","4.6","442","","Baby","6167","Baby Bath Seats","18","Kids' Bathroom Safety Products","77","3","1","FBA","$13,690.11","676","https://www.amazon.com/dp/B0BFDJTV2V","https://images-na.ssl-images-amazon.com/images/I/41X96IvxVlL._AC_UL600_SR600,400_.jpg","false","false","1","2026-02-04T06:17:44.510Z"
"B074BRBJTD","Soft Infant Bath Sponge Skid Proof Baby Bath Mat Newborn Odor Free (Pink)","$8.98","4.5","2784","","Baby","9905","Kids' Bathroom Safety Products","78","","","2","1","FBA","$2,927.14","306","https://www.amazon.com/dp/B074BRBJTD","https://images-na.ssl-images-amazon.com/images/I/61We0BY2meL._AC_UL600_SR600,400_.jpg","false","false","1","2026-02-04T06:17:44.511Z"
"B0CM2SRZMG","OS OMYSTYLE Baby Bath Kneeler and Elbow Rest Pad Set, 1.5'' Thick Quickly Dry Bathtub Kneeler Pad with Baby Toys & Bath Accessories Organizer, Kneeling and Elbow for Tub, Non-Slip Mat(Grey)","$21.84","4.4","169","","Baby","9918","Kids' Bathroom Safety Products","79","","","4","1","FBA","$6,599.34","222","https://www.amazon.com/dp/B0CM2SRZMG","https://images-na.ssl-images-amazon.com/images/I/81SeCSKFAwL._AC_UL600_SR600,400_.jpg","false","false","1","2026-02-04T06:17:44.512Z"
"B0DJCDK241","Rinzee® Baby Bath Cup with Suctions - BPA Free, 100% Food Grade Silicone Rinse Cup, Clutter-Free Tub Area, Kids Learning Tool, Sticks to Tiles, Drains Water Upside Down-patent pending","$15.99","4.4","84","","Baby","9925","Kids' Bathroom Safety Products","80","","","3","1","FBA","$3,149.16","197","https://www.amazon.com/dp/B0DJCDK241","https://images-na.ssl-images-amazon.com/images/I/51SkYwFWDUL._AC_UL600_SR600,400_.jpg","false","false","1","2026-02-04T06:17:44.513Z"
"B0D6CX7WDV","Spidey and His Amazing Friends Potty Storage Hook","$6.99","4.7","49","","Baby","10191","Kids' Bathroom Safety Products","81","","","1","1","AMZ","$2,131.51","305","https://www.amazon.com/dp/B0D6CX7WDV","https://images-na.ssl-images-amazon.com/images/I/619ktGvfp9L._AC_UL300_SR300,200_.jpg","false","false","1","2026-02-04T06:17:44.514Z"
"B0D954644J","LILEKA Baby Bath Kneeler and Elbow Rest Pad Set - Non-Slip Quick Dry Bath Kneeling Pad and Bath Elbow Rest Pad with Pockets for Baby Bath Essentials","$32.99","4.7","102","","Baby","10443","Kids' Bathroom Safety Products","82","","","1","1","FBA","$9,768.86","296","https://www.amazon.com/dp/B0D954644J","https://images-na.ssl-images-amazon.com/images/I/71l5HeDs8eL._AC_UL300_SR300,200_.jpg","false","false","1","2026-02-04T06:17:44.515Z"
"B08BQZYQLG","BONPEIPEI Baby Shower Shampoo Cap 2Pcs Adjustable Safety Eva Bath Visor Waterproof Soft Hair Washing Guard Accessories Bathing Hat for Girls, Boys, Infants, Kids and Toddlers-pink/green","$9.99","3.8","1323","","Baby","10462","Kids' Bathroom Safety Products","83","","","3","1","FBA","$2,358.41","236","https://www.amazon.com/dp/B08BQZYQLG","https://images-na.ssl-images-amazon.com/images/I/61QNE7LA3wL._AC_UL300_SR300,200_.jpg","false","false","1","2026-02-04T06:17:44.517Z"
"B0B1MFNB8Z","XPECIAL Faucet Extender for Toddlers and Kids, fits Sink spout tub for Kitchen and Bathroom. Promotes Hand Washing, Hygiene Awareness Independence. Cartoon Design w/Universal fits(Blue, Pink, 2PCS)","$9.99","4.5","501","","Baby","10477","Kids' Bathroom Safety Products","84","","","3","1","FBA","$3,827.95","328","https://www.amazon.com/dp/B0B1MFNB8Z","https://images-na.ssl-images-amazon.com/images/I/51+lfsh7X2L._AC_UL300_SR300,200_.jpg","false","false","1","2026-02-04T06:17:44.518Z"
"B07VH6PLTV","Bath Kneeler, Baby Bath Kneeler and Elbow Rest Pad Set, Kneeling Pad for Bathing Baby, Knee Pads for Bathing Babies (Gray, X-Large (22 Inches × 15 Inches))","$44.45","4.7","263","","Baby","10608","Kids' Bathroom Safety Products","85","","","4","2","FBA","$10,197.50","238","https://www.amazon.com/dp/B07VH6PLTV","https://images-na.ssl-images-amazon.com/images/I/814YlHeVlyL._AC_UL300_SR300,200_.jpg","false","false","1","2026-02-04T06:17:44.519Z"
"B0CL43Q1TF","PandaEar Baby Bath Rinse Cup, Silicone Baby Shampoo Rinser with 2 Pack Cradle Cap Brush for Kids Toddler Body Washing (Pink)","$9.95","4.7","463","","Baby","10647","Kids' Bathroom Safety Products","86","","","2","1","FBA","$3,043.65","306","https://www.amazon.com/dp/B0CL43Q1TF","https://images-na.ssl-images-amazon.com/images/I/61Z1ycCEvkL._AC_UL300_SR300,200_.jpg","false","false","1","2026-02-04T06:17:44.520Z"
"B07WCGKBW1","Baby Shower Cap Silicone Bathing Hat, Adjustable Shower Cap Kids, Infants Soft Protection Hat Safety Visor Cap Hat for Toddler Children 1-12 Years old/16.5-22.8 Inches","$9.98","3.8","5773","","Baby","10947","Kids' Bathroom Safety Products","87","","","3","1","FBA","$3,731.13","374","https://www.amazon.com/dp/B07WCGKBW1","https://images-na.ssl-images-amazon.com/images/I/61TfZc5bCsL._AC_UL300_SR300,200_.jpg","false","false","1","2026-02-04T06:17:44.522Z"
"B004X8K1R2","Shampoo Rinse Cup for Kids | Baby Bath Pail | Tear Free Baby Rinser Pail - Three Color Choices","$8.50","4.6","1485","","Baby","10993","Kids' Bathroom Safety Products","88","","","3","1","FBA","$2,223.67","262","https://www.amazon.com/dp/B004X8K1R2","https://images-na.ssl-images-amazon.com/images/I/71al-NwZU1L._AC_UL300_SR300,200_.jpg","false","false","1","2026-02-04T06:17:44.523Z"
"B0DFCFNY56","IFNOW Baby Bath Kneeler and Elbow Rest Pad Set - 26'' Extra Long and 2.4'' Thick, Quick Dry Kneeling Pad for Bathing Baby with Knee & Arm Support, Foldable Non-Slip Bathtub Mat with Toys Organizer","$29.99","4.6","158","","Baby","11101","Kids' Bathroom Safety Products","89","","","2","1","FBA","$7,239.09","227","https://www.amazon.com/dp/B0DFCFNY56","https://images-na.ssl-images-amazon.com/images/I/71qqXwodAwL._AC_UL300_SR300,200_.jpg","false","false","1","2026-02-04T06:17:44.524Z"
"B0BX4DVJT2","Bath Helper - Bath Tub Faucet Extender - Guides Water Directly from Faucet to Baby Bath Tub Without Excessive Water Waste and Splashing (Blue)","$9.99","3.9","104","","Baby","11159","Kids' Bathroom Safety Products","90","","","3","1","FBA","$2,883.32","289","https://www.amazon.com/dp/B0BX4DVJT2","https://images-na.ssl-images-amazon.com/images/I/51DXe1tGNcL._AC_UL300_SR300,200_.jpg","false","false","1","2026-02-04T06:17:44.526Z"
"B072XRFJPW","Yonisun Faucet Cover, Leaf Design Safety Faucet Extender for Children Toddler Kids Hand Washing Baby Kids Hand Wash Helper Bathroom Sink(2PCS/Pack)","$6.99","4.5","6938","","Baby","11165","Kids' Bathroom Safety Products","91","","","1","1","FBA","$2,606.48","373","https://www.amazon.com/dp/B072XRFJPW","https://images-na.ssl-images-amazon.com/images/I/515AH0uE+fL._AC_UL300_SR300,200_.jpg","false","false","1","2026-02-04T06:17:44.527Z"
"B09TRQPCP4","Bath Spout Cover, Faucet Cover Baby Protector Bath Tub Faucet Cover Protector for Kids, Silicone Bathtub Spout Cover for Baby Kids Toddlers Safety Protection Accessories","$8.99","4.7","763","","Baby","11220","Kids' Bathroom Safety Products","92","","","4","1","FBA","$1,334.51","140","https://www.amazon.com/dp/B09TRQPCP4","https://images-na.ssl-images-amazon.com/images/I/51aTa1wr3DL._AC_UL300_SR300,200_.jpg","false","false","1","2026-02-04T06:17:44.528Z"
"B071VK7N2L","Safety 1st OutSmart Toilet Lock, White, 1 Count (Pack of 1)","$6.96","3.7","2645","","Baby","11279","Kids' Bathroom Safety Products","93","","","2","11","AMZ","$3,244.44","321","https://www.amazon.com/dp/B071VK7N2L","https://images-na.ssl-images-amazon.com/images/I/71KdvBWnq+L._AC_UL300_SR300,200_.jpg","false","false","1","2026-02-04T06:17:44.530Z"
"B0CJ945Y3B","Baby Shower Cap Shield, Baby bath set shower cap/water cup/massage brush,Visor Hat for Eye and Ear Protection for 0-9 Years Old Children,Cute Crown Shape Makes the Baby Bath More Fun (Pink)","$16.99","3.9","152","","Baby","11312","Kids' Bathroom Safety Products","94","","","3","1","FBA","$4,591.47","285","https://www.amazon.com/dp/B0CJ945Y3B","https://images-na.ssl-images-amazon.com/images/I/511KnY6yn-L._AC_UL300_SR300,200_.jpg","false","false","1","2026-02-04T06:17:44.531Z"
"B0F8V6N9MP","Wibeelee Hair Washing Station for Kids Waterproof Shampoo Foam Mat with Ergonomic Design Non Slip Bath Pillow Sink Soft Neck Support for Easy Hair Wash","$21.99","4.4","41","","Baby","11410","Kids' Bathroom Safety Products","95","","","1","1","FBA","$5,315.68","234","https://www.amazon.com/dp/B0F8V6N9MP","https://images-na.ssl-images-amazon.com/images/I/61H3F6lB8oL._AC_UL300_SR300,200_.jpg","false","false","1","2026-02-04T06:17:44.532Z"
"B0FS2KKM5G","ACGROW Bath Kneeler and Elbow Rest Pad Set - Comfortable 1.5” Thick Baby Bath Kneeler Pads with Toys Organizer, Non-Slip Knee Arm Support Bathtub Mat, Quick-Drying Kneeling Pad for Baby Bath Time","$34.99","4.6","38","","Baby","11483","Kids' Bathroom Safety Products","96","","","4","1","FBA","$10,491.59","308","https://www.amazon.com/dp/B0FS2KKM5G","https://images-na.ssl-images-amazon.com/images/I/81SDgNH0n4L._AC_UL300_SR300,200_.jpg","false","false","1","2026-02-04T06:17:44.534Z"
"B0D6XW45VS","PandaEar Baby Bath Sponge Infant Soft Bath Sponge Mat, Baby Bath Mat Newborn Odor Free Bath Cushion, Blue (Blue)","$6.95","4.2","127","","Baby","11497","Kids' Bathroom Safety Products","97","","","2","1","FBA","$1,970.30","284","https://www.amazon.com/dp/B0D6XW45VS","https://images-na.ssl-images-amazon.com/images/I/714S35Ky24L._AC_UL300_SR300,200_.jpg","false","false","1","2026-02-04T06:17:44.535Z"
"B0F8J54VH3","Bath Faucet Cover for Kids，Bath Spout Cover for Baby are Suitable for Most Bathtub Faucet,spout Cover Bathroom Tub Adds Fun to Your Baby in The Shower.（Beige+Brush）","$8.65","4.6","1104","","Baby","11729","Kids' Bathroom Safety Products","98","","","4","1","FBA","$3,220.51","372","https://www.amazon.com/dp/B0F8J54VH3","https://images-na.ssl-images-amazon.com/images/I/51ZTYWZocwL._AC_UL300_SR300,200_.jpg","false","false","1","2026-02-04T06:17:44.537Z"
"B0DHXBV5TL","Simply Parents Comfortable Baby Bath Kneeler and Elbow Rest Pad Set - Quick-Dry Non-Slip Bath Kneeling Pad for Bathing Baby, Baby Bath Time Essentials for Newborn, Baby Bath Accessories for Tub","$35.99","4.8","124","","Baby","11785","Kids' Bathroom Safety Products","99","","","3","1","FBA","$8,975.01","251","https://www.amazon.com/dp/B0DHXBV5TL","https://images-na.ssl-images-amazon.com/images/I/718Ll2luZrL._AC_UL300_SR300,200_.jpg","false","false","1","2026-02-04T06:17:44.538Z"
"B0FKMWLBHC","Baby Shower Stand, Adjustable & Foldable Baby Bath Stand with Anti-Slip Base,Anti-Pinch Silicone,Baby Shower Standing Support (6-36 Months),Portable Toddler Shower Stand| Soporte para Bañera de Bebé","$39.98","4.8","38","","Baby","12054","Kids' Bathroom Safety Products","100","","","3","1","FBA","$4,601.70","110","https://www.amazon.com/dp/B0FKMWLBHC","https://images-na.ssl-images-amazon.com/images/I/61OcuxDe84L._AC_UL300_SR300,200_.jpg","false","false","1","2026-02-04T06:17:44.540Z"